1775584638-12,https://www.tripadvisor.es/Restaurant_Review-g187514-d11896546-Reviews-Astor-Madrid.html,Magia,Pat Z,"Un gran lugar para disfrutar con la familia y pareja , cenamos ceviche frito y costillar fue una auténtica delicia. 
Sin duda volveremos por la comida y su hospitalidad.",1 contribución,Escrita el 13 de enero de 2026,Muchísimas gracias por la visita y por tan amables palabras! Habiendo tantísimos y excelentes restaurantes por la zona nos enorgullece sobremanera que nos hayáis elegido. Ojalá volváis prontito. Mil gracias!,1 contribución,Escrita el 13 de enero de 2026,1,"Esta es la opinión subjetiva de un miembro de Tripadvisor, no de Tripadvisor LLC. Tripadvisor realiza comprobaciones de las opiniones.",restauranteastor,,,,,,,,,"Esta respuesta es la opinión subjetiva del representante de la dirección, no de Tripadvisor LLC.",Leer más,Leer más,0,,,,https://dynamic-media-cdn.tripadvisor.com/media/photo-o/1a/f6/df/2b/default-avatar-2020-39.jpg?w=100&h=-1&s=1,https://dynamic-media-cdn.tripadvisor.com/media/photo-o/0d/fa/aa/65/avatar.jpg?w=100&h=-1&s=1,,
1775584638-13,https://www.tripadvisor.es/Restaurant_Review-g187514-d11896546-Reviews-Astor-Madrid.html,Nunca defrauda. Acierto seguro.,laura,"Ástor nunca defrauda. Voy allí desde que abrieron y mantienen la calidad y la atención, incluso te recuerdan y te tratan con gran educación y amabilidad. La comida, fantástica. Esta vez decidí probar la hamburguesa de buey con huevo curado en soja y mirin y lo acompañamos con un poco de vino de Jerez. Me comentaron que tenían opción de pan sin gluten, cosa que se agradece mucho.
Muy recomendable.",5 contribuciones,Escrita el 12 de enero de 2026,Mil Gracias por venir y mil gracias por volver! Cada vez que venís para nosotr@s es una fiesta! Con personas como vosotr@s los servicios se transforman en alegres y bonitos. ÁSTOR es vuestra casa! Ya l@s estamos esperando con una copa preparada para brindar! Salú y millones de gracias!,"Madrid, España",Escrita el 13 de enero de 2026,5,Tienen opción sin gluten,restauranteastor,,Calidad/precio,Ambiente,Servicio,Comida,,,,"Esta respuesta es la opinión subjetiva del representante de la dirección, no de Tripadvisor LLC.",Leer más,Leer más,0,,,https://dynamic-media-cdn.tripadvisor.com/media/photo-o/32/31/ae/01/caption.jpg?w=300&h=300&s=1,https://dynamic-media-cdn.tripadvisor.com/media/photo-o/1a/f6/de/e7/default-avatar-2020-37.jpg?w=100&h=-1&s=1,https://dynamic-media-cdn.tripadvisor.com/media/photo-o/0d/fa/aa/65/avatar.jpg?w=100&h=-1&s=1,,
1775584638-14,https://www.tripadvisor.es/Restaurant_Review-g187514-d11896546-Reviews-Astor-Madrid.html,Un sitio para no cansarse de repetir!!,Enrique,"Muchas veces quiero mudarme a Madrid para tener este sitio cerca! Estivo todo excelente, la atención, las recomendaciones, el vino, la comida!!! Excelente!! Muchas gracias porque se ve que aman lo que hacen!!!",46 contribuciones,Escrita el 12 de enero de 2026,"Muchísimas gracias, primero por la visita (ya van unas cuantas y agradecemos todas y cada una de ellas), y luego, por tan cálidas y afectuosas palabras! Con personas como vosotr@s nuestro trabajo se vuelve más sencillo y placentero. ÁSTOR es vuestra casa y lo sabéis. Millones de gracias y ojalá seamos vecin@s;)",46 contribuciones,Escrita el 13 de enero de 2026,46,Un sitio de 10 para sorprender a tu pareja o a quien quieras impresionar. En el corazón de La Latina y un ambiente encantador!,restauranteastor,,Calidad/precio,Ambiente,Servicio,Comida,,,,"Esta respuesta es la opinión subjetiva del representante de la dirección, no de Tripadvisor LLC.",Leer más,Leer más,0,,,https://dynamic-media-cdn.tripadvisor.com/media/photo-o/32/31/6b/84/caption.jpg?w=300&h=300&s=1,https://dynamic-media-cdn.tripadvisor.com/media/photo-o/18/bf/a8/ee/enriquehgr.jpg?w=100&h=-1&s=1,https://dynamic-media-cdn.tripadvisor.com/media/photo-o/0d/fa/aa/65/avatar.jpg?w=100&h=-1&s=1,,
1775584638-15,https://www.tripadvisor.es/Restaurant_Review-g187514-d11896546-Reviews-Astor-Madrid.html,Maravillosa cocina y ambiente.,Juan Carlos L,Maravillosos Mejillones con curry y coco y fantásticas Mollejas a la parrilla con piparras!🙌🙌👌👌😍😍 Repetiré la próxima vez que esté por La Latina.,6 contribuciones,Escrita el 12 de enero de 2026,Muchísimas gracias por la visita y por tan cálidas palabras! Estaremos encantad@s y con una copa preparada para cuando gustéis volver. ÁSTOR es vuestra casa;) millones de gracias!,6 contribuciones,Escrita el 13 de enero de 2026,6,,restauranteastor,,Calidad/precio,Ambiente,Servicio,Comida,,,"Esta es la opinión subjetiva de un miembro de Tripadvisor, no de Tripadvisor LLC. Tripadvisor realiza comprobaciones de las opiniones.","Esta respuesta es la opinión subjetiva del representante de la dirección, no de Tripadvisor LLC.",Leer más,Leer más,0,,,https://dynamic-media-cdn.tripadvisor.com/media/photo-o/32/30/be/71/caption.jpg?w=300&h=300&s=1,https://dynamic-media-cdn.tripadvisor.com/media/photo-o/1a/f6/f4/5d/default-avatar-2020-32.jpg?w=100&h=-1&s=1,https://dynamic-media-cdn.tripadvisor.com/media/photo-o/0d/fa/aa/65/avatar.jpg?w=100&h=-1&s=1,,
1775584673-1,https://www.tripadvisor.es/Restaurant_Review-g187514-d11896546-Reviews-Astor-Madrid.html,Vale la pena las críticas increíbles - realmente encantador,HollersB,"Gran ambiente. Nuestra camarera, Lydia, era casi tan bueno en su trabajo como es posible ser - encantador y tan servicial. La comida era deliciosa - en general
una gran noche!","Thank you so much for choosing us, with so many excellent restaurants in the area! Thank you for your kind words. It was a true honor and a genuine pleasure to have you. We will pass on your regards to Lidia. Astor is your home! Thank you so much!",87 contribuciones,87,Escrita el 12 de diciembre de 2025,Escrita el 13 de diciembre de 2025,England,,restauranteastor,Traducir respuesta,Mostrar original,,,,,Traducido automáticamente,"Esta respuesta es la opinión subjetiva del representante de la dirección, no de Tripadvisor LLC.",,"Esta es la opinión subjetiva de un miembro de Tripadvisor, no de Tripadvisor LLC. Tripadvisor realiza comprobaciones de las opiniones.",,Leer más,Leer más,0.0,https://dynamic-media-cdn.tripadvisor.com/media/photo-o/1a/f6/f1/42/default-avatar-2020-20.jpg?w=100&h=-1&s=1,https://dynamic-media-cdn.tripadvisor.com/media/photo-o/0d/fa/aa/65/avatar.jpg?w=100&h=-1&s=1,,,
1775584673-2,https://www.tripadvisor.es/Restaurant_Review-g187514-d11896546-Reviews-Astor-Madrid.html,Excelente experiencia gastronómica!,Jacob S,Excelente comida y servicio! ¡Mejor tomate! ¡Puedes decir que es una empresa familiar que a todos les importa profundamente lo que sirven y cómo lo sirven! Muy recomendable,"Thank you so much for your kind words, and of course, thank you for visiting! It's true, we care deeply about what we serve and how we serve it, and when we do it for people like you, the pleasure is twofold. Thank you so much!",1 contribución,1,Escrita el 21 de noviembre de 2025,Escrita el 22 de noviembre de 2025,1 contribución,,restauranteastor,Traducir respuesta,Mostrar original,Calidad/precio,Ambiente,Servicio,Comida,Traducido automáticamente,"Esta respuesta es la opinión subjetiva del representante de la dirección, no de Tripadvisor LLC.","Esta es la opinión subjetiva de un miembro de Tripadvisor, no de Tripadvisor LLC. Tripadvisor realiza comprobaciones de las opiniones.",,,Leer más,Leer más,0.0,https://dynamic-media-cdn.tripadvisor.com/media/photo-o/1a/f6/7c/01/default-avatar-2020-5.jpg?w=100&h=-1&s=1,https://dynamic-media-cdn.tripadvisor.com/media/photo-o/0d/fa/aa/65/avatar.jpg?w=100&h=-1&s=1,,,
1775584673-3,https://www.tripadvisor.es/Restaurant_Review-g187514-d11896546-Reviews-Astor-Madrid.html,Muy grata sorpresa,Mariano S,"Estuvimos con unos amigos y la experiencia fue maravillosa. Desde la entrada hasta la salida, el trato ha sido impecable y familiar. Siempre había alguien pendiente, pero sin agobiar. Pedimos 5 platos para compartir y nos cambiaron dos veces los platos y cubiertos. La comida muy buena e imaginativa. El ambiente muy acogedor y el precio totalmente razonable. Hay infinidad de sitios en Madrid, pero a éste seguro que volveremos.","Muchas Gracias! Ha sido un placer y un honor que habiendo tantos excelentes restaurantes nos hayáis elegido. Justamente intentamos eso, a saber: estar presentes pero sin agobiar, l@s protagonistas sois siempre vosotr@s! Recibe un cordial saludo de parte de todo el equipo. ÁSTOR es vuestra casa! Muchas gracias!!!",7 contribuciones,7,Escrita el 8 de noviembre de 2025,Escrita el 11 de noviembre de 2025,7 contribuciones,"Déjate aconsejar por los platos fuera de carta, acertamos de pleno",restauranteastor,,,Calidad/precio,Ambiente,Servicio,Comida,,,"Esta es la opinión subjetiva de un miembro de Tripadvisor, no de Tripadvisor LLC. Tripadvisor realiza comprobaciones de las opiniones.",,"Esta respuesta es la opinión subjetiva del representante de la dirección, no de Tripadvisor LLC.",Leer más,Leer más,0.0,https://dynamic-media-cdn.tripadvisor.com/media/photo-o/1a/f6/f0/48/default-avatar-2020-15.jpg?w=100&h=-1&s=1,https://dynamic-media-cdn.tripadvisor.com/media/photo-o/0d/fa/aa/65/avatar.jpg?w=100&h=-1&s=1,,,
1775584673-4,https://www.tripadvisor.es/Restaurant_Review-g187514-d11896546-Reviews-Astor-Madrid.html,Me encantó este lugar mucho!,Jangle289,"Hermoso ambiente, muy relajado pero con estilo, excelente servicio de Gabriela, muy servicial con consejos y hacernos sentir muy bienvenidos. Todo el mundo era amable y todo el personal de hospitalidad verdaderamente superior. 

La comida era fabulosa, disfrutamos de cada plato incluyendo las vieiras, provoleta, el pescado, las costillas, el filete. Recomiendo encarecidamente el cóctel Astorita también. 

Sin duda volveremos de nuevo y lo recomendaría a todos nuestros amigos",Thank you so much for your kind words! We strive to provide you with the best possible service. We will pass on your kind words to Gabriela. It has been an honor and a pleasure to have you at Ástor (your home in Madrid!). We hope to see you again soon! Enjoy Madrid!,79 contribuciones,79,Escrita el 1 de noviembre de 2025,Escrita el 2 de noviembre de 2025,"Londres, Reino Unido",,restauranteastor,Traducir respuesta,Mostrar original,,,,,Traducido automáticamente,"Esta respuesta es la opinión subjetiva del representante de la dirección, no de Tripadvisor LLC.",,"Esta es la opinión subjetiva de un miembro de Tripadvisor, no de Tripadvisor LLC. Tripadvisor realiza comprobaciones de las opiniones.",,Leer más,Leer más,0.0,https://dynamic-media-cdn.tripadvisor.com/media/photo-o/1a/f6/de/e7/default-avatar-2020-37.jpg?w=100&h=-1&s=1,https://dynamic-media-cdn.tripadvisor.com/media/photo-o/0d/fa/aa/65/avatar.jpg?w=100&h=-1&s=1,,,
1775584673-5,https://www.tripadvisor.es/Restaurant_Review-g187514-d11896546-Reviews-Astor-Madrid.html,Comida maravillosa,Maria R,"Maravillosa comida, unos tomates que se saborean solo de verlos, cada platillo tiene un sabor especial y una atención increíble , amable y cordial
Altamente recomendable","Muchísimas Gracias por tan cálidas palabras (ojalá las merezcamos. Nos esforzamos para que servicio a servicio así sea). Ha sido un verdadero placer contar con vuestra presencia. Con personas como vosotr@s nuestro trabajo se hace más fácil, mucho más. Millones de Gracias! Estamos aquí para brindar cuando queráis !",1 contribución,1,Escrita el 28 de octubre de 2025,Escrita el 2 de noviembre de 2025,1 contribución,"Esta es la opinión subjetiva de un miembro de Tripadvisor, no de Tripadvisor LLC. Tripadvisor realiza comprobaciones de las opiniones.",restauranteastor,,,,,,,,,,,"Esta respuesta es la opinión subjetiva del representante de la dirección, no de Tripadvisor LLC.",Leer más,Leer más,0.0,https://dynamic-media-cdn.tripadvisor.com/media/photo-o/1a/f6/de/5a/default-avatar-2020-36.jpg?w=100&h=-1&s=1,https://dynamic-media-cdn.tripadvisor.com/media/photo-o/0d/fa/aa/65/avatar.jpg?w=100&h=-1&s=1,,,
1775584673-6,https://www.tripadvisor.es/Restaurant_Review-g187514-d11896546-Reviews-Astor-Madrid.html,¡Encantador!,SPH20617,"En primer lugar, solo fue debido a la amabilidad y comprensión del Maitre d' que pudimos cenar la noche que visitamos; un error por mi parte al reservar a través de una aplicación. 

Con gran alivio y sin ningún alboroto, nos mostraron a nuestra mesa, que daba a un hueco de la escalera y por lo tanto nos dio una vista sin obstáculos de este encantador restaurante. 

Una vez que nos instalamos, nuestros servidores nos atendieron y nos proporcionaron menús. La tarifa estaba claramente establecida y era comprensible. Para nosotros, esto fue muy útil ya que era nuestra primera visita. 

Mi mujer eligió un entrante de tomates (de Zamora, nos informaron después) que al ser probados, me aseguró, eran los más bonitos que había tenido y ha tenido la suerte de haber disfrutado de muchas variedades en multitud de destinos. Normalmente no soy un amante del tomate, pero estos fueron para mi paladar inculto, excepcional. Elegí el Hummus de Remolacha que era muy sabroso y servido con abundantes pittas frescas y crujientes. 

La principal opción de plato de mis socios fue el Lomo de pescado Croker que se presentó de una manera muy apetitosa y, estoy seguro, era ""muy sabroso de hecho"". Mi elección fue la hamburguesa Big Ox que se sirvió con una pequeña pero adecuada porción de papas fritas. La hamburguesa era grande, pero todavía manejable. Pensé que el plato estaba un poco salado, pero recordé que fui yo quien pidió el huevo opcional cocinado a fuego lento (curado en soja y mirin) encima de la hamburguesa. En cualquier caso, me gustó mucho. 

Mi sensato compañero de comedor pasó de postre pero glotón que soy, pedí la tarta de queso para. También era muy agradable y nada pesado. Un final perfecto para una comida encantadora... o eso pensé. 

Si fue porque era nuestra primera visita o no, no puedo recordar, pero inesperadamente nos ofrecieron una bebida después de la cena o ""digestivo"" como creo que se llama más al norte. Mi compañera de comedor eligió una crema Bailey's pero yo estaba indecisa. Nuestro servidor, que al igual que sus colegas, fue atento pero discreto durante la duración de nuestra comida, preguntó sobre mis gustos y brillantemente sugirió algo llamado 'PanCaliente' (de Casa Ortega). Un vaso de esta magia líquida fue servido y era exactamente lo que me gusta. 

En general, nuestra visita a Àstor fue una de las experiencias gastronómicas más agradables y memorables que hemos experimentado. De principio a fin, fuimos muy bien atendidos por nuestros anfitriones. Nos mimaron para la elección por el menú y todo lo que elegimos era muy de nuestro gusto. El equipo de Ástor -enfrente de la casa y en la cocina- obviamente saben en qué están, cómo cuidar a sus invitados, qué servir y disfrutar haciéndolo. Lamentablemente, no podemos regresar fácilmente ya que vivimos fuera de España, pero el recuerdo de nuestra última noche en Madrid, que se definió por esta maravillosa experiencia gastronómica, vivirá mucho en nuestras mentes. 

p.d. Traté de encontrar una botella de ""PanCaliente"" en el aeropuerto libre de impuestos. En mi Español, normalmente comprensible, pregunté ""¿Teneis PanCaliente? "" El caballero parecía un poco confundido al principio, pero luego me hizo señas útiles para que lo siguiera. Al ver que nos acercábamos a una encimera de pan caliente (Pan Caliente significa 'pan caliente/tortitas') expliqué que era una marca de jerez producido en Madrid. Él no había oído hablar de ella, pero no puedo creer que pasará mucho tiempo antes de que todos los amantes del jerez lo sepan.","Wow! Thank you, thank you, thank you, thank you, and thank you so much! Thank you so much for such kind words! Thank you for choosing us when there are so many excellent restaurants in the area! Thank you for taking the time to write such lovely words! We strive to do our best, and we're so proud that you enjoyed it.
It has been a true honor and a real pleasure to have you at Ástor (your home in Madrid)!
If you have any friends or acquaintances in Madrid traveling to your country, we would love to send them a bottle of ""Pan Caliente"" (Bodega Sotomanrique) as a gift through them.
Thank you so much, friends! We hope to see you again soon! A million thanks!",48 contribuciones,48,Escrita el 18 de octubre de 2025,Escrita el 19 de octubre de 2025,"Dublín, Irlanda",,restauranteastor,Traducir respuesta,Mostrar original,,,,,Traducido automáticamente,"Esta respuesta es la opinión subjetiva del representante de la dirección, no de Tripadvisor LLC.","Esta es la opinión subjetiva de un miembro de Tripadvisor, no de Tripadvisor LLC. Tripadvisor realiza comprobaciones de las opiniones.",,,Leer más,Leer más,0.0,https://dynamic-media-cdn.tripadvisor.com/media/photo-o/17/81/b5/94/sph20617.jpg?w=100&h=-1&s=1,https://dynamic-media-cdn.tripadvisor.com/media/photo-o/0d/fa/aa/65/avatar.jpg?w=100&h=-1&s=1,,,
1775584673-7,https://www.tripadvisor.es/Restaurant_Review-g187514-d11896546-Reviews-Astor-Madrid.html,Otro comentario de 5 estrellas-¿qué puedo decir?,Youneke,"Fuimos a almorzar. La comida, el personal y el ambiente eran perfectos. Teníamos el aperitivo de queso provolone - estilo Astor, el pescado croaker y el pastel de queso. Todos estaban deliciosos. Ya estamos planeando nuestra próxima aventura allí.","Thank you so much for choosing us! With so many excellent restaurants in the area, we're proud you came to Ástor (your home in Madrid)! Thank you so much for your kind words. We strive to improve every day, and our greatest motivation is when people leave happy. We hope to see you again soon! Enjoy Madrid! Thank you so much!",223 contribuciones,223,Escrita el 13 de octubre de 2025,Escrita el 13 de octubre de 2025,"Genoa, Nevada",,restauranteastor,Traducir respuesta,Mostrar original,Calidad/precio,Ambiente,Servicio,Comida,Traducido automáticamente,"Esta respuesta es la opinión subjetiva del representante de la dirección, no de Tripadvisor LLC.",,,,Leer más,Leer más,0.0,https://dynamic-media-cdn.tripadvisor.com/media/photo-o/1a/f6/e2/e6/default-avatar-2020-45.jpg?w=100&h=-1&s=1,https://dynamic-media-cdn.tripadvisor.com/media/photo-o/0d/fa/aa/65/avatar.jpg?w=100&h=-1&s=1,,,
1775584673-8,https://www.tripadvisor.es/Restaurant_Review-g187514-d11896546-Reviews-Astor-Madrid.html,Joya en el centro de la ciudad,Kayee L,Comida deliciosa! Gran vino y camarera muy atenta. La ubicación era muy céntrica y fácil de encontrar. Buena selección de comida,Thank you so much for choosing us when there are so many excellent restaurants in the area. It was a pleasure having you at Ástor (your home in Madrid)! We hope to see you soon! Enjoy Madrid!,12 contribuciones,12,Escrita el 5 de octubre de 2025,Escrita el 7 de octubre de 2025,"Croydon, Reino Unido",,restauranteastor,Traducir respuesta,Mostrar original,,,,,Traducido automáticamente,"Esta respuesta es la opinión subjetiva del representante de la dirección, no de Tripadvisor LLC.",,"Esta es la opinión subjetiva de un miembro de Tripadvisor, no de Tripadvisor LLC. Tripadvisor realiza comprobaciones de las opiniones.",,Leer más,Leer más,0.0,https://dynamic-media-cdn.tripadvisor.com/media/photo-o/1a/f6/df/2b/default-avatar-2020-39.jpg?w=100&h=-1&s=1,https://dynamic-media-cdn.tripadvisor.com/media/photo-o/0d/fa/aa/65/avatar.jpg?w=100&h=-1&s=1,,,
1775584673-9,https://www.tripadvisor.es/Restaurant_Review-g187514-d11896546-Reviews-Astor-Madrid.html,Lo súper recomiendo!,Juan B,"El lugar es muy cool y la atención súper cordial!
Probamos varios de sus platos y son exquisitos!
súper recomendable y volvería!","Muchísimas gracias por tan amables palabras, ojalá las merezcamos. Nos esforzamos para que así sea. Gracias por la visita! Fue un placer tenerl@s en Ástor (vuestra casa en Madrid). Esperamos verl@s pronto! Saluuu amigos!!!",1 contribución,1,Escrita el 24 de septiembre de 2025,Escrita el 26 de septiembre de 2025,1 contribución,"Esta es la opinión subjetiva de un miembro de Tripadvisor, no de Tripadvisor LLC. Tripadvisor realiza comprobaciones de las opiniones.",restauranteastor,,,,,,,,,,,"Esta respuesta es la opinión subjetiva del representante de la dirección, no de Tripadvisor LLC.",Leer más,Leer más,0.0,https://dynamic-media-cdn.tripadvisor.com/media/photo-o/1a/f6/e2/11/default-avatar-2020-41.jpg?w=100&h=-1&s=1,https://dynamic-media-cdn.tripadvisor.com/media/photo-o/0d/fa/aa/65/avatar.jpg?w=100&h=-1&s=1,,,
1775584673-10,https://www.tripadvisor.es/Restaurant_Review-g187514-d11896546-Reviews-Astor-Madrid.html,Perfección,Laura L,"No puedo decir suficiente sobre lo fabuloso que era este restaurante. La comida era perfecta. El personal fue eficiente, paciente y considerado con todas nuestras preguntas, necesidades y sensible a nuestras preocupaciones. Nos ayudaron a interpretar el menú cuando tuvimos preguntas sobre la interpretación Español. Estaban encantados de traer salsas a un lado como preferimos. Mi marido consiguió filete que era más raro de lo que había esperado después de solicitar medio raro, así que amablemente lo pusieron de nuevo en la parrilla y lo trajo de vuelta a su gusto. Nos sorprendieron con una pieza de cortesía del pastel de quesos más delicioso que he comido. Recomiendo encarecidamente Astor.","Thank you so much for your kind words! It was a pleasure and a true honor to have you as our guests at Ástor (your home in Madrid). With guests like you, our job becomes so much easier. We will pass on your best wishes to all the staff. We hope to see you again soon. Thank you!",5 contribuciones,5,Escrita el 20 de septiembre de 2025,Escrita el 20 de septiembre de 2025,5 contribuciones,,restauranteastor,Traducir respuesta,Mostrar original,,,,,Traducido automáticamente,"Esta respuesta es la opinión subjetiva del representante de la dirección, no de Tripadvisor LLC.",,"Esta es la opinión subjetiva de un miembro de Tripadvisor, no de Tripadvisor LLC. Tripadvisor realiza comprobaciones de las opiniones.",,Leer más,Leer más,0.0,https://dynamic-media-cdn.tripadvisor.com/media/photo-o/1a/f6/df/2b/default-avatar-2020-39.jpg?w=100&h=-1&s=1,https://dynamic-media-cdn.tripadvisor.com/media/photo-o/0d/fa/aa/65/avatar.jpg?w=100&h=-1&s=1,,,
1775584673-11,https://www.tripadvisor.es/Restaurant_Review-g187514-d11896546-Reviews-Astor-Madrid.html,Gran experiencia!,Patricio A,"Execelente lugar para comer tranquilos, muy lindo ambiente. Los platos exquisitos, y mejor aún la atención de Salvador, estuvo hasta en el mínimo detalle, recomiendo 100% el lugar, no duden en ir, gran experiencia.","Muchísimas gracias, de verdad! Le transmitiremos a Salvador vuestros recuerdos! Ha sido un placer enorme tenerlos en Ástor (vuestra casa). Ojalá estemos siempre a la altura de semejantes cálidas palabras. Prometemos que lo intentaremos siempre, servicio a servicio. Ojalá brindemos pronto! Gracias y mucha saluuuuu!",1 contribución,1,Escrita el 4 de septiembre de 2025,Escrita el 6 de septiembre de 2025,1 contribución,"Esta es la opinión subjetiva de un miembro de Tripadvisor, no de Tripadvisor LLC. Tripadvisor realiza comprobaciones de las opiniones.",restauranteastor,,,,,,,,,,,"Esta respuesta es la opinión subjetiva del representante de la dirección, no de Tripadvisor LLC.",Leer más,Leer más,0.0,https://dynamic-media-cdn.tripadvisor.com/media/photo-o/1a/f6/e6/ea/default-avatar-2020-54.jpg?w=100&h=-1&s=1,https://dynamic-media-cdn.tripadvisor.com/media/photo-o/0d/fa/aa/65/avatar.jpg?w=100&h=-1&s=1,,,
1775584673-12,https://www.tripadvisor.es/Restaurant_Review-g187514-d11896546-Reviews-Astor-Madrid.html,Atención de lujo y comida impecable,Mariana L,"Fantástico en todos los sentidos.
La comida es una fusión exquisita de culturas, el ambiente cálido y elegante, y la atención de Salvador insuperable: atento a cada detalle, desde los gustos de nuestras hijas y nuestros, hasta las recomendaciones de vino para los diferentes paladares de mi marido y mio. 
Una experiencia maravillosa que recomiendo al 100%.","Muchísimas Gracias por tan amables palabras, ojalá las merezcamos. Nos esforzamos servicio a servicio para que así sea. Le transmitiremos a Salvador vuestros recuerdos. Ha sido un honor y un placer haberl@s tenido en Ástor. Ojalá volváis pronto y así poder brindar por el reencuentro, Con personas como vosotr@s nuestro trabajo se hace mucho más fácil y placentero. Gracias, de verdad; miles de gracias!",2 contribuciones,2,Escrita el 4 de septiembre de 2025,Escrita el 6 de septiembre de 2025,2 contribuciones,"Esta es la opinión subjetiva de un miembro de Tripadvisor, no de Tripadvisor LLC. Tripadvisor realiza comprobaciones de las opiniones.",restauranteastor,,,,,,,,,,,"Esta respuesta es la opinión subjetiva del representante de la dirección, no de Tripadvisor LLC.",Leer más,Leer más,0.0,https://dynamic-media-cdn.tripadvisor.com/media/photo-o/08/55/19/9d/mariana-l.jpg?w=100&h=-1&s=1,https://dynamic-media-cdn.tripadvisor.com/media/photo-o/0d/fa/aa/65/avatar.jpg?w=100&h=-1&s=1,,,
