1775659934-15,https://www.tripadvisor.es/Restaurant_Review-g187514-d21090214-Reviews-SteakBurger_Gran_Via_55-Madrid.html,Maria Jose C,Uno de los mejores restaurantes de Madrid,"Personal al 100%. Y la comida un 1.000/10. Volveremos siempre que estemos en Madrid.
Keny y Lady, unos encargados siempre pendientes del cliente",¡Muchísimas gracias por tu reseña tan fantástica! Nos alegra un montón que la comida les haya encantado y que la atención de Kenny y Lady haya sido tan excelente. Es genial saber que se sintieron tan bien atendidos. ¡Esperamos verles de nuevo cada vez que estén en Madrid!,1.0,Escrita el 4 de julio de 2025,1 contribución,Jaime Vicente,Escrita el 2 de agosto de 2025,,Calidad/precio,Ambiente,Servicio,Comida,,Reservar por si acaso.,,"Esta respuesta es la opinión subjetiva del representante de la dirección, no de Tripadvisor LLC.","Esta es la opinión subjetiva de un miembro de Tripadvisor, no de Tripadvisor LLC. Tripadvisor realiza comprobaciones de las opiniones.",,,Leer más,Leer más,,https://dynamic-media-cdn.tripadvisor.com/media/photo-o/1a/f6/eb/e3/default-avatar-2020-59.jpg?w=100&h=-1&s=1,https://dynamic-media-cdn.tripadvisor.com/media/photo-o/1a/f6/e8/ea/default-avatar-2020-63.jpg?w=100&h=-1&s=1,0.0
1775659868-1,https://www.tripadvisor.es/Restaurant_Review-g187514-d21090214-Reviews-SteakBurger_Gran_Via_55-Madrid.html,Las mejores Hamburguesas,Mariana B,"Nos atendió muy amablemente Juli.
 Steak Burger nunca falla, 100% recomendado.",1 contribución,1.0,Escrita el 26 de marzo de 2026,,Calidad/precio,Ambiente,Servicio,Comida,,"Esta es la opinión subjetiva de un miembro de Tripadvisor, no de Tripadvisor LLC. Tripadvisor realiza comprobaciones de las opiniones.",,Leer más,0,,,,,,,,,https://dynamic-media-cdn.tripadvisor.com/media/photo-o/1a/f6/e8/ea/default-avatar-2020-63.jpg?w=100&h=-1&s=1,,
1775659868-2,https://www.tripadvisor.es/Restaurant_Review-g187514-d21090214-Reviews-SteakBurger_Gran_Via_55-Madrid.html,Buena comida y buen servicio,Chris,"Excelente comida, a un precio muy responsable teniendo en cuenta que está en la franja principal de Madrid",25 contribuciones,25.0,Escrita el 17 de marzo de 2026,Mostrar original,,,,,Traducido automáticamente,"Esta es la opinión subjetiva de un miembro de Tripadvisor, no de Tripadvisor LLC. Tripadvisor realiza comprobaciones de las opiniones.",,Leer más,0,,,,,,,,,https://dynamic-media-cdn.tripadvisor.com/media/photo-l/01/2a/fd/97/avatar.jpg?w=100&h=-1&s=1,,
1775659868-3,https://www.tripadvisor.es/Restaurant_Review-g187514-d21090214-Reviews-SteakBurger_Gran_Via_55-Madrid.html,10/10,Bogdan A,"El lugar es muy hermoso, la comida deliciosa y el servicio encantador. El tiempo de espera no fue superior a 15 20 minutos
Nuestra camarera Patricia era muy encantadora",1 contribución,1.0,Escrita el 17 de marzo de 2026,Mostrar original,,,,,Traducido automáticamente,,,Leer más,0,,,,,,,,https://dynamic-media-cdn.tripadvisor.com/media/photo-o/32/b5/b9/8a/caption.jpg?w=300&h=300&s=1,https://dynamic-media-cdn.tripadvisor.com/media/photo-o/1a/f6/f6/0d/default-avatar-2020-34.jpg?w=100&h=-1&s=1,,
1775659868-4,https://www.tripadvisor.es/Restaurant_Review-g187514-d21090214-Reviews-SteakBurger_Gran_Via_55-Madrid.html,buen servicio,Ainhoa C,muy buen servicio en especial recalcar a el camarero william,1 contribución,1.0,Escrita el 11 de marzo de 2026,,Calidad/precio,Ambiente,Servicio,Comida,,"Esta es la opinión subjetiva de un miembro de Tripadvisor, no de Tripadvisor LLC. Tripadvisor realiza comprobaciones de las opiniones.",,Leer más,0,,,,,,,,,https://dynamic-media-cdn.tripadvisor.com/media/photo-o/1a/f6/de/5a/default-avatar-2020-36.jpg?w=100&h=-1&s=1,,
1775659868-5,https://www.tripadvisor.es/Restaurant_Review-g187514-d21090214-Reviews-SteakBurger_Gran_Via_55-Madrid.html,Excelente,Victoria S,"Muy buena experiencia en este restaurante. Desde que llegas te atienden muy bien. Tardaron muy poco en atendernos en la mesa, el servicio fue muy rápido, Patricia fue muy amable y profesional. Los nachos estaban muy buenos y las hamburguesas deliciosas y enormes!!. Sin duda repetiremos.",3 contribuciones,3.0,Escrita el 10 de marzo de 2026,,,,,,,,"Esta es la opinión subjetiva de un miembro de Tripadvisor, no de Tripadvisor LLC. Tripadvisor realiza comprobaciones de las opiniones.",Leer más,0,,,,,,,,,https://dynamic-media-cdn.tripadvisor.com/media/photo-o/08/45/7b/a5/victoria-s.jpg?w=100&h=-1&s=1,,
1775659868-6,https://www.tripadvisor.es/Restaurant_Review-g187514-d21090214-Reviews-SteakBurger_Gran_Via_55-Madrid.html,Filete hermoso,missO,"Absolutamente increíble relación calidad-precio, el personal es tan amable y atento sin duda volver!",3 contribuciones,3.0,Escrita el 9 de marzo de 2026,Mostrar original,,,,,Traducido automáticamente,,,Leer más,0,,,,,,,,https://dynamic-media-cdn.tripadvisor.com/media/photo-o/32/a4/0f/d4/caption.jpg?w=300&h=300&s=1,,,
1775659868-7,https://www.tripadvisor.es/Restaurant_Review-g187514-d21090214-Reviews-SteakBurger_Gran_Via_55-Madrid.html,Buen trato,laura a,"Restaurante con bonita decoración.
El trato de Andrés fue muy atento y amable.
La comida estaba muy rica.",1 contribución,1.0,Escrita el 7 de marzo de 2026,,Calidad/precio,Ambiente,Servicio,Comida,,"Esta es la opinión subjetiva de un miembro de Tripadvisor, no de Tripadvisor LLC. Tripadvisor realiza comprobaciones de las opiniones.",,Leer más,0,,,,,,,,,https://dynamic-media-cdn.tripadvisor.com/media/photo-o/1a/f6/e9/ef/default-avatar-2020-66.jpg?w=100&h=-1&s=1,,
1775659868-8,https://www.tripadvisor.es/Restaurant_Review-g187514-d21090214-Reviews-SteakBurger_Gran_Via_55-Madrid.html,cena inolvidable,Bruno S,Traje a cenar a mi mamá y quedó encantada y más con la atención de Andrés que hizo nuestra cena 10/10 volveremos a probar la costilla que se ve espectacular,1 contribución,1.0,Escrita el 2 de marzo de 2026,,,,,,,"Esta es la opinión subjetiva de un miembro de Tripadvisor, no de Tripadvisor LLC. Tripadvisor realiza comprobaciones de las opiniones.",,Leer más,0,,,,,,,,https://dynamic-media-cdn.tripadvisor.com/media/photo-o/32/95/db/05/caption.jpg?w=300&h=300&s=1,https://dynamic-media-cdn.tripadvisor.com/media/photo-o/1a/f6/7c/01/default-avatar-2020-5.jpg?w=100&h=-1&s=1,,
1775659868-9,https://www.tripadvisor.es/Restaurant_Review-g187514-d21090214-Reviews-SteakBurger_Gran_Via_55-Madrid.html,Lo pasamos muy bien,Luis Miguel A,Nos atendió Andrés y estaba todo muy bueno. Muy bien,1 contribución,1.0,Escrita el 22 de febrero de 2026,,Calidad/precio,Ambiente,Servicio,Comida,,"Esta es la opinión subjetiva de un miembro de Tripadvisor, no de Tripadvisor LLC. Tripadvisor realiza comprobaciones de las opiniones.",,Leer más,0,,,,,,,,,https://dynamic-media-cdn.tripadvisor.com/media/photo-o/1a/f6/eb/a3/default-avatar-2020-38.jpg?w=100&h=-1&s=1,,
1775659868-10,https://www.tripadvisor.es/Restaurant_Review-g187514-d21090214-Reviews-SteakBurger_Gran_Via_55-Madrid.html,Gran comida y servicio,Amy O,"Muy buena comida, William sirvió nuestra mesa y él era muy educado y atento. El filete de hierro fue uno de los mejores filetes que he probado. Recomendaría",4 contribuciones,4.0,Escrita el 22 de febrero de 2026,Mostrar original,Calidad/precio,Ambiente,Servicio,Comida,Traducido automáticamente,,,Leer más,0,,,,,,,,https://dynamic-media-cdn.tripadvisor.com/media/photo-o/32/82/db/13/caption.jpg?w=300&h=300&s=1,https://dynamic-media-cdn.tripadvisor.com/media/photo-o/1a/f6/e8/ea/default-avatar-2020-63.jpg?w=100&h=-1&s=1,,
1775659868-11,https://www.tripadvisor.es/Restaurant_Review-g187514-d21090214-Reviews-SteakBurger_Gran_Via_55-Madrid.html,excelente,Miiriiam M,"La comida maravillosa y el servicio increíble, nos atendió Carlos. Tardaron poco en servirnos los entrantes y todo llegó como pedimos. 10/10",1 contribución,1.0,Escrita el 8 de febrero de 2026,,Calidad/precio,Ambiente,Servicio,Comida,,"Esta es la opinión subjetiva de un miembro de Tripadvisor, no de Tripadvisor LLC. Tripadvisor realiza comprobaciones de las opiniones.",,Leer más,0,,,,,,,,,https://dynamic-media-cdn.tripadvisor.com/media/photo-o/1a/f6/7c/01/default-avatar-2020-5.jpg?w=100&h=-1&s=1,,
1775659868-12,https://www.tripadvisor.es/Restaurant_Review-g187514-d21090214-Reviews-SteakBurger_Gran_Via_55-Madrid.html,Muy buena la atención de Carlos,Ana Camile M,"Muy buena la atención de Carlos, y la comida aunque el olor del local no era lo mejor estaba concentrado entre lluvia y sudor no hay ventilación",1 contribución,1.0,Escrita el 8 de febrero de 2026,,,,,,,,"Esta es la opinión subjetiva de un miembro de Tripadvisor, no de Tripadvisor LLC. Tripadvisor realiza comprobaciones de las opiniones.",Leer más,0,,,,,,,,,https://dynamic-media-cdn.tripadvisor.com/media/photo-o/1a/f6/f1/b8/default-avatar-2020-22.jpg?w=100&h=-1&s=1,,
1775659868-13,https://www.tripadvisor.es/Restaurant_Review-g187514-d21090214-Reviews-SteakBurger_Gran_Via_55-Madrid.html,L,Maria S,"Buen Servicio y muy buena atención sobre todo del camarero Carlos que es un encanto, la comida muy buena sin duda volveré",1 contribución,1.0,Escrita el 7 de febrero de 2026,,,,,,,,"Esta es la opinión subjetiva de un miembro de Tripadvisor, no de Tripadvisor LLC. Tripadvisor realiza comprobaciones de las opiniones.",Leer más,0,,,,,,,,,https://dynamic-media-cdn.tripadvisor.com/media/photo-o/1a/f6/f2/b8/default-avatar-2020-26.jpg?w=100&h=-1&s=1,,
1775659868-14,https://www.tripadvisor.es/Restaurant_Review-g187514-d21090214-Reviews-SteakBurger_Gran_Via_55-Madrid.html,Nuestra Despedida,cristina s,"Gracias a Carlos tuvimos la mejor experiencia de comida! Estuvimos super bien y la comida muyy rica.
Estamos de despedida y mis amigas estuvieron encantadas",1 contribución,1.0,Escrita el 7 de febrero de 2026,,,,,,,,"Esta es la opinión subjetiva de un miembro de Tripadvisor, no de Tripadvisor LLC. Tripadvisor realiza comprobaciones de las opiniones.",Leer más,0,,,,,,,,,https://dynamic-media-cdn.tripadvisor.com/media/photo-o/1a/f6/e2/11/default-avatar-2020-41.jpg?w=100&h=-1&s=1,,
1775659868-15,https://www.tripadvisor.es/Restaurant_Review-g187514-d21090214-Reviews-SteakBurger_Gran_Via_55-Madrid.html,Buena comida mejor servicio.,Berta E,"Experiencia increíble estuvimos de comida de despedida, servicio excepcional. Carlos y Andrés nos atendieron súper bien. Gracias por los chupitos.",2 contribuciones,2.0,Escrita el 7 de febrero de 2026,,Calidad/precio,Ambiente,Servicio,Comida,,"Esta es la opinión subjetiva de un miembro de Tripadvisor, no de Tripadvisor LLC. Tripadvisor realiza comprobaciones de las opiniones.",,Leer más,0,,,,,,,,,,,
1775659910-1,https://www.tripadvisor.es/Restaurant_Review-g187514-d21090214-Reviews-SteakBurger_Gran_Via_55-Madrid.html,Genial,Gema O,"Todo genial, el trato por parte de Ángela ( nuestra camarera ) estupendo, muy atenta y las hamburguesas buenísimas.
El sitio muy bonito",Escrita el 7 de noviembre de 2025,1.0,1 contribución,1 contribución,Calidad/precio,Servicio,Ambiente,Comida,,"Esta es la opinión subjetiva de un miembro de Tripadvisor, no de Tripadvisor LLC. Tripadvisor realiza comprobaciones de las opiniones.",,,,Leer más,0,,,,,,,https://dynamic-media-cdn.tripadvisor.com/media/photo-o/1a/f6/e8/5b/default-avatar-2020-61.jpg?w=100&h=-1&s=1,,
1775659910-2,https://www.tripadvisor.es/Restaurant_Review-g187514-d21090214-Reviews-SteakBurger_Gran_Via_55-Madrid.html,100% volveremos. Servicio excelente y comida exquisita,Culture53715716661,"Fue todo un acierto cenar allí. Nos atendió Isabella, encantadora y muy profesional, muy pendiente a cada momento de nosotros. Repetiremos seguro cuando volvamos. Servicio excelente. Y la comida exquisita",Escrita el 3 de noviembre de 2025,1.0,1 contribución,1 contribución,Calidad/precio,Servicio,Ambiente,Comida,,,"Esta es la opinión subjetiva de un miembro de Tripadvisor, no de Tripadvisor LLC. Tripadvisor realiza comprobaciones de las opiniones.",,,Leer más,0,,,,,,https://dynamic-media-cdn.tripadvisor.com/media/photo-o/31/a0/8b/74/caption.jpg?w=300&h=300&s=1,https://dynamic-media-cdn.tripadvisor.com/media/photo-o/1a/f6/f1/42/default-avatar-2020-20.jpg?w=100&h=-1&s=1,,
1775659910-3,https://www.tripadvisor.es/Restaurant_Review-g187514-d21090214-Reviews-SteakBurger_Gran_Via_55-Madrid.html,Almuerzo,Tomislav S,"Muy mala experiencia, la carne no era comestible y duro. El servicio era bueno, pero no nos preguntaron si era bueno o si había un problema ya que la carne se dejó en los platos.",Escrita el 1 de noviembre de 2025,7.0,7 contribuciones,7 contribuciones,Servicio,Comida,,Ambiente,Mostrar original,,"Esta es la opinión subjetiva de un miembro de Tripadvisor, no de Tripadvisor LLC. Tripadvisor realiza comprobaciones de las opiniones.",Traducido automáticamente,,Leer más,0,,,,,,,https://dynamic-media-cdn.tripadvisor.com/media/photo-o/1a/f6/e2/4a/default-avatar-2020-42.jpg?w=100&h=-1&s=1,,
1775659910-4,https://www.tripadvisor.es/Restaurant_Review-g187514-d21090214-Reviews-SteakBurger_Gran_Via_55-Madrid.html,Excelente,Pablo M,Muy buena la comida tanto la parte de steak como la de pizzería es de la mejor comida que he comido en mi vida. Totalmente recomendable,Escrita el 22 de octubre de 2025,1.0,1 contribución,1 contribución,,,,,,"Esta es la opinión subjetiva de un miembro de Tripadvisor, no de Tripadvisor LLC. Tripadvisor realiza comprobaciones de las opiniones.",,,,Leer más,0,,,,,,https://dynamic-media-cdn.tripadvisor.com/media/photo-o/31/7b/50/65/caption.jpg?w=300&h=300&s=1,https://dynamic-media-cdn.tripadvisor.com/media/photo-o/1a/f6/de/e7/default-avatar-2020-37.jpg?w=100&h=-1&s=1,,
1775659910-5,https://www.tripadvisor.es/Restaurant_Review-g187514-d21090214-Reviews-SteakBurger_Gran_Via_55-Madrid.html,👌,Sierra M,"Tuvimos una comida increíble en Steak Burger! La comida era deliciosa, y nuestro servidor Janise era tan amable y atento. Ella hizo la experiencia aún mejor sin duda volver!",Escrita el 16 de octubre de 2025,1.0,1 contribución,1 contribución,,,,,Mostrar original,"Esta es la opinión subjetiva de un miembro de Tripadvisor, no de Tripadvisor LLC. Tripadvisor realiza comprobaciones de las opiniones.",,Traducido automáticamente,,Leer más,0,,,,,,,https://dynamic-media-cdn.tripadvisor.com/media/photo-o/1a/f6/ef/9c/default-avatar-2020-14.jpg?w=100&h=-1&s=1,,
1775659910-6,https://www.tripadvisor.es/Restaurant_Review-g187514-d21090214-Reviews-SteakBurger_Gran_Via_55-Madrid.html,¡Debo visitar!,Jason V,"Janise era increíble y la comida era deliciosa! Sin duda volvería, todo lo que comimos era genial y Janise tenía el mejor servicio de todos!",Escrita el 16 de octubre de 2025,1.0,1 contribución,1 contribución,,,,,Mostrar original,"Esta es la opinión subjetiva de un miembro de Tripadvisor, no de Tripadvisor LLC. Tripadvisor realiza comprobaciones de las opiniones.",,Traducido automáticamente,,Leer más,0,,,,,,,https://dynamic-media-cdn.tripadvisor.com/media/photo-o/1a/f6/ef/32/default-avatar-2020-12.jpg?w=100&h=-1&s=1,,
1775659910-7,https://www.tripadvisor.es/Restaurant_Review-g187514-d21090214-Reviews-SteakBurger_Gran_Via_55-Madrid.html,Pésima experiencia nada  recomendable,Javier B,"Servicio pésimo, habia reservado por teléfono y perdieron la reserva 
Nos hicieron esperar como si no tuviéramos reserva 
La jefa de sala borde
Se olvidaron la comanda 
Para aplicar un copón tuve que ir a la barra
 Todo lo que pudo salir mal salió mal 
Hicieron que una celebración de cumpleaños de un niño fuera muy desagradable",Escrita el 4 de octubre de 2025,1.0,"Madrid, España",1 contribución,,,,,,,,,"Esta es la opinión subjetiva de un miembro de Tripadvisor, no de Tripadvisor LLC. Tripadvisor realiza comprobaciones de las opiniones.",Leer más,0,,,,,,,https://dynamic-media-cdn.tripadvisor.com/media/photo-o/1a/f6/e9/60/default-avatar-2020-64.jpg?w=100&h=-1&s=1,,
1775659910-8,https://www.tripadvisor.es/Restaurant_Review-g187514-d21090214-Reviews-SteakBurger_Gran_Via_55-Madrid.html,Muy agusto,Esthefany C,Me estanco la comida y la atención de la camarera Isabela muy amable ❤️volveríamos la comida el ambiente todo estaba muy bueno,Escrita el 28 de septiembre de 2025,1.0,1 contribución,1 contribución,,,,,,,,,"Esta es la opinión subjetiva de un miembro de Tripadvisor, no de Tripadvisor LLC. Tripadvisor realiza comprobaciones de las opiniones.",Leer más,0,,,,,,,https://dynamic-media-cdn.tripadvisor.com/media/photo-o/1a/f6/de/0a/default-avatar-2020-35.jpg?w=100&h=-1&s=1,,
1775659910-9,https://www.tripadvisor.es/Restaurant_Review-g187514-d21090214-Reviews-SteakBurger_Gran_Via_55-Madrid.html,Opinión,Andrea C,"excelente atención por parte de Janice, excelente comunicación y empatía con los clientes y la comida súper buena! volvería",Escrita el 26 de septiembre de 2025,1.0,1 contribución,1 contribución,,,,,,,,,"Esta es la opinión subjetiva de un miembro de Tripadvisor, no de Tripadvisor LLC. Tripadvisor realiza comprobaciones de las opiniones.",Leer más,0,,,,,,,https://dynamic-media-cdn.tripadvisor.com/media/photo-o/1a/f6/f3/23/default-avatar-2020-28.jpg?w=100&h=-1&s=1,,
1775659910-10,https://www.tripadvisor.es/Restaurant_Review-g187514-d21090214-Reviews-SteakBurger_Gran_Via_55-Madrid.html,Hamburguesas en Madrid,Adrian R,¡Grandes hamburguesas! Gracias a Patricia por el gran servicio amable. El lugar era acogedor y limpio. Si te gustan las hamburguesas... Recomiendo encarecidamente visitar.,Escrita el 24 de septiembre de 2025,2.0,"Hillarys, Australia",2 contribuciones,Calidad/precio,Servicio,Ambiente,Comida,Mostrar original,,"Esta es la opinión subjetiva de un miembro de Tripadvisor, no de Tripadvisor LLC. Tripadvisor realiza comprobaciones de las opiniones.",Traducido automáticamente,,Leer más,0,,,,,,,https://dynamic-media-cdn.tripadvisor.com/media/photo-o/1a/f6/e6/ea/default-avatar-2020-54.jpg?w=100&h=-1&s=1,,
1775659910-11,https://www.tripadvisor.es/Restaurant_Review-g187514-d21090214-Reviews-SteakBurger_Gran_Via_55-Madrid.html,Gran lugar y personal amable,Leah R,Viajamos desde Australia y encontramos este lugar impresionante para el almuerzo! Gran ambiente! Mención especial a Abul nuestro camarero por su amabilidad y su sentido del humor. ¡La comida estaba deliciosa!,Escrita el 23 de septiembre de 2025,1.0,1 contribución,1 contribución,Calidad/precio,Servicio,Ambiente,Comida,Mostrar original,,"Esta es la opinión subjetiva de un miembro de Tripadvisor, no de Tripadvisor LLC. Tripadvisor realiza comprobaciones de las opiniones.",Traducido automáticamente,,Leer más,0,,,,,,,https://dynamic-media-cdn.tripadvisor.com/media/photo-o/1a/f6/e7/3d/default-avatar-2020-55.jpg?w=100&h=-1&s=1,,
1775659910-12,https://www.tripadvisor.es/Restaurant_Review-g187514-d21090214-Reviews-SteakBurger_Gran_Via_55-Madrid.html,Recomiendo este lugar,Lauren E,Agradable y agradable con buena cerveza increíble filete y una hermosa vibra al lugar lo recomendaría altamente para las noches,Escrita el 9 de septiembre de 2025,7.0,7 contribuciones,7 contribuciones,Calidad/precio,Servicio,Ambiente,Comida,Mostrar original,,"Esta es la opinión subjetiva de un miembro de Tripadvisor, no de Tripadvisor LLC. Tripadvisor realiza comprobaciones de las opiniones.",Traducido automáticamente,,Leer más,0,,,,,,,https://dynamic-media-cdn.tripadvisor.com/media/photo-o/1a/f6/e2/e6/default-avatar-2020-45.jpg?w=100&h=-1&s=1,,
1775659910-13,https://www.tripadvisor.es/Restaurant_Review-g187514-d21090214-Reviews-SteakBurger_Gran_Via_55-Madrid.html,Excelente lugar,Luciano R,"Excelente comida y servicio en todos los aspectos. 

Vinimos con mi pareja y fuimos atendidos por Cris y Emmanuel de forma espléndida, super carismáticos ambos.

Volveremos pronto.",Escrita el 3 de septiembre de 2025,1.0,1 contribución,1 contribución,,,,,,,,,"Esta es la opinión subjetiva de un miembro de Tripadvisor, no de Tripadvisor LLC. Tripadvisor realiza comprobaciones de las opiniones.",Leer más,0,,,,,,,https://dynamic-media-cdn.tripadvisor.com/media/photo-o/1a/f6/e9/ef/default-avatar-2020-66.jpg?w=100&h=-1&s=1,,
1775659910-14,https://www.tripadvisor.es/Restaurant_Review-g187514-d21090214-Reviews-SteakBurger_Gran_Via_55-Madrid.html,Genial,Daniel E,Comida muy buena buena atención buena decoración y William un camarero 10 muy amable y atento muchas gracias. volveremos,Escrita el 29 de agosto de 2025,1.0,1 contribución,1 contribución,,,,,,"Esta es la opinión subjetiva de un miembro de Tripadvisor, no de Tripadvisor LLC. Tripadvisor realiza comprobaciones de las opiniones.",,,,Leer más,0,,,,,,https://dynamic-media-cdn.tripadvisor.com/media/photo-o/30/f3/c5/52/caption.jpg?w=300&h=300&s=1,https://dynamic-media-cdn.tripadvisor.com/media/photo-o/1a/f6/ef/9c/default-avatar-2020-14.jpg?w=100&h=-1&s=1,,
1775659910-15,https://www.tripadvisor.es/Restaurant_Review-g187514-d21090214-Reviews-SteakBurger_Gran_Via_55-Madrid.html,Entró al azar,caesarjoel,"La comida era excelente. El precio es muy caro, pero no está mal para lo que se obtiene. La decoración es moderna y agradable. Janise era una camarera increíble. Muy recomendable",Escrita el 27 de agosto de 2025,2.0,"Austin, Texas",2 contribuciones,,,,,Mostrar original,"Esta es la opinión subjetiva de un miembro de Tripadvisor, no de Tripadvisor LLC. Tripadvisor realiza comprobaciones de las opiniones.",,Traducido automáticamente,,Leer más,0,,,,,,,https://dynamic-media-cdn.tripadvisor.com/media/photo-o/1a/f6/f1/06/default-avatar-2020-18.jpg?w=100&h=-1&s=1,,
1775659893-1,https://www.tripadvisor.es/Restaurant_Review-g187514-d21090214-Reviews-SteakBurger_Gran_Via_55-Madrid.html,Rica comida,Elena M,"La comida muy rica . Precios accesibles y la atención se Carlos espectacular. ;)
Instalaciones con calefacción 
Todo muy chulo",3 contribuciones,3.0,Escrita el 7 de febrero de 2026,,,,,,,"Esta es la opinión subjetiva de un miembro de Tripadvisor, no de Tripadvisor LLC. Tripadvisor realiza comprobaciones de las opiniones.",,,Leer más,0,,,,,,,https://dynamic-media-cdn.tripadvisor.com/media/photo-o/32/65/17/25/caption.jpg?w=300&h=300&s=1,https://dynamic-media-cdn.tripadvisor.com/media/photo-o/32/65/17/2d/caption.jpg?w=300&h=300&s=1,https://dynamic-media-cdn.tripadvisor.com/media/photo-o/1a/f6/ed/00/default-avatar-2020-4.jpg?w=100&h=-1&s=1,
1775659893-2,https://www.tripadvisor.es/Restaurant_Review-g187514-d21090214-Reviews-SteakBurger_Gran_Via_55-Madrid.html,La comida y la atención,Carla R,"Muchas gracias a Carlos, nos ha atendido estupendamente bien!! Un servicio de 10!! Y la comida está buenísima, recomiendo mucho este lugar.",2 contribuciones,2.0,Escrita el 7 de febrero de 2026,,,,,,"Esta es la opinión subjetiva de un miembro de Tripadvisor, no de Tripadvisor LLC. Tripadvisor realiza comprobaciones de las opiniones.",,,,Leer más,0,,,,,,,,,,
1775659893-3,https://www.tripadvisor.es/Restaurant_Review-g187514-d21090214-Reviews-SteakBurger_Gran_Via_55-Madrid.html,Burguer bbq,Roam28196390728,"La boda está buenísima, igual que los nachos y en general el servicio espectacular. Recomendar Symo para todos mis familiares.",1 contribución,1.0,Escrita el 7 de febrero de 2026,Calidad/precio,,Ambiente,Servicio,Comida,,"Esta es la opinión subjetiva de un miembro de Tripadvisor, no de Tripadvisor LLC. Tripadvisor realiza comprobaciones de las opiniones.",,,Leer más,0,,,,,,,,,https://dynamic-media-cdn.tripadvisor.com/media/photo-o/1a/f6/f0/48/default-avatar-2020-15.jpg?w=100&h=-1&s=1,
1775659893-4,https://www.tripadvisor.es/Restaurant_Review-g187514-d21090214-Reviews-SteakBurger_Gran_Via_55-Madrid.html,No hay dos sin tres,Esther G,"Éramos 16 teníamos una reserva y cuando llegamos nos habían puesto en un hueco que no entrábamos, uno de nosotros se tuvo que mover dos veces para poder abrir una puerta de un almacén, como protestamos la solución que nos dieron fue poner a 4 en otra mesa, bueno pues lo de las mesas se solucionó, pero ahí no queda la cosa, a media cena pedimos unas cañas y no nos las podían servir porque no tenían copas limpias, sorprendente y ya la última fue de traca íbamos con una persona celíaca y se pidió la burguer con salsa de trufa que le dijeron que no tenía gluten cuando llegan con la burguer le dice una camarera que si que lleva gluten, que solo hay una que lleva la carne tomate y lechuga sin ningún tipo de salsa ni queso, dice que le traigan esa y al rato vuelven con la primera y la dicen que en cocina aseguran que no tiene gluten, al final se quedó con la de trufa, esta persona celíaca porque ya está acostumbrada a este tipo de situaciones pero no me parece profesional ni sano que tengan ese tipo de dudas con una alergia y esta fue mi experiencia juzgar vosotros mismos",1 contribución,1.0,Escrita el 25 de enero de 2026,Calidad/precio,,Ambiente,Servicio,Comida,,"Esta es la opinión subjetiva de un miembro de Tripadvisor, no de Tripadvisor LLC. Tripadvisor realiza comprobaciones de las opiniones.",,,Leer más,0,,,,,,,,,https://dynamic-media-cdn.tripadvisor.com/media/photo-o/1a/f6/f0/d5/default-avatar-2020-17.jpg?w=100&h=-1&s=1,
1775659893-5,https://www.tripadvisor.es/Restaurant_Review-g187514-d21090214-Reviews-SteakBurger_Gran_Via_55-Madrid.html,Todo muy bueno y gran servicio,manuel r,"Muy buena comida y un gran servicio de José, un máquina. Muy buenas recomendaciones",2 contribuciones,2.0,Escrita el 23 de enero de 2026,Calidad/precio,,Ambiente,Servicio,Comida,,"Esta es la opinión subjetiva de un miembro de Tripadvisor, no de Tripadvisor LLC. Tripadvisor realiza comprobaciones de las opiniones.",,,Leer más,0,,,,,,,,,https://dynamic-media-cdn.tripadvisor.com/media/photo-o/1a/f6/e8/5b/default-avatar-2020-61.jpg?w=100&h=-1&s=1,
