1775659893-6,https://www.tripadvisor.es/Restaurant_Review-g187514-d21090214-Reviews-SteakBurger_Gran_Via_55-Madrid.html,Buena comida y buen servicio,Linda B,"La comida era increíble, y también el servicio. Angela era nuestra camarera, ella era muy amable y nos habló a través del menú con detalle.",1 contribución,1.0,Escrita el 19 de enero de 2026,Calidad/precio,Mostrar original,Ambiente,Servicio,Comida,,,Traducido automáticamente,"Esta es la opinión subjetiva de un miembro de Tripadvisor, no de Tripadvisor LLC. Tripadvisor realiza comprobaciones de las opiniones.",Leer más,0,,,,,,,,,https://dynamic-media-cdn.tripadvisor.com/media/photo-o/1a/f6/e2/11/default-avatar-2020-41.jpg?w=100&h=-1&s=1,
1775659893-7,https://www.tripadvisor.es/Restaurant_Review-g187514-d21090214-Reviews-SteakBurger_Gran_Via_55-Madrid.html,Nos atrapó Stake Burguer en Madrid!,JAIRO S,"N imaginamos la calidad del sitio! Había cola para entrar y nos imaginamos que era por algo!Tremenda sorpresa, variedad, excelente razón precio/calidad, porciones generosas, excelente atención! Recomendación mejor oferta de verduras! Tienen muchas sedes en Madrid y alta demanda! Pueden reservar, pero los atendieron por seleccionar Stake, no todo es hamburguesas!",50 contribuciones,50.0,Escrita el 2 de enero de 2026,,,,,,,"Esta es la opinión subjetiva de un miembro de Tripadvisor, no de Tripadvisor LLC. Tripadvisor realiza comprobaciones de las opiniones.",,,Leer más,0,,,,,,,https://dynamic-media-cdn.tripadvisor.com/media/photo-o/32/1c/93/41/caption.jpg?w=300&h=300&s=1,,https://dynamic-media-cdn.tripadvisor.com/media/photo-o/1a/f6/e9/60/default-avatar-2020-64.jpg?w=100&h=-1&s=1,
1775659893-8,https://www.tripadvisor.es/Restaurant_Review-g187514-d21090214-Reviews-SteakBurger_Gran_Via_55-Madrid.html,Genial.,Paul K,"Gran hamburguesa, muy sabrosa. 
¿El servicio? No sé si era nuevo, tenía un mal día o simplemente no le importaba. Él estaba teniendo una yegua completa no con nuestro pedido, sino con otras mesas también",46 contribuciones,46.0,Escrita el 16 de diciembre de 2025,Comida,Mostrar original,,,,,,Traducido automáticamente,"Esta es la opinión subjetiva de un miembro de Tripadvisor, no de Tripadvisor LLC. Tripadvisor realiza comprobaciones de las opiniones.",Leer más,0,,,,,,,,,https://dynamic-media-cdn.tripadvisor.com/media/photo-o/1a/f6/e9/60/default-avatar-2020-64.jpg?w=100&h=-1&s=1,
1775659893-9,https://www.tripadvisor.es/Restaurant_Review-g187514-d21090214-Reviews-SteakBurger_Gran_Via_55-Madrid.html,Plataforma events con fuego deja mucho que desear,Camper51034236739,"No tengo nada contra el restaurante que sin duda será bueno, pero si con la plataforma que realiza las reservas  events con fuego. Ojo, reserve para 12 y después de llamar e intentar reconfirmar me dijeron que no había reserva con las fechas que estamos. Así que ojo con la plataforma",1 contribución,1.0,Escrita el 14 de diciembre de 2025,,,,,,"Esta es la opinión subjetiva de un miembro de Tripadvisor, no de Tripadvisor LLC. Tripadvisor realiza comprobaciones de las opiniones.",,,,Leer más,0,,,,,,,,,,
1775659893-10,https://www.tripadvisor.es/Restaurant_Review-g187514-d21090214-Reviews-SteakBurger_Gran_Via_55-Madrid.html,Reservas para nada porque tienes que  esperar como cualquier cliente que llega,Noelia G,"Hicimos una reserva para las 21:30 y se nos atendió a eso de las 22:15,no respetan las reservas por estar lleno,luego nos hicieron sentar en un sillón para esperar una mesa libre para cenar.La comida nos está mal,la atención de una de las camareras que se llama Cris fue de lo mejor,una excelente persona que nos ayudó en cada pregunta y a disfrutar de la cena.Lo único malo fue eso,tener una reserva hecha y estar esperando demasiado tiempo,tenían que tener otro tipo de reservas y decir que para ciertas horas ya no hay sitio.Un diez para Cris!!!",2 contribuciones,2.0,Escrita el 30 de noviembre de 2025,Calidad/precio,,Ambiente,Servicio,Comida,Las reservas tampoco ayudan para que entres antes…,,,"Esta es la opinión subjetiva de un miembro de Tripadvisor, no de Tripadvisor LLC. Tripadvisor realiza comprobaciones de las opiniones.",Leer más,0,,,,,,,,,https://dynamic-media-cdn.tripadvisor.com/media/photo-o/1a/f6/f4/5d/default-avatar-2020-32.jpg?w=100&h=-1&s=1,
1775659893-11,https://www.tripadvisor.es/Restaurant_Review-g187514-d21090214-Reviews-SteakBurger_Gran_Via_55-Madrid.html,Trato del personal y comida,Getaway22591590536,"Muy buen trato el que hemos recibido mi madre y yo sobre todo el de Isabella. 
Es una chica muy agradable y muy atenta.
La comida es espectacular, en este caso pedidos dos hamburguesas con salsa de trufa y he de decir que ha sido de las mejores hamburguesas que he probado en mi vida.
10/10
Volveremos 🥰",1 contribución,1.0,Escrita el 18 de noviembre de 2025,Calidad/precio,,Ambiente,Servicio,Comida,,"Esta es la opinión subjetiva de un miembro de Tripadvisor, no de Tripadvisor LLC. Tripadvisor realiza comprobaciones de las opiniones.",,,Leer más,0,,,,,,,,,https://dynamic-media-cdn.tripadvisor.com/media/photo-o/1a/f6/ea/2e/default-avatar-2020-67.jpg?w=100&h=-1&s=1,
1775659893-12,https://www.tripadvisor.es/Restaurant_Review-g187514-d21090214-Reviews-SteakBurger_Gran_Via_55-Madrid.html,¡No te vayas!,Laura,"Absolutamente horrible comida y un servicio horrible. ¡El filete a 28 euros fue asqueroso! ¡Todo el personal fue grosero! No tengo nada bueno que decir sobre este lugar, por favor, ahorre tiempo y dinero e ir a otro lugar.",9 contribuciones,9.0,Escrita el 15 de noviembre de 2025,,Mostrar original,,,,,"Esta es la opinión subjetiva de un miembro de Tripadvisor, no de Tripadvisor LLC. Tripadvisor realiza comprobaciones de las opiniones.",Traducido automáticamente,,Leer más,0,,,,,,,,,https://dynamic-media-cdn.tripadvisor.com/media/photo-o/1a/f6/ef/32/default-avatar-2020-12.jpg?w=100&h=-1&s=1,
1775659893-13,https://www.tripadvisor.es/Restaurant_Review-g187514-d21090214-Reviews-SteakBurger_Gran_Via_55-Madrid.html,Reservamos com fever,Sarai R,"Muy buen sitio, la decoracion esta super chula, la comida muy buena y la chica qué nos antendió (Isabella) fue muy agradable.

El único 'pero' es que en la reserva (por fever) pone que el vino es de una reserva de 2017 y nos sirvieron Uno de 2022",1 contribución,1.0,Escrita el 12 de noviembre de 2025,Calidad/precio,,Ambiente,Servicio,Comida,,"Esta es la opinión subjetiva de un miembro de Tripadvisor, no de Tripadvisor LLC. Tripadvisor realiza comprobaciones de las opiniones.",,,Leer más,0,,,,,,,,,https://dynamic-media-cdn.tripadvisor.com/media/photo-o/1a/f6/e5/2b/default-avatar-2020-52.jpg?w=100&h=-1&s=1,
1775659893-14,https://www.tripadvisor.es/Restaurant_Review-g187514-d21090214-Reviews-SteakBurger_Gran_Via_55-Madrid.html,Un lugar para volver,Jose P,"Isabela me atendió y súper bien ! 
La Burguer buenísima y el lugar increíble 
El equipo humano se les ve muy profesionales 
Muchas gracias",1 contribución,1.0,Escrita el 10 de noviembre de 2025,Calidad/precio,,Ambiente,Servicio,Comida,,,,"Esta es la opinión subjetiva de un miembro de Tripadvisor, no de Tripadvisor LLC. Tripadvisor realiza comprobaciones de las opiniones.",Leer más,0,,,,,,,https://dynamic-media-cdn.tripadvisor.com/media/photo-o/31/ae/f1/8e/caption.jpg?w=300&h=300&s=1,https://dynamic-media-cdn.tripadvisor.com/media/photo-o/31/ae/f1/8f/caption.jpg?w=300&h=300&s=1,https://dynamic-media-cdn.tripadvisor.com/media/photo-o/15/fa/e7/5a/jose-p.jpg?w=100&h=-1&s=1,
1775659893-15,https://www.tripadvisor.es/Restaurant_Review-g187514-d21090214-Reviews-SteakBurger_Gran_Via_55-Madrid.html,Completamente recomendado,Santiago A,"Muy buena experiencia y muy buena atención al cliente, muchas gracias al mesero Carlos!

Super recomendado a cualquier persona que tenga pensado en venir",1 contribución,1.0,Escrita el 9 de noviembre de 2025,Calidad/precio,,Ambiente,Servicio,Comida,,,,"Esta es la opinión subjetiva de un miembro de Tripadvisor, no de Tripadvisor LLC. Tripadvisor realiza comprobaciones de las opiniones.",Leer más,0,,,,,,,https://dynamic-media-cdn.tripadvisor.com/media/photo-o/31/ae/14/2e/caption.jpg?w=300&h=300&s=1,https://dynamic-media-cdn.tripadvisor.com/media/photo-o/31/ae/14/2f/caption.jpg?w=300&h=300&s=1,https://dynamic-media-cdn.tripadvisor.com/media/photo-o/1a/f6/de/0a/default-avatar-2020-35.jpg?w=100&h=-1&s=1,
