1775727951-12,https://www.tripadvisor.es/Restaurant_Review-g187514-d3599952-Reviews-Steak_Burger_Luchana-Madrid.html,Muy bueno,Discover30546965530,"Buena carne, buena calidad, buen ambiente, somos del barrio y venimos muchas veces porque es un sitio que está bueno y es muy cómodo.",1 contribución,Escrita el 18 de octubre de 2025,1 contribución,Calidad/precio,Ambiente,Servicio,Comida,,,,"Esta es la opinión subjetiva de un miembro de Tripadvisor, no de Tripadvisor LLC. Tripadvisor realiza comprobaciones de las opiniones.",,Leer más,0,,1,,https://dynamic-media-cdn.tripadvisor.com/media/photo-o/31/70/b5/35/caption.jpg?w=300&h=300&s=1,https://dynamic-media-cdn.tripadvisor.com/media/photo-o/1a/f6/ef/32/default-avatar-2020-12.jpg?w=100&h=-1&s=1
1775727951-13,https://www.tripadvisor.es/Restaurant_Review-g187514-d3599952-Reviews-Steak_Burger_Luchana-Madrid.html,Camarero,David M,"La atención y el trato recibido por Fer excelente, muy atento a todo y se agradece, volveremos pronto además la comida estaba rica",1 contribución,Escrita el 6 de octubre de 2025,1 contribución,,,,,,"Esta es la opinión subjetiva de un miembro de Tripadvisor, no de Tripadvisor LLC. Tripadvisor realiza comprobaciones de las opiniones.",,,,Leer más,0,,1,,,https://dynamic-media-cdn.tripadvisor.com/media/photo-o/1a/f6/e9/ef/default-avatar-2020-66.jpg?w=100&h=-1&s=1
1775727951-14,https://www.tripadvisor.es/Restaurant_Review-g187514-d3599952-Reviews-Steak_Burger_Luchana-Madrid.html,Está bien,Sarah E,"Si usted está buscando un bocado rápido para comer y Servicio rápido. 

Pros
 -mucha elección en el menú. 
 -no es caro en absoluto, a un precio muy razonable. 
 -no ocupado y mucho personal. 
 - Menú de códigos qr. 

Desventajas
 -la comida es media, sin sabor. 
 -No lo recomendaría, pero está bien para uno solo. 
 Gran ubicación. 
 -No hay música en el lugar tan tranquilo.",51 contribuciones,Escrita el 29 de agosto de 2025,51 contribuciones,,,,,Mostrar original,,,"Esta es la opinión subjetiva de un miembro de Tripadvisor, no de Tripadvisor LLC. Tripadvisor realiza comprobaciones de las opiniones.",Traducido automáticamente,Leer más,0,,51,,https://dynamic-media-cdn.tripadvisor.com/media/photo-o/30/f3/a1/79/caption.jpg?w=300&h=300&s=1,https://dynamic-media-cdn.tripadvisor.com/media/photo-o/1a/f6/e8/ea/default-avatar-2020-63.jpg?w=100&h=-1&s=1
1775727951-15,https://www.tripadvisor.es/Restaurant_Review-g187514-d3599952-Reviews-Steak_Burger_Luchana-Madrid.html,Calidad al precio que ofrecen.,Jorge S,Una buena hamburguesería con una calidad muy aceptable. Las hamburguesas baratas no son hamburguesas. Aquí te cobran una calidad que se nota. Por lo tanto he vuelto a menudo.,16 contribuciones,Escrita el 8 de agosto de 2025,"Alicante, España",,,,,,"Esta es la opinión subjetiva de un miembro de Tripadvisor, no de Tripadvisor LLC. Tripadvisor realiza comprobaciones de las opiniones.",,,,Leer más,0,,16,,,https://dynamic-media-cdn.tripadvisor.com/media/photo-o/1a/f6/e5/66/default-avatar-2020-53.jpg?w=100&h=-1&s=1
1775727995-1,https://www.tripadvisor.es/Restaurant_Review-g187514-d3599952-Reviews-Steak_Burger_Luchana-Madrid.html,100% recomendado,Jenni D,"Recomendado 100% excelente servicio, la comida jugosa y de calidad, el personal muy atento y sociable, muy acogedor el lugar",Escrita el 19 de junio de 2024,,1 contribución,,Calidad/precio,Ambiente,Servicio,Comida,"Esta es la opinión subjetiva de un miembro de Tripadvisor, no de Tripadvisor LLC. Tripadvisor realiza comprobaciones de las opiniones.",,,,Leer más,,,1,1.0,https://dynamic-media-cdn.tripadvisor.com/media/photo-o/1a/f6/f2/eb/default-avatar-2020-27.jpg?w=100&h=-1&s=1,
1775727995-2,https://www.tripadvisor.es/Restaurant_Review-g187514-d3599952-Reviews-Steak_Burger_Luchana-Madrid.html,Excelente,Tania M,"Ambiente agradable, estoy con mi pareja de aniversario, la pasamos muy bien, todo muy acogedor la atención el servicio las bebidas y la comida excelente!!",Escrita el 18 de junio de 2024,,1 contribución,,Calidad/precio,Ambiente,Servicio,Comida,"Esta es la opinión subjetiva de un miembro de Tripadvisor, no de Tripadvisor LLC. Tripadvisor realiza comprobaciones de las opiniones.",,,,Leer más,,,1,1.0,https://dynamic-media-cdn.tripadvisor.com/media/photo-o/1a/f6/e5/66/default-avatar-2020-53.jpg?w=100&h=-1&s=1,
1775727995-3,https://www.tripadvisor.es/Restaurant_Review-g187514-d3599952-Reviews-Steak_Burger_Luchana-Madrid.html,Buena atención,claudia c,"Fuimos muy bien atendidos por Bárbara, siempre con una sonrisa y super rápida sirviendo! Es un placer tener este tipo de atención.",Escrita el 7 de junio de 2024,,1 contribución,,,,,,,"Esta es la opinión subjetiva de un miembro de Tripadvisor, no de Tripadvisor LLC. Tripadvisor realiza comprobaciones de las opiniones.",,,Leer más,,,1,1.0,https://dynamic-media-cdn.tripadvisor.com/media/photo-o/1a/f6/ee/10/default-avatar-2020-8.jpg?w=100&h=-1&s=1,
1775727995-4,https://www.tripadvisor.es/Restaurant_Review-g187514-d3599952-Reviews-Steak_Burger_Luchana-Madrid.html,Opinión,Alvaro A,"El sitio está genial!! Vinimos a comer con amigos y la comida es estupenda, muy recomendable. Además, el establecimiento es muy cómodo, y la música ambienta la cena de forma estupenda",Escrita el 7 de junio de 2024,,1 contribución,,,,,,,"Esta es la opinión subjetiva de un miembro de Tripadvisor, no de Tripadvisor LLC. Tripadvisor realiza comprobaciones de las opiniones.",,,Leer más,,,1,1.0,https://dynamic-media-cdn.tripadvisor.com/media/photo-o/1a/f6/ee/10/default-avatar-2020-8.jpg?w=100&h=-1&s=1,
1775727995-5,https://www.tripadvisor.es/Restaurant_Review-g187514-d3599952-Reviews-Steak_Burger_Luchana-Madrid.html,Riquísimo,Maria s,"Todo estupendo, y muy rico. Barbara nos ha atendido muy bien y nos ha aconsejado estupendamente. La hamburguesa esta muy rico😋😋😋",Escrita el 7 de junio de 2024,,1 contribución,,Calidad/precio,Ambiente,Servicio,Comida,,,,,Leer más,,,1,1.0,,
1775727995-6,https://www.tripadvisor.es/Restaurant_Review-g187514-d3599952-Reviews-Steak_Burger_Luchana-Madrid.html,Fantástico,George H,"Barbara es fantástica ! The comida es increíble 100% los precios son justos y ustedes tiene mi recomendación. 

Steak Burger !",Escrita el 2 de junio de 2024,,1 contribución,,,,,,,"Esta es la opinión subjetiva de un miembro de Tripadvisor, no de Tripadvisor LLC. Tripadvisor realiza comprobaciones de las opiniones.",,,Leer más,,,1,1.0,https://dynamic-media-cdn.tripadvisor.com/media/photo-o/1a/f6/eb/e3/default-avatar-2020-59.jpg?w=100&h=-1&s=1,
1775727995-7,https://www.tripadvisor.es/Restaurant_Review-g187514-d3599952-Reviews-Steak_Burger_Luchana-Madrid.html,Cena!,Brighit C,"Nos atendió Bárbara y Mirian, estaba todo buenísimo, nos pedimos dos hamburguesas y nos atendieron super bien! Volveremos sin duda !",Escrita el 31 de mayo de 2024,,1 contribución,,,,,,"Esta es la opinión subjetiva de un miembro de Tripadvisor, no de Tripadvisor LLC. Tripadvisor realiza comprobaciones de las opiniones.",,,,Leer más,,,1,1.0,https://dynamic-media-cdn.tripadvisor.com/media/photo-o/1a/f6/e5/66/default-avatar-2020-53.jpg?w=100&h=-1&s=1,
1775727995-8,https://www.tripadvisor.es/Restaurant_Review-g187514-d3599952-Reviews-Steak_Burger_Luchana-Madrid.html,Hamburguesas con amigos,Elena J,"La comida estaba muy rica, además de que la relación calidad/precio era muy buena. La camarera Bárbara la mejor del mundo, súper atenta y trataba muy bien a los clientes.",Escrita el 4 de mayo de 2024,"Nos enorgullece que te haya gustado el servicio y la comida, esperamos veros pronto!",2 contribuciones,steakburguer l,Calidad/precio,Ambiente,Servicio,Comida,"Esta es la opinión subjetiva de un miembro de Tripadvisor, no de Tripadvisor LLC. Tripadvisor realiza comprobaciones de las opiniones.",,Escrita el 22 de mayo de 2024,"Esta respuesta es la opinión subjetiva del representante de la dirección, no de Tripadvisor LLC.",Leer más,Leer más,,2,1.0,https://dynamic-media-cdn.tripadvisor.com/media/photo-o/1a/f6/e7/7b/default-avatar-2020-56.jpg?w=100&h=-1&s=1,https://dynamic-media-cdn.tripadvisor.com/media/photo-o/1a/f6/f2/b8/default-avatar-2020-26.jpg?w=100&h=-1&s=1
1775727995-9,https://www.tripadvisor.es/Restaurant_Review-g187514-d3599952-Reviews-Steak_Burger_Luchana-Madrid.html,Grata experiencia,María R,"Barbara nos atendió y fue muy simpática, muy buen trato. Nos lo pasamos muy bien y repetiremos cien por cien. Salimos contentos y satisfechos",Escrita el 4 de mayo de 2024,,1 contribución,,,,,,,"Esta es la opinión subjetiva de un miembro de Tripadvisor, no de Tripadvisor LLC. Tripadvisor realiza comprobaciones de las opiniones.",,,Leer más,,,1,1.0,https://dynamic-media-cdn.tripadvisor.com/media/photo-o/1a/f6/de/e7/default-avatar-2020-37.jpg?w=100&h=-1&s=1,
1775727995-10,https://www.tripadvisor.es/Restaurant_Review-g187514-d3599952-Reviews-Steak_Burger_Luchana-Madrid.html,The food is excellent,Brandon H,"Marcos es una excelente persona, nos recomendo muy bien. La hamburguesa muy bien bien cocinada en el punto exigido y de sabor 10/10",Escrita el 26 de abril de 2024,"Buenas, muchísimas gracias por su comentario.",1 contribución,steakburguer l,,,,,,"Esta es la opinión subjetiva de un miembro de Tripadvisor, no de Tripadvisor LLC. Tripadvisor realiza comprobaciones de las opiniones.",Escrita el 22 de mayo de 2024,"Esta respuesta es la opinión subjetiva del representante de la dirección, no de Tripadvisor LLC.",Leer más,Leer más,,1,1.0,,https://dynamic-media-cdn.tripadvisor.com/media/photo-o/1a/f6/f2/b8/default-avatar-2020-26.jpg?w=100&h=-1&s=1
1775727995-11,https://www.tripadvisor.es/Restaurant_Review-g187514-d3599952-Reviews-Steak_Burger_Luchana-Madrid.html,Muy bueno!,mar gp,"Muy rico y la atención de Jakelin muy bien. Atenta y rápida.
Pelín caro, aunque lo cierto es q calidad-precio bien. La carne buenísima",Escrita el 21 de abril de 2024,"Un placer haber contado su visita, gracias",2 contribuciones,steakburguer l,Calidad/precio,Ambiente,Servicio,Comida,"Esta es la opinión subjetiva de un miembro de Tripadvisor, no de Tripadvisor LLC. Tripadvisor realiza comprobaciones de las opiniones.",,Escrita el 22 de abril de 2024,"Esta respuesta es la opinión subjetiva del representante de la dirección, no de Tripadvisor LLC.",Leer más,Leer más,,2,1.0,https://dynamic-media-cdn.tripadvisor.com/media/photo-o/1a/f6/e7/3d/default-avatar-2020-55.jpg?w=100&h=-1&s=1,https://dynamic-media-cdn.tripadvisor.com/media/photo-o/1a/f6/f2/b8/default-avatar-2020-26.jpg?w=100&h=-1&s=1
1775727995-12,https://www.tripadvisor.es/Restaurant_Review-g187514-d3599952-Reviews-Steak_Burger_Luchana-Madrid.html,Muy bien atendidos y muy rica la cena,Carolina C,"Muy ricas las hamburguesas Brutal BBQ y Melting cheese Trufle. Me ba atendido Jakelin muy bien y ha sido muy amable, muchas gracias.",Escrita el 14 de abril de 2024,Gracias a vosotros.,1 contribución,steakburguer l,,,,,,"Esta es la opinión subjetiva de un miembro de Tripadvisor, no de Tripadvisor LLC. Tripadvisor realiza comprobaciones de las opiniones.",Escrita el 22 de abril de 2024,"Esta respuesta es la opinión subjetiva del representante de la dirección, no de Tripadvisor LLC.",Leer más,Leer más,,1,1.0,https://dynamic-media-cdn.tripadvisor.com/media/photo-o/1a/f6/ee/10/default-avatar-2020-8.jpg?w=100&h=-1&s=1,https://dynamic-media-cdn.tripadvisor.com/media/photo-o/1a/f6/f2/b8/default-avatar-2020-26.jpg?w=100&h=-1&s=1
1775727995-13,https://www.tripadvisor.es/Restaurant_Review-g187514-d3599952-Reviews-Steak_Burger_Luchana-Madrid.html,Podria haber sido bueno pero NO,Alejandro S,"Después de una cuenta de 167,50 € nos han cobrado 2,90 € por un trozo de pan. Esta esperiencia podría haber sido buena pero nos la han colado con una sonrisa",Escrita el 13 de abril de 2024,"Buenas tardes Alejandro
El pan es un extra...se ofrece pero jamás lo servimos si el cliente no lo ha pedido, nuestra ración esta compuesta por 3 panes, lamentamos que no hayas quedado satisfecho.",1 contribución,steakburguer l,,,,,,"Esta es la opinión subjetiva de un miembro de Tripadvisor, no de Tripadvisor LLC. Tripadvisor realiza comprobaciones de las opiniones.",Escrita el 22 de abril de 2024,"Esta respuesta es la opinión subjetiva del representante de la dirección, no de Tripadvisor LLC.",Leer más,Leer más,,1,0.0,,https://dynamic-media-cdn.tripadvisor.com/media/photo-o/1a/f6/f2/b8/default-avatar-2020-26.jpg?w=100&h=-1&s=1
1775727995-14,https://www.tripadvisor.es/Restaurant_Review-g187514-d3599952-Reviews-Steak_Burger_Luchana-Madrid.html,Volveremos!,Nuria G,"La comida estuvo super buena, y nos atendieron rapidísimo. Además destaca la atención que nos prestó Bárbara, que nos asesoró con muchísima simpatía y humor.",Escrita el 11 de abril de 2024,"Muchas gracias, esperamos volveros a ver.",1 contribución,steakburguer l,,,,,,"Esta es la opinión subjetiva de un miembro de Tripadvisor, no de Tripadvisor LLC. Tripadvisor realiza comprobaciones de las opiniones.",Escrita el 22 de abril de 2024,"Esta respuesta es la opinión subjetiva del representante de la dirección, no de Tripadvisor LLC.",Leer más,Leer más,,1,1.0,,https://dynamic-media-cdn.tripadvisor.com/media/photo-o/1a/f6/f2/b8/default-avatar-2020-26.jpg?w=100&h=-1&s=1
1775727995-15,https://www.tripadvisor.es/Restaurant_Review-g187514-d3599952-Reviews-Steak_Burger_Luchana-Madrid.html,Muy buena cena,Francisco A,"Nos atendió Bárbara, muy atenta y agradable. La comida tardó poco y estaba muy buena, bien preparada, así como presentada.
Volveremos!",Escrita el 11 de abril de 2024,"Nos alegra escuchar eso.
Un saludo.",2 contribuciones,steakburguer l,Calidad/precio,Ambiente,Servicio,Comida,"Esta es la opinión subjetiva de un miembro de Tripadvisor, no de Tripadvisor LLC. Tripadvisor realiza comprobaciones de las opiniones.",,Escrita el 22 de abril de 2024,"Esta respuesta es la opinión subjetiva del representante de la dirección, no de Tripadvisor LLC.",Leer más,Leer más,,2,1.0,https://dynamic-media-cdn.tripadvisor.com/media/photo-o/1a/f6/e9/60/default-avatar-2020-64.jpg?w=100&h=-1&s=1,https://dynamic-media-cdn.tripadvisor.com/media/photo-o/1a/f6/f2/b8/default-avatar-2020-26.jpg?w=100&h=-1&s=1
1775727977-1,https://www.tripadvisor.es/Restaurant_Review-g187514-d3599952-Reviews-Steak_Burger_Luchana-Madrid.html,Buen trato,Jaime R,"Buen trato y servicio por parte de las chicas que me atendieron (Karen y Jaqueline),  comida excelente. Lo recomiendo mucho.",1 contribución,Escrita el 11 de julio de 2025,"Buen trato y servicio por parte de Jaqueline y Karen. Comida excelente, lo recomiendo mucho.",Calidad/precio,Ambiente,Servicio,Comida,"Esta es la opinión subjetiva de un miembro de Tripadvisor, no de Tripadvisor LLC. Tripadvisor realiza comprobaciones de las opiniones.",,Leer más,0,,,,,1,,,
1775727977-2,https://www.tripadvisor.es/Restaurant_Review-g187514-d3599952-Reviews-Steak_Burger_Luchana-Madrid.html,Cena de amigas,Alejandra V,"Excelente atención de Irma, muy  buena comida, comimos hamburguesa, nachos, la carne estaba en su punto perfecto y los platos con  una presentación exquisita por parte del cocinero Fernando.",1 contribución,Escrita el 1 de junio de 2025,,Calidad/precio,Ambiente,Servicio,Comida,"Esta es la opinión subjetiva de un miembro de Tripadvisor, no de Tripadvisor LLC. Tripadvisor realiza comprobaciones de las opiniones.",,Leer más,0,,,,,1,,https://dynamic-media-cdn.tripadvisor.com/media/photo-o/1a/f6/ee/db/default-avatar-2020-10.jpg?w=100&h=-1&s=1,
1775727977-3,https://www.tripadvisor.es/Restaurant_Review-g187514-d3599952-Reviews-Steak_Burger_Luchana-Madrid.html,Buena burger y excelente servicio,Estefania H,"Las hamburguesas muy buenas. El término de cocción medio fue perfecto. El tiempo de espera fue corto. El tinto de verano espectacular. Y la atención de Irma inmejorable, fue muy cálida y todo lo que se espera de un servicio excelente.",3 contribuciones,Escrita el 23 de mayo de 2025,,Calidad/precio,Ambiente,Servicio,Comida,,"Esta es la opinión subjetiva de un miembro de Tripadvisor, no de Tripadvisor LLC. Tripadvisor realiza comprobaciones de las opiniones.",Leer más,0,,,,,3,,https://dynamic-media-cdn.tripadvisor.com/media/photo-o/1a/f6/f4/20/default-avatar-2020-31.jpg?w=100&h=-1&s=1,
1775727977-4,https://www.tripadvisor.es/Restaurant_Review-g187514-d3599952-Reviews-Steak_Burger_Luchana-Madrid.html,Muy buena comida y atención,Jesus C,"Nos atendió Irma. Fue muy amable y atenta. Muy buena experiencia. La comida estuvo muy bien también, salí muy satisfecho.",1 contribución,Escrita el 23 de mayo de 2025,,Calidad/precio,Ambiente,Servicio,Comida,,"Esta es la opinión subjetiva de un miembro de Tripadvisor, no de Tripadvisor LLC. Tripadvisor realiza comprobaciones de las opiniones.",Leer más,0,,,,,1,,https://dynamic-media-cdn.tripadvisor.com/media/photo-o/1a/f6/ec/a2/default-avatar-2020-3.jpg?w=100&h=-1&s=1,
1775727977-5,https://www.tripadvisor.es/Restaurant_Review-g187514-d3599952-Reviews-Steak_Burger_Luchana-Madrid.html,La carne jugosa y en su punto como me gusta y la atención de las chicas muy buenas. No tarda nada en llegar la comida.,Marian G,"Mi tercera vez repitiendo. Las hamburguesas increíblemente buenas! La atención de Irma un encanto, si duda volvería!",1 contribución,Escrita el 17 de mayo de 2025,,Calidad/precio,Ambiente,Servicio,Comida,,"Esta es la opinión subjetiva de un miembro de Tripadvisor, no de Tripadvisor LLC. Tripadvisor realiza comprobaciones de las opiniones.",Leer más,0,,,,,1,,https://dynamic-media-cdn.tripadvisor.com/media/photo-o/1a/f6/f3/23/default-avatar-2020-28.jpg?w=100&h=-1&s=1,
1775727977-6,https://www.tripadvisor.es/Restaurant_Review-g187514-d3599952-Reviews-Steak_Burger_Luchana-Madrid.html,Hamburguesas deliciosas,Lila M,"Todo muy bueno, la atención de Ale 10/10
Las hamburguesas muy buenas en general
Recomendado
😋😋………………………………………………👻🫶🏻",1 contribución,Escrita el 3 de mayo de 2025,,Calidad/precio,Ambiente,Servicio,Comida,,"Esta es la opinión subjetiva de un miembro de Tripadvisor, no de Tripadvisor LLC. Tripadvisor realiza comprobaciones de las opiniones.",Leer más,0,,,,,1,,https://dynamic-media-cdn.tripadvisor.com/media/photo-o/1a/f6/f2/7a/default-avatar-2020-25.jpg?w=100&h=-1&s=1,
1775727977-7,https://www.tripadvisor.es/Restaurant_Review-g187514-d3599952-Reviews-Steak_Burger_Luchana-Madrid.html,todo estupendo sigen siendo una de las mejores experiencia que he tenido con la comida son una bomba! sin duda volverías,Karen G,Karen excelente todo riquísimo el ambiente súper bien y la comida súper exquisita el ambiente muy tranquilo y con buena música,3 contribuciones,Escrita el 3 de mayo de 2025,,Calidad/precio,Ambiente,Servicio,Comida,,"Esta es la opinión subjetiva de un miembro de Tripadvisor, no de Tripadvisor LLC. Tripadvisor realiza comprobaciones de las opiniones.",Leer más,0,,,,,3,,https://dynamic-media-cdn.tripadvisor.com/media/photo-o/1a/f6/f1/42/default-avatar-2020-20.jpg?w=100&h=-1&s=1,
1775727977-8,https://www.tripadvisor.es/Restaurant_Review-g187514-d3599952-Reviews-Steak_Burger_Luchana-Madrid.html,Excelente,patricia p,"Comida muy rica pero lo mejor como nos han atendido, Karen ha sido una camarera excelente nos ha atendido rápido y súper amable.",1 contribución,Escrita el 27 de abril de 2025,"Esta es la opinión subjetiva de un miembro de Tripadvisor, no de Tripadvisor LLC. Tripadvisor realiza comprobaciones de las opiniones.",,,,,,,Leer más,0,,,,,1,,https://dynamic-media-cdn.tripadvisor.com/media/photo-o/1a/f6/e9/ef/default-avatar-2020-66.jpg?w=100&h=-1&s=1,
1775727977-9,https://www.tripadvisor.es/Restaurant_Review-g187514-d3599952-Reviews-Steak_Burger_Luchana-Madrid.html,Volveremos! Nos gusta mucho,Raquel T,"Los trabajadores genial, muy simpáticos y amables, la comida está muy rica. El menú también en viernes es genial. Volveremos!",1 contribución,Escrita el 25 de abril de 2025,"Me encanta la Pampa, es mi favorita.",Calidad/precio,Ambiente,Servicio,Comida,"Esta es la opinión subjetiva de un miembro de Tripadvisor, no de Tripadvisor LLC. Tripadvisor realiza comprobaciones de las opiniones.",,Leer más,0,,,,,1,,https://dynamic-media-cdn.tripadvisor.com/media/photo-o/1a/f6/e2/a7/default-avatar-2020-44.jpg?w=100&h=-1&s=1,
1775727977-10,https://www.tripadvisor.es/Restaurant_Review-g187514-d3599952-Reviews-Steak_Burger_Luchana-Madrid.html,Mal servicio,Aurora,"Preguntó por una hamburguesa vegetariana y me preguntó a cuál apuntaba en el menú dijo que estaba bien. 

Conseguí una hamburguesa de carne y me la comí. Se enteró en el sitio web después de que no era vegetariano. Su menú no es muy claro. Este camarero obviamente tampoco era un buen oyente.",5 contribuciones,Escrita el 6 de diciembre de 2024,,,,,,,"Esta es la opinión subjetiva de un miembro de Tripadvisor, no de Tripadvisor LLC. Tripadvisor realiza comprobaciones de las opiniones.",Leer más,0,,,,,5,,https://dynamic-media-cdn.tripadvisor.com/media/photo-o/1a/f6/e8/ea/default-avatar-2020-63.jpg?w=100&h=-1&s=1,
1775727977-11,https://www.tripadvisor.es/Restaurant_Review-g187514-d3599952-Reviews-Steak_Burger_Luchana-Madrid.html,Cansados y con hambre,Cony C,"Muy Agradable lugar, estuvimos en la terraza y el ambiente fue confortable, recibimos un Buen trato desde la entrada, los sanitarios bien, la comida también. Nos sugirieron entrada de alitas ( bien ) y plato fuerte ordenamos unas hamburguesas y hasta jalapeños nos trajeron. Eso verdaderamente se aprecia. 
Fuimos atendidos por Bruno ( de origen Brasileño ) de manera cordial, y muy servicial, en todo momento se esforzó para atendernos en Español. y se fotografió con nosotros",20 contribuciones,Escrita el 22 de septiembre de 2024,,,,,,,"Esta es la opinión subjetiva de un miembro de Tripadvisor, no de Tripadvisor LLC. Tripadvisor realiza comprobaciones de las opiniones.",Leer más,1,,,,,20,,https://dynamic-media-cdn.tripadvisor.com/media/photo-o/1a/f6/de/e7/default-avatar-2020-37.jpg?w=100&h=-1&s=1,
1775727977-12,https://www.tripadvisor.es/Restaurant_Review-g187514-d3599952-Reviews-Steak_Burger_Luchana-Madrid.html,Ambiente agradable y buena atención,Lourdes A,"No tengo nada que ophetar.
Todo muy bien. Ambiente agradable, buena comida y la atención exelente.  Muy recomendado para todos",1 contribución,Escrita el 24 de agosto de 2024,,Calidad/precio,Ambiente,Servicio,Comida,,"Esta es la opinión subjetiva de un miembro de Tripadvisor, no de Tripadvisor LLC. Tripadvisor realiza comprobaciones de las opiniones.",Leer más,1,,,,,1,,https://dynamic-media-cdn.tripadvisor.com/media/photo-o/1a/f6/e7/3d/default-avatar-2020-55.jpg?w=100&h=-1&s=1,
1775727977-13,https://www.tripadvisor.es/Restaurant_Review-g187514-d3599952-Reviews-Steak_Burger_Luchana-Madrid.html,Repetiremos!!,jose javier d,"Genial el sitio, hamburguesas increíbles, acompañado de buen vino. repetiremos seguro.
Isabel, una gran profesional, muy atenta y agradable.
Muchísimas gracias!",2 contribuciones,Escrita el 21 de agosto de 2024,"Esta es la opinión subjetiva de un miembro de Tripadvisor, no de Tripadvisor LLC. Tripadvisor realiza comprobaciones de las opiniones.",,,,,,,Leer más,1,,,,,2,,https://dynamic-media-cdn.tripadvisor.com/media/photo-o/10/91/d7/79/jose-javier-d.jpg?w=100&h=-1&s=1,
1775727977-14,https://www.tripadvisor.es/Restaurant_Review-g187514-d3599952-Reviews-Steak_Burger_Luchana-Madrid.html,excelente,Wander21796039043,"sitio muy agradable y bien ubicado, fui con mis amigos a celebrar un cumple y la verdad que la comida y el servicio excelente, comimos costillas hamburguesas entrantes y todo estuvo genial volveremos quedamos encantados. gracias por todo!!!",1 contribución,Escrita el 19 de junio de 2024,,Calidad/precio,Ambiente,Servicio,Comida,,"Esta es la opinión subjetiva de un miembro de Tripadvisor, no de Tripadvisor LLC. Tripadvisor realiza comprobaciones de las opiniones.",Leer más,1,,,,,1,,https://dynamic-media-cdn.tripadvisor.com/media/photo-o/1a/f6/f1/79/default-avatar-2020-21.jpg?w=100&h=-1&s=1,
1775727977-15,https://www.tripadvisor.es/Restaurant_Review-g187514-d3599952-Reviews-Steak_Burger_Luchana-Madrid.html,Buena Experiencia,Suric N,"Muy buen lugar para comer, realmente es un ambiente diferente, fui en familia y la verdad que la comida, el trato y el servicio que prestan es inigualable, así que volveremos sin duda.",1 contribución,Escrita el 19 de junio de 2024,,Calidad/precio,Ambiente,Servicio,Comida,,"Esta es la opinión subjetiva de un miembro de Tripadvisor, no de Tripadvisor LLC. Tripadvisor realiza comprobaciones de las opiniones.",Leer más,1,,,,,1,,,
