web_scraper_order,web_scraper_start_url,data,data2,data3,data4,position,data5,data6,data7,data8,data9,data10,data11,data12,data13,data14,data15,image,data16,image2,data17,data18
1775669135-1,https://www.tripadvisor.es/Restaurant_Review-g187514-d10509960-Reviews-Oven_Mozzarella_Pizzeria_Las_Tablas-Madrid.html,Muy buena comida,Jusbeth M,"Nos gusta mucho este restaurante 
Muy buena atención por parte de Andrea y Ruth, la comida estaba deliciosa. 
Lo recomendamos sin duda",2 contribuciones,2.0,Escrita el 20 de octubre de 2024,"Madrid, España",oct 2024 • En familia,Calidad/precio,Ambiente,Servicio,Comida,,,Leer más,0,,,,,
1775669135-2,https://www.tripadvisor.es/Restaurant_Review-g187514-d10509960-Reviews-Oven_Mozzarella_Pizzeria_Las_Tablas-Madrid.html,Recomendable,Ismael F,"Comimos 4 personas y todo estaba muy rico. Dos niños y dos adultos. Tardó un poco en llegar los primeros, pero nada preocupante",1 contribución,1.0,Escrita el 20 de octubre de 2024,1 contribución,oct 2024 • En familia,,,,,,"Esta es la opinión subjetiva de un miembro de Tripadvisor, no de Tripadvisor LLC. Tripadvisor realiza comprobaciones de las opiniones.",Leer más,0,https://dynamic-media-cdn.tripadvisor.com/media/photo-o/1a/f6/e3/6a/default-avatar-2020-47.jpg?w=100&h=-1&s=1,,,,
1775669135-3,https://www.tripadvisor.es/Restaurant_Review-g187514-d10509960-Reviews-Oven_Mozzarella_Pizzeria_Las_Tablas-Madrid.html,Reseña Cena,Christian M,"Servicio muy bueno y atento en todo momento (nos atendió Carmen),  buen ambiente y la comida bastante rica en general. Muy contentos con la experiencia.",1 contribución,1.0,Escrita el 19 de octubre de 2024,1 contribución,oct 2024 • Amigos,Calidad/precio,Ambiente,Servicio,Comida,"Esta es la opinión subjetiva de un miembro de Tripadvisor, no de Tripadvisor LLC. Tripadvisor realiza comprobaciones de las opiniones.",,Leer más,0,https://dynamic-media-cdn.tripadvisor.com/media/photo-o/1a/f6/f2/b8/default-avatar-2020-26.jpg?w=100&h=-1&s=1,,,,
1775669135-4,https://www.tripadvisor.es/Restaurant_Review-g187514-d10509960-Reviews-Oven_Mozzarella_Pizzeria_Las_Tablas-Madrid.html,Cena familiar con buena atención,Gabriel C,"Lugar ideal para compartir en familia, tanto la comida como la atención ha sido de 10. Mención especial para Carmen que tuvo un trato excepcional.",1 contribución,1.0,Escrita el 19 de octubre de 2024,1 contribución,oct 2024 • En familia,,,,,,"Esta es la opinión subjetiva de un miembro de Tripadvisor, no de Tripadvisor LLC. Tripadvisor realiza comprobaciones de las opiniones.",Leer más,0,https://dynamic-media-cdn.tripadvisor.com/media/photo-o/1a/f6/de/e7/default-avatar-2020-37.jpg?w=100&h=-1&s=1,,,,
1775669135-5,https://www.tripadvisor.es/Restaurant_Review-g187514-d10509960-Reviews-Oven_Mozzarella_Pizzeria_Las_Tablas-Madrid.html,Excelente atención y comida,Paulo F,"Muy amable los camareros, las 4 pizzas que pedimos increíbles, son duda alguna volveremos!!! Carmen es una crackkkkk!",1 contribución,1.0,Escrita el 19 de octubre de 2024,1 contribución,oct 2024 • En familia,Calidad/precio,Ambiente,Servicio,Comida,"Esta es la opinión subjetiva de un miembro de Tripadvisor, no de Tripadvisor LLC. Tripadvisor realiza comprobaciones de las opiniones.",,Leer más,0,https://dynamic-media-cdn.tripadvisor.com/media/photo-o/1a/f6/ec/3d/default-avatar-2020-1.jpg?w=100&h=-1&s=1,,,,
1775669135-6,https://www.tripadvisor.es/Restaurant_Review-g187514-d10509960-Reviews-Oven_Mozzarella_Pizzeria_Las_Tablas-Madrid.html,Cena,alicia m,"Hoy hemos sido atendidos por Alex. Ha sido todo un profesional incluso cuando el rte estaba lleno. 
Siempre que vamos nos sentimos como en casa. Tengo que destacar que todos los camareros nos han atendido siempre con una sonrisa incluso cuando han estado saturados.",1 contribución,1.0,Escrita el 18 de octubre de 2024,1 contribución,oct 2024 • En familia,Calidad/precio,Ambiente,Servicio,Comida,"Esta es la opinión subjetiva de un miembro de Tripadvisor, no de Tripadvisor LLC. Tripadvisor realiza comprobaciones de las opiniones.",,Leer más,0,https://dynamic-media-cdn.tripadvisor.com/media/photo-o/1a/f6/f1/42/default-avatar-2020-20.jpg?w=100&h=-1&s=1,,,,
1775669135-7,https://www.tripadvisor.es/Restaurant_Review-g187514-d10509960-Reviews-Oven_Mozzarella_Pizzeria_Las_Tablas-Madrid.html,Completo y abundante,Carlos AP,"Atendidos por Carmen que es un amor. menú está basado en comida italiana, siendo completo y abundante. Repetiremos seguro",1 contribución,1.0,Escrita el 16 de octubre de 2024,"Getafe, España",oct 2024 • Amigos,,,,,,"Esta es la opinión subjetiva de un miembro de Tripadvisor, no de Tripadvisor LLC. Tripadvisor realiza comprobaciones de las opiniones.",Leer más,0,https://dynamic-media-cdn.tripadvisor.com/media/photo-o/1a/f6/e2/4a/default-avatar-2020-42.jpg?w=100&h=-1&s=1,,,,
1775669135-8,https://www.tripadvisor.es/Restaurant_Review-g187514-d10509960-Reviews-Oven_Mozzarella_Pizzeria_Las_Tablas-Madrid.html,fantástico!,Alicia ZR,"muy rica la comida y la atención de Carmen maravillosa.
la comida muy rica, buenas cantidades. ambiente cómodo y bonito",8 contribuciones,8.0,Escrita el 16 de octubre de 2024,"Madrid, España",oct 2024 • Amigos,,,,,,"Esta es la opinión subjetiva de un miembro de Tripadvisor, no de Tripadvisor LLC. Tripadvisor realiza comprobaciones de las opiniones.",Leer más,0,https://dynamic-media-cdn.tripadvisor.com/media/photo-o/09/ad/f3/08/salivados.jpg?w=100&h=-1&s=1,,,,
1775669135-9,https://www.tripadvisor.es/Restaurant_Review-g187514-d10509960-Reviews-Oven_Mozzarella_Pizzeria_Las_Tablas-Madrid.html,Buena experiencia,Oscar A,"Muy bonito local, sabrosa comida y servicio muy cordial de parte de Carmen. La pizza demoró un poco más de lo normal pero nos han pedido disculpas.",5 contribuciones,5.0,Escrita el 14 de octubre de 2024,"Múnich, Alemania",oct 2024 • En familia,,,,,,"Esta es la opinión subjetiva de un miembro de Tripadvisor, no de Tripadvisor LLC. Tripadvisor realiza comprobaciones de las opiniones.",Leer más,0,https://dynamic-media-cdn.tripadvisor.com/media/photo-o/1a/f6/ee/db/default-avatar-2020-10.jpg?w=100&h=-1&s=1,,,,
1775669135-10,https://www.tripadvisor.es/Restaurant_Review-g187514-d10509960-Reviews-Oven_Mozzarella_Pizzeria_Las_Tablas-Madrid.html,NADA ESPECIAL,José Carlos V,"La comida correcta. El servicio normal, tirando a despistado. Me pareció algo caro para lo ofrecido. Platos de pasta, todos en torno a 18€.
Un detalle que creo deberían mejorar es mostrar el precio de los platos en su página web. No sabes cuánto cuestan hasta que llegas al restaurante y te descargas la carta con el QR.",450 contribuciones,450.0,Escrita el 13 de octubre de 2024,"Alcalá de Henares, España",oct 2024 • En familia,,,,,,"Esta es la opinión subjetiva de un miembro de Tripadvisor, no de Tripadvisor LLC. Tripadvisor realiza comprobaciones de las opiniones.",Leer más,0,https://dynamic-media-cdn.tripadvisor.com/media/photo-o/1b/41/27/4e/jocarve.jpg?w=100&h=-1&s=1,,,,
1775669135-11,https://www.tripadvisor.es/Restaurant_Review-g187514-d10509960-Reviews-Oven_Mozzarella_Pizzeria_Las_Tablas-Madrid.html,Buenisimo italiano y Lesli estupenda camarera,perubi0,"La camarera Lesli muy atenta y educada. La comida magnífica, tanto aperitivos, platos principales y postres.
Buenisimo italiano en Las Tablas.
Volveremos",15 contribuciones,15.0,Escrita el 6 de octubre de 2024,"Madrid, España",oct 2024 • En familia,,,,,,"Esta es la opinión subjetiva de un miembro de Tripadvisor, no de Tripadvisor LLC. Tripadvisor realiza comprobaciones de las opiniones.",Leer más,0,https://dynamic-media-cdn.tripadvisor.com/media/photo-o/1a/f6/eb/a3/default-avatar-2020-38.jpg?w=100&h=-1&s=1,,,,
1775669135-12,https://www.tripadvisor.es/Restaurant_Review-g187514-d10509960-Reviews-Oven_Mozzarella_Pizzeria_Las_Tablas-Madrid.html,Cena de calidad y sabor en familia,Aluque L,"Nos hemos hecho asiduos por los platos, los ingredientes de los mismos y con buena atención. Hoy nos atendió Carmen y lo cierto es que ha sido muy amable y atenta.",2 contribuciones,2.0,Escrita el 5 de octubre de 2024,2 contribuciones,oct 2024 • En familia,,,,,,"Esta es la opinión subjetiva de un miembro de Tripadvisor, no de Tripadvisor LLC. Tripadvisor realiza comprobaciones de las opiniones.",Leer más,0,,,,,
1775669135-13,https://www.tripadvisor.es/Restaurant_Review-g187514-d10509960-Reviews-Oven_Mozzarella_Pizzeria_Las_Tablas-Madrid.html,"Está bien, aunque un poco caro.",Magic66,"Muy rico todo y muy bien atendidos por Leslie. Como algo negativo, es que es un poco caro en comparación con otros italianos.",22 contribuciones,22.0,Escrita el 5 de octubre de 2024,"Badajoz, España",oct 2024 • En familia,,,,,,"Esta es la opinión subjetiva de un miembro de Tripadvisor, no de Tripadvisor LLC. Tripadvisor realiza comprobaciones de las opiniones.",Leer más,0,https://dynamic-media-cdn.tripadvisor.com/media/photo-o/1b/46/16/eb/magic66.jpg?w=100&h=-1&s=1,,,,
1775669135-14,https://www.tripadvisor.es/Restaurant_Review-g187514-d10509960-Reviews-Oven_Mozzarella_Pizzeria_Las_Tablas-Madrid.html,Genial,Bea C,La cena fue espectacular y Carmen nos atendió de maravilla y tuvo con nosotros un detalle precioso por ser el cumpleaños de mi hermana,4 contribuciones,4.0,Escrita el 4 de octubre de 2024,4 contribuciones,oct 2024 • En familia,,,,,,"Esta es la opinión subjetiva de un miembro de Tripadvisor, no de Tripadvisor LLC. Tripadvisor realiza comprobaciones de las opiniones.",Leer más,0,https://dynamic-media-cdn.tripadvisor.com/media/photo-o/1a/f6/df/99/default-avatar-2020-40.jpg?w=100&h=-1&s=1,,,,
1775669135-15,https://www.tripadvisor.es/Restaurant_Review-g187514-d10509960-Reviews-Oven_Mozzarella_Pizzeria_Las_Tablas-Madrid.html,Bellisimo,Miguel C,"Está genial para una salida informal de cena en pareja, buena comida italiana (tanto pasta como pizza) buena decoración y genial atención.",3 contribuciones,3.0,Escrita el 4 de octubre de 2024,3 contribuciones,oct 2024 • Parejas,Calidad/precio,Ambiente,Servicio,Comida,"Esta es la opinión subjetiva de un miembro de Tripadvisor, no de Tripadvisor LLC. Tripadvisor realiza comprobaciones de las opiniones.",,Leer más,0,https://dynamic-media-cdn.tripadvisor.com/media/photo-o/1a/f6/e6/ea/default-avatar-2020-54.jpg?w=100&h=-1&s=1,,,,
1775669124-1,https://www.tripadvisor.es/Restaurant_Review-g187514-d10509960-Reviews-Oven_Mozzarella_Pizzeria_Las_Tablas-Madrid.html,"Comida deliciosa en ambiente agradable, gracias Carmen por atendernos tan bien",Sergio Mate,"Comida en la zona de la terraza, con mi madre, hemos estado muy tranquilas, muy bien atendidas por Carmen que nos ha asesorado en la elección de platos deliciosos del menú y ha estado atenta en todo momento. Volveremos pronto, muchas gracias",,,13 contribuciones,Escrita el 5 de noviembre de 2024,13,"Madrid, España","Esta es la opinión subjetiva de un miembro de Tripadvisor, no de Tripadvisor LLC. Tripadvisor realiza comprobaciones de las opiniones.",,Leer más,0,,,,https://dynamic-media-cdn.tripadvisor.com/media/photo-o/1a/f6/e9/ef/default-avatar-2020-66.jpg?w=100&h=-1&s=1,,,,
1775669124-2,https://www.tripadvisor.es/Restaurant_Review-g187514-d10509960-Reviews-Oven_Mozzarella_Pizzeria_Las_Tablas-Madrid.html,Muy rico,Patricia S,"Comimos genial y el camarero encantador y muy atento, se llamaba Alex. 
Probamos el risotto y la pasta estrella de Oven y nos encantó.",,,1 contribución,Escrita el 1 de noviembre de 2024,1,1 contribución,"Esta es la opinión subjetiva de un miembro de Tripadvisor, no de Tripadvisor LLC. Tripadvisor realiza comprobaciones de las opiniones.",,Leer más,0,,,,https://dynamic-media-cdn.tripadvisor.com/media/photo-o/1a/f6/e2/11/default-avatar-2020-41.jpg?w=100&h=-1&s=1,,,,
1775669124-3,https://www.tripadvisor.es/Restaurant_Review-g187514-d10509960-Reviews-Oven_Mozzarella_Pizzeria_Las_Tablas-Madrid.html,Genial!!,Odyssey62950885525,"La comida super rica y el servicio muy bueno. Carmen, que atendió nuestra mesa, es muy amable. Volveremos seguro!!!!!!",,,1 contribución,Escrita el 31 de octubre de 2024,1,"Madrid, España",,"Esta es la opinión subjetiva de un miembro de Tripadvisor, no de Tripadvisor LLC. Tripadvisor realiza comprobaciones de las opiniones.",Leer más,0,,,,,,,,
1775669124-4,https://www.tripadvisor.es/Restaurant_Review-g187514-d10509960-Reviews-Oven_Mozzarella_Pizzeria_Las_Tablas-Madrid.html,Cena entre amigos!,Luis E,"Excelente  experiencia,  buen ambiente, atención muy agradable  gracias a la camarera Carmen!..  recomendable 100%, volveremos!",,,1 contribución,Escrita el 30 de octubre de 2024,1,1 contribución,"Esta es la opinión subjetiva de un miembro de Tripadvisor, no de Tripadvisor LLC. Tripadvisor realiza comprobaciones de las opiniones.",,Leer más,0,,,,https://dynamic-media-cdn.tripadvisor.com/media/photo-o/1a/f6/ee/10/default-avatar-2020-8.jpg?w=100&h=-1&s=1,,,,
1775669124-5,https://www.tripadvisor.es/Restaurant_Review-g187514-d10509960-Reviews-Oven_Mozzarella_Pizzeria_Las_Tablas-Madrid.html,Excelente servicio de la sta carmen,Liria R,Excelente servicio la camarera carmen nos dio una atención increíble. Esperamos volver pronto a comernos una pizza. Buen rollo,,,1 contribución,Escrita el 30 de octubre de 2024,1,1 contribución,"Esta es la opinión subjetiva de un miembro de Tripadvisor, no de Tripadvisor LLC. Tripadvisor realiza comprobaciones de las opiniones.",,Leer más,0,,,,https://dynamic-media-cdn.tripadvisor.com/media/photo-o/1a/f6/77/ae/default-avatar-2020-2.jpg?w=100&h=-1&s=1,,,,
1775669124-6,https://www.tripadvisor.es/Restaurant_Review-g187514-d10509960-Reviews-Oven_Mozzarella_Pizzeria_Las_Tablas-Madrid.html,Excelente,Frank D,"Excelente, carmen fue genial,  el local está muy chulo, se pasa un rato agradable en sus instalaciones, gracias por sus atenciones",,,1 contribución,Escrita el 30 de octubre de 2024,1,1 contribución,"Esta es la opinión subjetiva de un miembro de Tripadvisor, no de Tripadvisor LLC. Tripadvisor realiza comprobaciones de las opiniones.",,Leer más,0,,,,https://dynamic-media-cdn.tripadvisor.com/media/photo-o/1a/f6/eb/a3/default-avatar-2020-38.jpg?w=100&h=-1&s=1,,,,
1775669124-7,https://www.tripadvisor.es/Restaurant_Review-g187514-d10509960-Reviews-Oven_Mozzarella_Pizzeria_Las_Tablas-Madrid.html,Agradable en todos los sentidos,Rosa Blanca O,"El sitio es muy agradable, el servicio excelente , nos ha atendido Andrea y es muy atenta y la comida estaba divina! Hemos pedido pizza campesina y la ensalada de espinaca con extra de pollo, todo delicioso. Segunda vez que venimos y tanto la atención como la calidad de la comida se han mantenido. Volveremos seguro!",,,1 contribución,Escrita el 30 de octubre de 2024,1,1 contribución,,"Esta es la opinión subjetiva de un miembro de Tripadvisor, no de Tripadvisor LLC. Tripadvisor realiza comprobaciones de las opiniones.",Leer más,0,,,,,,,,
1775669124-8,https://www.tripadvisor.es/Restaurant_Review-g187514-d10509960-Reviews-Oven_Mozzarella_Pizzeria_Las_Tablas-Madrid.html,Muy rico y buen servicio,Ángeles R,"Muy rica la comida. Nos atendió Carmen y el servicio estuvo muy bueno. Ágil y amable. Y el mejor cierre, me trajeron una tarta con velita por mi cumpleaños :)",,,1 contribución,Escrita el 29 de octubre de 2024,1,1 contribución,"Esta es la opinión subjetiva de un miembro de Tripadvisor, no de Tripadvisor LLC. Tripadvisor realiza comprobaciones de las opiniones.",,Leer más,0,,,,https://dynamic-media-cdn.tripadvisor.com/media/photo-o/1a/f6/f1/79/default-avatar-2020-21.jpg?w=100&h=-1&s=1,,,,
1775669124-9,https://www.tripadvisor.es/Restaurant_Review-g187514-d10509960-Reviews-Oven_Mozzarella_Pizzeria_Las_Tablas-Madrid.html,Lugar acogedor,Sonia C,Oven no falla nunca. Todos sus platos son deliciosos. Hemos cenado con amigas y lo hemos pasado muy bien. Nos ha atendido Carmen quien ha sido muy amable y servicial. Volveremos!,,,24 contribuciones,Escrita el 29 de octubre de 2024,24,24 contribuciones,"Esta es la opinión subjetiva de un miembro de Tripadvisor, no de Tripadvisor LLC. Tripadvisor realiza comprobaciones de las opiniones.",,Leer más,0,,,,https://dynamic-media-cdn.tripadvisor.com/media/photo-o/1a/f6/de/e7/default-avatar-2020-37.jpg?w=100&h=-1&s=1,,,,
1775669124-10,https://www.tripadvisor.es/Restaurant_Review-g187514-d10509960-Reviews-Oven_Mozzarella_Pizzeria_Las_Tablas-Madrid.html,Cena con amigas,Soledad R,"Cena con amigas! Carmen ha sido super amable y calida en su atencion! Todo riquisimo, menu variado y delicioso. Volvere!",,,3 contribuciones,Escrita el 29 de octubre de 2024,3,3 contribuciones,"Esta es la opinión subjetiva de un miembro de Tripadvisor, no de Tripadvisor LLC. Tripadvisor realiza comprobaciones de las opiniones.",,Leer más,0,,,,https://dynamic-media-cdn.tripadvisor.com/media/photo-o/1a/f6/e7/7b/default-avatar-2020-56.jpg?w=100&h=-1&s=1,,,,
1775669124-11,https://www.tripadvisor.es/Restaurant_Review-g187514-d10509960-Reviews-Oven_Mozzarella_Pizzeria_Las_Tablas-Madrid.html,"Genial, como siempre",Lydia T,Vengo mucho con mi pareja y amigos y el trato y comida siempre están a la altura. Dariela nos atendió de 10 preocupándose de todo detalle. La cena muy rica. Seguiré repitiendo.,,,1 contribución,Escrita el 25 de octubre de 2024,1,1 contribución,,"Esta es la opinión subjetiva de un miembro de Tripadvisor, no de Tripadvisor LLC. Tripadvisor realiza comprobaciones de las opiniones.",Leer más,0,,,,https://dynamic-media-cdn.tripadvisor.com/media/photo-o/1a/f6/e3/1f/default-avatar-2020-46.jpg?w=100&h=-1&s=1,,,,
1775669124-12,https://www.tripadvisor.es/Restaurant_Review-g187514-d10509960-Reviews-Oven_Mozzarella_Pizzeria_Las_Tablas-Madrid.html,Genial,Jaime V,Tanto la comida como el servicio excelentes. Mucha cantidad y todo de muy buena calidad. Carmen muy atenta a todo lo que necesitaramos,,,1 contribución,Escrita el 22 de octubre de 2024,1,1 contribución,"Esta es la opinión subjetiva de un miembro de Tripadvisor, no de Tripadvisor LLC. Tripadvisor realiza comprobaciones de las opiniones.",,Leer más,0,,,,https://dynamic-media-cdn.tripadvisor.com/media/photo-o/1a/f6/de/0a/default-avatar-2020-35.jpg?w=100&h=-1&s=1,,,,
1775669124-13,https://www.tripadvisor.es/Restaurant_Review-g187514-d10509960-Reviews-Oven_Mozzarella_Pizzeria_Las_Tablas-Madrid.html,Todo muy bien. Oa pizza bbq y el coulant muy buenos. El local está decorado de manera excelente y la música de fondo muy bien es,David M,"Todo muy bueno. Pizza bbq y biscotti. El local precioso y la música ambiental perfectamente escogida.

Si vuelvo por Madrid repetiré",,,9 contribuciones,Escrita el 22 de octubre de 2024,9,"Cassa de la Selva, España","Esta es la opinión subjetiva de un miembro de Tripadvisor, no de Tripadvisor LLC. Tripadvisor realiza comprobaciones de las opiniones.",,Leer más,0,,,,https://dynamic-media-cdn.tripadvisor.com/media/photo-o/1a/f6/ec/a2/default-avatar-2020-3.jpg?w=100&h=-1&s=1,,,,
1775669124-14,https://www.tripadvisor.es/Restaurant_Review-g187514-d10509960-Reviews-Oven_Mozzarella_Pizzeria_Las_Tablas-Madrid.html,Perfecto para disfrutar de una cena tranquila,Curiosity56139086785,"Estaba todo buenísimo, recomiendo la burrata con trufa y la pasta con setas y trufa. Fuimos muy bien atendidos por Carmen, muchas gracias!",,,1 contribución,Escrita el 22 de octubre de 2024,1,1 contribución,"Esta es la opinión subjetiva de un miembro de Tripadvisor, no de Tripadvisor LLC. Tripadvisor realiza comprobaciones de las opiniones.",,Leer más,0,,,,https://dynamic-media-cdn.tripadvisor.com/media/photo-o/1a/f6/e7/7b/default-avatar-2020-56.jpg?w=100&h=-1&s=1,,,,
1775669124-15,https://www.tripadvisor.es/Restaurant_Review-g187514-d10509960-Reviews-Oven_Mozzarella_Pizzeria_Las_Tablas-Madrid.html,Excelente,Yamercy R,Todas las recomendaciones de Andre fueron muy acertada. La entrada excelente igual que los platos. Volveremos pronto. Recomendado un 100%. No quedará mal,,,1 contribución,Escrita el 20 de octubre de 2024,1,1 contribución,,"Esta es la opinión subjetiva de un miembro de Tripadvisor, no de Tripadvisor LLC. Tripadvisor realiza comprobaciones de las opiniones.",Leer más,0,,,,https://dynamic-media-cdn.tripadvisor.com/media/photo-o/1a/f6/e7/99/default-avatar-2020-57.jpg?w=100&h=-1&s=1,,,,
1775669110-1,https://www.tripadvisor.es/Restaurant_Review-g187514-d10509960-Reviews-Oven_Mozzarella_Pizzeria_Las_Tablas-Madrid.html,"Vreselijke bediening en het eten van €118 grotendeels laten staan. Terrible servicio, y la mayor parte de la comida de 118€ se dejó",Twan G,"Vreselijke bediening en het eten van € 118 , - laten staan. Na 1 uur pas het eerste bebido. Na 1 , 5 horas después. Huevo escalfado laten liggen, pasta completa zo waterig era en amper vegetarische opties. 

Terrible servicio, y dejamos los 118€ de comida atrás. Tomó 1 hora para obtener las primeras bebidas y 1 . 5 horas para el primer plato. El huevo escalfado estaba intacto, la pasta era tan acuosa y apenas había opciones vegetarianas.",,1.0,1 contribución,Escrita el 1 de enero de 2025,"Bruselas, Bélgica",,Leer más,0,,,,,,https://dynamic-media-cdn.tripadvisor.com/media/photo-o/1a/f6/e5/2b/default-avatar-2020-52.jpg?w=100&h=-1&s=1,,,,
1775669110-2,https://www.tripadvisor.es/Restaurant_Review-g187514-d10509960-Reviews-Oven_Mozzarella_Pizzeria_Las_Tablas-Madrid.html,Comida rica y buena atención,Maur Barroso,"La comida muy bien, como siempre. Jackson siempre muy atento y educado. No doy 5 estrellas por la subida considerable de los precios.",,32.0,32 contribuciones,Escrita el 21 de diciembre de 2024,"Madrid, España","Esta es la opinión subjetiva de un miembro de Tripadvisor, no de Tripadvisor LLC. Tripadvisor realiza comprobaciones de las opiniones.",Leer más,0,,,,,,https://dynamic-media-cdn.tripadvisor.com/media/photo-o/13/66/07/e5/maur-b.jpg?w=100&h=-1&s=1,,,,
1775669110-3,https://www.tripadvisor.es/Restaurant_Review-g187514-d10509960-Reviews-Oven_Mozzarella_Pizzeria_Las_Tablas-Madrid.html,Comida negocios,Miguel R,Muy buena comida y atención por parte de Andrea. Lugar al que volver cuando estás por Las Tablas en Madrid. Muy rico todo y menú del día muy recomendable,,2.0,2 contribuciones,Escrita el 3 de diciembre de 2024,2 contribuciones,"Esta es la opinión subjetiva de un miembro de Tripadvisor, no de Tripadvisor LLC. Tripadvisor realiza comprobaciones de las opiniones.",Leer más,0,,,,,,https://dynamic-media-cdn.tripadvisor.com/media/photo-o/1a/f6/f3/23/default-avatar-2020-28.jpg?w=100&h=-1&s=1,,,,
1775669110-4,https://www.tripadvisor.es/Restaurant_Review-g187514-d10509960-Reviews-Oven_Mozzarella_Pizzeria_Las_Tablas-Madrid.html,Muy bueno,Beatriz D,"Todo muy rico y Andrea quien nos atendió muy amable.
Pedimos pasta y la milanesa con pasta y de postre un tiramisú súper rico.
Ambiente bueno sin excesivo ruido.",,1.0,1 contribución,Escrita el 30 de noviembre de 2024,1 contribución,"Esta es la opinión subjetiva de un miembro de Tripadvisor, no de Tripadvisor LLC. Tripadvisor realiza comprobaciones de las opiniones.",Leer más,0,,,,,,https://dynamic-media-cdn.tripadvisor.com/media/photo-o/1a/f6/f0/9f/default-avatar-2020-16.jpg?w=100&h=-1&s=1,,,,
1775669110-5,https://www.tripadvisor.es/Restaurant_Review-g187514-d10509960-Reviews-Oven_Mozzarella_Pizzeria_Las_Tablas-Madrid.html,Super recomendable!!!!,Carina B,"Nos ha encantado! Todo estaba riquisimo, muy buena calidad. El local es muy acogedor y Andrea nos ha tratado de maravilla.",,6.0,6 contribuciones,Escrita el 28 de noviembre de 2024,"Granada, España","Esta es la opinión subjetiva de un miembro de Tripadvisor, no de Tripadvisor LLC. Tripadvisor realiza comprobaciones de las opiniones.",Leer más,0,,,,,,https://dynamic-media-cdn.tripadvisor.com/media/photo-o/1a/f6/7c/01/default-avatar-2020-5.jpg?w=100&h=-1&s=1,,,,
1775669110-6,https://www.tripadvisor.es/Restaurant_Review-g187514-d10509960-Reviews-Oven_Mozzarella_Pizzeria_Las_Tablas-Madrid.html,"Correcto, recomendable",jose felix r,"Trato agradable, relación calidad precio buena, pedimos pizza, berenjena y afocato, servicio rápido y bien elaborado 🙂👍",,3.0,3 contribuciones,Escrita el 16 de noviembre de 2024,3 contribuciones,"Reservar, suele estar completo",Leer más,0,,,,,,https://dynamic-media-cdn.tripadvisor.com/media/photo-o/1a/f6/f2/eb/default-avatar-2020-27.jpg?w=100&h=-1&s=1,,,,
1775669110-7,https://www.tripadvisor.es/Restaurant_Review-g187514-d10509960-Reviews-Oven_Mozzarella_Pizzeria_Las_Tablas-Madrid.html,Muy bien,Javier P,"El sitio es acogedor, el servicio muy agradable. Carmen ha sido un encanto y nos ha atendido fenomenal. La comida estupenda.
 Recomendamos los rigatonni al forno.",,2.0,2 contribuciones,Escrita el 16 de noviembre de 2024,"San Agustín de Guadalix, España","Esta es la opinión subjetiva de un miembro de Tripadvisor, no de Tripadvisor LLC. Tripadvisor realiza comprobaciones de las opiniones.",Leer más,0,,,,,,https://dynamic-media-cdn.tripadvisor.com/media/photo-o/1a/f6/e9/bb/default-avatar-2020-65.jpg?w=100&h=-1&s=1,,,,
1775669110-8,https://www.tripadvisor.es/Restaurant_Review-g187514-d10509960-Reviews-Oven_Mozzarella_Pizzeria_Las_Tablas-Madrid.html,Perfecto,carlos d,"El trato fue increíble. Carmen nos trató súper bien. Además, estuvo atenta a todo lo que necesitáramos. Volveré lo antes posible :)",,1.0,1 contribución,Escrita el 15 de noviembre de 2024,1 contribución,"Esta es la opinión subjetiva de un miembro de Tripadvisor, no de Tripadvisor LLC. Tripadvisor realiza comprobaciones de las opiniones.",Leer más,0,,,,,,https://dynamic-media-cdn.tripadvisor.com/media/photo-o/1a/f6/eb/6d/default-avatar-2020-19.jpg?w=100&h=-1&s=1,,,,
