1776248045-13,https://www.tripadvisor.es/Restaurant_Review-g187514-d33094616-Reviews-Asado_Central-Madrid.html,La atención es excepcional 👏👏,Nicolas B,"Excelente atención y calidad de la comida! La parrillada espectacular!
Obvio que voy a volver ❤️",,Escrita el 1 de marzo de 2026,1 contribución,Calidad/precio,Comida,Servicio,Ambiente,,,Leer más,1.0,0,,https://dynamic-media-cdn.tripadvisor.com/media/photo-o/32/91/a3/7d/caption.jpg?w=300&h=300&s=1,https://dynamic-media-cdn.tripadvisor.com/media/photo-o/1a/f6/f1/42/default-avatar-2020-20.jpg?w=100&h=-1&s=1
1776248045-14,https://www.tripadvisor.es/Restaurant_Review-g187514-d33094616-Reviews-Asado_Central-Madrid.html,Súper recomendable,Celeste Gisella G,Excelente la comida muy rico y abundante. La atención un 10!,,Escrita el 1 de marzo de 2026,1 contribución,Calidad/precio,Comida,Servicio,Ambiente,La parrillada y la chocotorta son exquisitas,,Leer más,1.0,0,,https://dynamic-media-cdn.tripadvisor.com/media/photo-o/32/91/a3/51/caption.jpg?w=300&h=300&s=1,https://dynamic-media-cdn.tripadvisor.com/media/photo-o/1a/f6/ee/10/default-avatar-2020-8.jpg?w=100&h=-1&s=1
1776248045-15,https://www.tripadvisor.es/Restaurant_Review-g187514-d33094616-Reviews-Asado_Central-Madrid.html,Buena carne tal como debe estar,Lorenz S,"Carne excelente, servicio muy atento y amable, el local muy simple sin mucho fifi. Dentro de todo una muy buena experiencia parillera. 
Si quieres una buena parillada sin mucho cuenteo es el local óptimo.",,Escrita el 20 de febrero de 2026,1 contribución,Calidad/precio,Comida,Servicio,Ambiente,,"Esta es la opinión subjetiva de un miembro de Tripadvisor, no de Tripadvisor LLC. Tripadvisor realiza comprobaciones de las opiniones.",Leer más,1.0,0,,,https://dynamic-media-cdn.tripadvisor.com/media/photo-o/1a/f6/ea/74/default-avatar-2020-68.jpg?w=100&h=-1&s=1
1776247998-1,https://www.tripadvisor.es/Restaurant_Review-g187514-d33094616-Reviews-Asado_Central-Madrid.html,Muy buena atención.,Alvaro G,Muy buena atención de los camareros. La comida excelente y buen precio con el tenedor.,,Escrita el 12 de abril de 2026,1,,,,,"Esta es la opinión subjetiva de un miembro de Tripadvisor, no de Tripadvisor LLC. Tripadvisor realiza comprobaciones de las opiniones.",,,,Leer más,0.0,https://dynamic-media-cdn.tripadvisor.com/media/photo-o/1a/f6/e7/3d/default-avatar-2020-55.jpg?w=100&h=-1&s=1,
1776247998-2,https://www.tripadvisor.es/Restaurant_Review-g187514-d33094616-Reviews-Asado_Central-Madrid.html,Carnes y empanadas perfectas,Tatiana S,"Pedimos un entrecot y estaba riquísimo. Las empanadas super crujientes, deliciosas. Nos ha encantado.",,Escrita el 6 de abril de 2026,1,,,,,"Esta es la opinión subjetiva de un miembro de Tripadvisor, no de Tripadvisor LLC. Tripadvisor realiza comprobaciones de las opiniones.",,,,Leer más,0.0,,
1776247998-3,https://www.tripadvisor.es/Restaurant_Review-g187514-d33094616-Reviews-Asado_Central-Madrid.html,Fenomenal,Journey49603106246,"Hemos comido hoy Jueves Santo 4 amigos, nos ha atendido Laura y Adrián fenomenal. Las empanadas argentinas muy ricas, la carne también. 
Muy recomendable, a través de la app El Tenedor. Repetiremos",,Escrita el 5 de abril de 2026,1,,,,,"Esta es la opinión subjetiva de un miembro de Tripadvisor, no de Tripadvisor LLC. Tripadvisor realiza comprobaciones de las opiniones.",,,,Leer más,0.0,https://dynamic-media-cdn.tripadvisor.com/media/photo-o/1a/f6/e2/e6/default-avatar-2020-45.jpg?w=100&h=-1&s=1,
1776247998-4,https://www.tripadvisor.es/Restaurant_Review-g187514-d33094616-Reviews-Asado_Central-Madrid.html,Comida muy buena. Trato excelente,Javier,"Trato excelente. 
Ha habido un problema con la reserva, hemos tenido que esperar un tiempo para poder cenar, pero lo han compensado sobradamente.
La comida muy rica, pero lo mejor, el trato del personal.",,Escrita el 5 de abril de 2026,1,,,,,"Esta es la opinión subjetiva de un miembro de Tripadvisor, no de Tripadvisor LLC. Tripadvisor realiza comprobaciones de las opiniones.",,,,Leer más,0.0,https://dynamic-media-cdn.tripadvisor.com/media/photo-o/1a/f6/e9/60/default-avatar-2020-64.jpg?w=100&h=-1&s=1,
1776247998-5,https://www.tripadvisor.es/Restaurant_Review-g187514-d33094616-Reviews-Asado_Central-Madrid.html,Buena comida,Aitor T,"Todo muy bueno, personal muy amable",,Escrita el 4 de abril de 2026,2,,,,,"Esta es la opinión subjetiva de un miembro de Tripadvisor, no de Tripadvisor LLC. Tripadvisor realiza comprobaciones de las opiniones.",,,,Leer más,0.0,https://dynamic-media-cdn.tripadvisor.com/media/photo-o/1a/f6/e7/3d/default-avatar-2020-55.jpg?w=100&h=-1&s=1,
1776247998-6,https://www.tripadvisor.es/Restaurant_Review-g187514-d33094616-Reviews-Asado_Central-Madrid.html,buena carne,Pau V,"muy bueno, personal muy atento",,Escrita el 4 de abril de 2026,1,,,,,"Esta es la opinión subjetiva de un miembro de Tripadvisor, no de Tripadvisor LLC. Tripadvisor realiza comprobaciones de las opiniones.",,,,Leer más,0.0,https://dynamic-media-cdn.tripadvisor.com/media/photo-o/1a/f6/de/5a/default-avatar-2020-36.jpg?w=100&h=-1&s=1,
1776247998-7,https://www.tripadvisor.es/Restaurant_Review-g187514-d33094616-Reviews-Asado_Central-Madrid.html,Buena carne y sabrosa. Resto a revisar,Javier,"Pedimos parrilla para 2 y una milanesa, la carne muy buena aunque la morcilla estaba fría por dentro. 
El punto de la carne pedimos muy  poco hecha y vino al punto menos. 
La milanesa normal, sin más.",,Escrita el 2 de abril de 2026,3,,,,,"Esta es la opinión subjetiva de un miembro de Tripadvisor, no de Tripadvisor LLC. Tripadvisor realiza comprobaciones de las opiniones.",,,,Leer más,0.0,https://dynamic-media-cdn.tripadvisor.com/media/photo-o/22/30/42/ff/jramosduran.jpg?w=100&h=-1&s=1,
1776247998-8,https://www.tripadvisor.es/Restaurant_Review-g187514-d33094616-Reviews-Asado_Central-Madrid.html,Increíble,Safari06322473562,"La camarera Grace fue muy amable y simpática, y nos recomendó muy bien. La comida estuvo muy buena",,Escrita el 2 de abril de 2026,1,,,,,"Esta es la opinión subjetiva de un miembro de Tripadvisor, no de Tripadvisor LLC. Tripadvisor realiza comprobaciones de las opiniones.",,,,Leer más,0.0,https://dynamic-media-cdn.tripadvisor.com/media/photo-o/1a/f6/e5/2b/default-avatar-2020-52.jpg?w=100&h=-1&s=1,
1776247998-9,https://www.tripadvisor.es/Restaurant_Review-g187514-d33094616-Reviews-Asado_Central-Madrid.html,Sitio muy agradable con buen personal,Teo M,"Todo muy bueno, el personal muy simpático (sobre todo la camarera Grace)",,Escrita el 2 de abril de 2026,1,Calidad/precio,Comida,Servicio,Ambiente,,"Esta es la opinión subjetiva de un miembro de Tripadvisor, no de Tripadvisor LLC. Tripadvisor realiza comprobaciones de las opiniones.",,,Leer más,0.0,https://dynamic-media-cdn.tripadvisor.com/media/photo-o/1a/f6/f4/20/default-avatar-2020-31.jpg?w=100&h=-1&s=1,
1776247998-10,https://www.tripadvisor.es/Restaurant_Review-g187514-d33094616-Reviews-Asado_Central-Madrid.html,Camarera,Antonio M,Muy rico y la camarera perfecta,,Escrita el 2 de abril de 2026,1,,,,,"Esta es la opinión subjetiva de un miembro de Tripadvisor, no de Tripadvisor LLC. Tripadvisor realiza comprobaciones de las opiniones.",,,,Leer más,0.0,https://dynamic-media-cdn.tripadvisor.com/media/photo-o/1a/f6/e9/ef/default-avatar-2020-66.jpg?w=100&h=-1&s=1,
1776247998-11,https://www.tripadvisor.es/Restaurant_Review-g187514-d33094616-Reviews-Asado_Central-Madrid.html,Completamente recomendable,Rubén M,"Comida de calidad y un trato excepcional. 
Completamente recomendable.",,Escrita el 1 de abril de 2026,1,Calidad/precio,Comida,Servicio,Ambiente,,"Esta es la opinión subjetiva de un miembro de Tripadvisor, no de Tripadvisor LLC. Tripadvisor realiza comprobaciones de las opiniones.",,,Leer más,0.0,https://dynamic-media-cdn.tripadvisor.com/media/photo-o/1a/f6/7c/01/default-avatar-2020-5.jpg?w=100&h=-1&s=1,
1776247998-12,https://www.tripadvisor.es/Restaurant_Review-g187514-d33094616-Reviews-Asado_Central-Madrid.html,"He ido con mi pareja y hemos quedados muy satisfechos con el servicio, la comida estaba deliciosa y servicio 10/10",Stefany A,"Muy buena experiencia, para repetir",,Escrita el 31 de marzo de 2026,1,Calidad/precio,Comida,Servicio,Ambiente,,"Esta es la opinión subjetiva de un miembro de Tripadvisor, no de Tripadvisor LLC. Tripadvisor realiza comprobaciones de las opiniones.",,,Leer más,0.0,https://dynamic-media-cdn.tripadvisor.com/media/photo-o/1a/f6/df/2b/default-avatar-2020-39.jpg?w=100&h=-1&s=1,
1776247998-13,https://www.tripadvisor.es/Restaurant_Review-g187514-d33094616-Reviews-Asado_Central-Madrid.html,Recomendable 100%,Carlos R,"Todo estupendo, tanto reto del personal como calidad de la comida",,Escrita el 29 de marzo de 2026,11,,,,,"Esta es la opinión subjetiva de un miembro de Tripadvisor, no de Tripadvisor LLC. Tripadvisor realiza comprobaciones de las opiniones.",,,,Leer más,0.0,https://dynamic-media-cdn.tripadvisor.com/media/photo-o/16/90/1b/e3/carlos-r.jpg?w=100&h=-1&s=1,
1776247998-14,https://www.tripadvisor.es/Restaurant_Review-g187514-d33094616-Reviews-Asado_Central-Madrid.html,Deliciosa parrilla.,Johan U,"Fuimos a celebrar el cumpleaños de mi hermana. La comida ha estado increíblemente deliciosa y la atención fue demasiado buena y los postres muy ricos, un excelente servicio por parte de todos. Volveremos.",,Escrita el 28 de marzo de 2026,1,,,,,,"Esta es la opinión subjetiva de un miembro de Tripadvisor, no de Tripadvisor LLC. Tripadvisor realiza comprobaciones de las opiniones.",,,Leer más,0.0,https://dynamic-media-cdn.tripadvisor.com/media/photo-o/1a/f6/f2/59/default-avatar-2020-24.jpg?w=100&h=-1&s=1,
1776247998-15,https://www.tripadvisor.es/Restaurant_Review-g187514-d33094616-Reviews-Asado_Central-Madrid.html,Calidad-precio,Journey43336142364,"Calidad-precio muy recomendable si vienes con mucha hambre . 
La atención de Erik de 10 muy atento y simpático . 
Lo recomiendo",,Escrita el 27 de marzo de 2026,1,,,,,"Esta es la opinión subjetiva de un miembro de Tripadvisor, no de Tripadvisor LLC. Tripadvisor realiza comprobaciones de las opiniones.",,,,Leer más,0.0,https://dynamic-media-cdn.tripadvisor.com/media/photo-o/1a/f6/f1/06/default-avatar-2020-18.jpg?w=100&h=-1&s=1,
1776248031-1,https://www.tripadvisor.es/Restaurant_Review-g187514-d33094616-Reviews-Asado_Central-Madrid.html,Buena carne y buen servicio,Nelo,"Un buen lugar de carne. Erik un camarero 10, muy atento.

El único punto negativo ha sido el pan de la hamburguesa, según el menú es brioche, pero ha llegado con el típico pan con pepitas descongelado (19€).

Por el resto guay.",Escrita el 15 de marzo de 2026,1 contribución,"Esta es la opinión subjetiva de un miembro de Tripadvisor, no de Tripadvisor LLC. Tripadvisor realiza comprobaciones de las opiniones.",mar 2026 • Amigos,,,,,,Leer más,1.0,0,,,https://dynamic-media-cdn.tripadvisor.com/media/photo-o/1a/f6/f2/7a/default-avatar-2020-25.jpg?w=100&h=-1&s=1
1776248031-2,https://www.tripadvisor.es/Restaurant_Review-g187514-d33094616-Reviews-Asado_Central-Madrid.html,Se come muy bien,Beatriz F,La carne está espectacular y la atención muy buena.  Repetiremos.,Escrita el 15 de marzo de 2026,"Madrid, España","Esta es la opinión subjetiva de un miembro de Tripadvisor, no de Tripadvisor LLC. Tripadvisor realiza comprobaciones de las opiniones.",mar 2026 • Parejas,,,,,,Leer más,60.0,0,,,https://dynamic-media-cdn.tripadvisor.com/media/photo-o/07/a4/bd/4c/beatriz-r.jpg?w=200&h=-1&s=1
1776248031-3,https://www.tripadvisor.es/Restaurant_Review-g187514-d33094616-Reviews-Asado_Central-Madrid.html,Cena Argentina,Gisela M,Comida deliciosa y servicio excelente.,Escrita el 15 de marzo de 2026,1 contribución,,mar 2026 • Parejas,,,,,"Esta es la opinión subjetiva de un miembro de Tripadvisor, no de Tripadvisor LLC. Tripadvisor realiza comprobaciones de las opiniones.",Leer más,1.0,0,,https://dynamic-media-cdn.tripadvisor.com/media/photo-o/32/af/26/83/caption.jpg?w=300&h=300&s=1,https://dynamic-media-cdn.tripadvisor.com/media/photo-o/1a/f6/de/5a/default-avatar-2020-36.jpg?w=100&h=-1&s=1
1776248031-4,https://www.tripadvisor.es/Restaurant_Review-g187514-d33094616-Reviews-Asado_Central-Madrid.html,Muy recomendable,Johan L,Excelente como siempre. Mi lugar argentino preferido en Madrid. La atención de Laura es insuperable,Escrita el 14 de marzo de 2026,1 contribución,,mar 2026 • Amigos,Calidad/precio,Comida,Servicio,Ambiente,"Esta es la opinión subjetiva de un miembro de Tripadvisor, no de Tripadvisor LLC. Tripadvisor realiza comprobaciones de las opiniones.",Leer más,1.0,0,,,https://dynamic-media-cdn.tripadvisor.com/media/photo-o/1a/f6/f2/11/default-avatar-2020-23.jpg?w=100&h=-1&s=1
1776248031-5,https://www.tripadvisor.es/Restaurant_Review-g187514-d33094616-Reviews-Asado_Central-Madrid.html,Almuerzo en familia!,Marynes S,"Laura muy amable!!! La comida súper rica, muy recomendado!",Escrita el 14 de marzo de 2026,1 contribución,Laura muy amable!! La comida deliciosa! Super recomendado!!,mar 2026 • En familia,Calidad/precio,Comida,Servicio,Ambiente,,Leer más,1.0,0,,https://dynamic-media-cdn.tripadvisor.com/media/photo-o/32/ae/d1/4d/caption.jpg?w=300&h=300&s=1,https://dynamic-media-cdn.tripadvisor.com/media/photo-o/1a/f6/ef/9c/default-avatar-2020-14.jpg?w=100&h=-1&s=1
1776248031-6,https://www.tripadvisor.es/Restaurant_Review-g187514-d33094616-Reviews-Asado_Central-Madrid.html,Excelente lugar,Yudith C,Muy bueno el servicio ! Valentina y Laura nos atendieron de manera positiva. Fueron muy amables ! La comida estuvo riquísima !,Escrita el 13 de marzo de 2026,1 contribución,"Esta es la opinión subjetiva de un miembro de Tripadvisor, no de Tripadvisor LLC. Tripadvisor realiza comprobaciones de las opiniones.",mar 2026 • En familia,,,,,,Leer más,1.0,0,,,https://dynamic-media-cdn.tripadvisor.com/media/photo-o/1a/f6/f4/20/default-avatar-2020-31.jpg?w=100&h=-1&s=1
1776248031-7,https://www.tripadvisor.es/Restaurant_Review-g187514-d33094616-Reviews-Asado_Central-Madrid.html,Best place ever,daniela m,"Laura y Valentina nos atendieron increíble honestamente muy recomendado, la comida exquisita! 
Nos dieron unos shots complementarios muy ricos !",Escrita el 13 de marzo de 2026,1 contribución,,mar 2026 • En familia,,,,,"Esta es la opinión subjetiva de un miembro de Tripadvisor, no de Tripadvisor LLC. Tripadvisor realiza comprobaciones de las opiniones.",Leer más,1.0,0,,https://dynamic-media-cdn.tripadvisor.com/media/photo-o/32/aa/ef/32/caption.jpg?w=300&h=300&s=1,https://dynamic-media-cdn.tripadvisor.com/media/photo-o/1a/f6/e8/24/default-avatar-2020-60.jpg?w=100&h=-1&s=1
1776248031-8,https://www.tripadvisor.es/Restaurant_Review-g187514-d33094616-Reviews-Asado_Central-Madrid.html,Cena en pareja.,Rossybell T,"Me gustaría destacar varios aspectos, solo con la intención de que puedan mejorar que, al final creo que es lo que todos los restaurantes quieren. 

Primeramente, admiro mucho que chicos jóvenes estén en una plantilla, son muy amables, solo les falta un poco de experiencia que es normal al ser chicos, creo que el establecimiento debería capacitarlos en su carta para que puedan asesorar de una manera adecuada a los comensales. 

Pedí una provoleta que me llegó súper dura, buen sabor pero falta de cocción o no la tienen de manera adecueda para que llegue en su punto a la mesa. 
Pedí expresamente que me hicieran tiempos. Y pues al devolver el queso, me trajeron los segundos, por lo cual pedí que ya no retornara el queso. 

La carne estaba muy muy muy deliciosa. Como la pedí. 

Simplemente detalles que creo que pueden mejorar. 

El vino se abre en la mesa, no en el aire. El vino es el protagonista de una cena y por ende debe tener ese espacio en la mesa adecuadamente. 

Por último, solo hay una chica que atiende extraño. No sé si es su forma de ser o algo, pero no tiene un lenguaje apropiado para dirigirse a un comensal.  

Gracias por todo. 
Volvería por la comida. Está divina. Y espero que los chicos estén más preparados y sientan la confianza de asesorar.",Escrita el 12 de marzo de 2026,1 contribución,Deberían tener música de ambiente.,mar 2026 • Parejas,Calidad/precio,Comida,Servicio,Ambiente,,Leer más,1.0,0,,https://dynamic-media-cdn.tripadvisor.com/media/photo-o/32/aa/89/b8/caption.jpg?w=300&h=300&s=1,https://dynamic-media-cdn.tripadvisor.com/media/photo-o/1a/f6/e3/1f/default-avatar-2020-46.jpg?w=100&h=-1&s=1
1776248031-9,https://www.tripadvisor.es/Restaurant_Review-g187514-d33094616-Reviews-Asado_Central-Madrid.html,Mi primera vez,Jackeline R,"Mucho calor, tomar en cuenta para cuando está full y afuera está caluroso tener la calefacción o no prender un poco el aire cuando no hay ventanas, es muy difícil estar agradable.
Una sugerencia",Escrita el 12 de marzo de 2026,"Playa del Carmen, México",,mar 2026 • Parejas,,,,,"Esta es la opinión subjetiva de un miembro de Tripadvisor, no de Tripadvisor LLC. Tripadvisor realiza comprobaciones de las opiniones.",Leer más,55.0,0,,https://dynamic-media-cdn.tripadvisor.com/media/photo-o/32/aa/88/3e/caption.jpg?w=300&h=300&s=1,https://dynamic-media-cdn.tripadvisor.com/media/photo-o/07/5b/83/63/jackeline-r.jpg?w=100&h=-1&s=1
1776248031-10,https://www.tripadvisor.es/Restaurant_Review-g187514-d33094616-Reviews-Asado_Central-Madrid.html,Un poco decepcionada,Rocío N,"Aparece como el sitio mejor valorado de carne de Madrid, pero la carne no es a la brasa y el sitio es pequeño. La atención no fue mala y la localización es buena. Además es barato. Pero si lo que buscas es un sitio premium de carne, hay sitios mejores.",Escrita el 12 de marzo de 2026,2 contribuciones,,mar 2026 • En familia,Calidad/precio,Comida,Servicio,Ambiente,"Esta es la opinión subjetiva de un miembro de Tripadvisor, no de Tripadvisor LLC. Tripadvisor realiza comprobaciones de las opiniones.",Leer más,2.0,0,,,https://dynamic-media-cdn.tripadvisor.com/media/photo-o/1a/f6/eb/6d/default-avatar-2020-19.jpg?w=100&h=-1&s=1
1776248031-11,https://www.tripadvisor.es/Restaurant_Review-g187514-d33094616-Reviews-Asado_Central-Madrid.html,GENIAL!,Leonardo Z,Servicio excelente y comida espectacular! recomiendo absolutamente el sitio! muchas gracias a todas!,Escrita el 11 de marzo de 2026,1 contribución,"Esta es la opinión subjetiva de un miembro de Tripadvisor, no de Tripadvisor LLC. Tripadvisor realiza comprobaciones de las opiniones.",mar 2026 • Amigos,,,,,,Leer más,1.0,0,,,https://dynamic-media-cdn.tripadvisor.com/media/photo-o/1a/f6/e8/5b/default-avatar-2020-61.jpg?w=100&h=-1&s=1
1776248031-12,https://www.tripadvisor.es/Restaurant_Review-g187514-d33094616-Reviews-Asado_Central-Madrid.html,La comida,Carlos A,"Buenísima la comida. Muy buen ambiente y la atención de Erick, de otro mundo",Escrita el 10 de marzo de 2026,1 contribución,"Esta es la opinión subjetiva de un miembro de Tripadvisor, no de Tripadvisor LLC. Tripadvisor realiza comprobaciones de las opiniones.",mar 2026 • En familia,,,,,,Leer más,1.0,0,,,https://dynamic-media-cdn.tripadvisor.com/media/photo-o/1a/f6/ef/73/default-avatar-2020-13.jpg?w=100&h=-1&s=1
1776248031-13,https://www.tripadvisor.es/Restaurant_Review-g187514-d33094616-Reviews-Asado_Central-Madrid.html,Excelente carne,Tour725186,"Excelente carne, servicio muy bien y rápido!",Escrita el 10 de marzo de 2026,1 contribución,,mar 2026 • Parejas,Calidad/precio,Comida,Servicio,Ambiente,"Esta es la opinión subjetiva de un miembro de Tripadvisor, no de Tripadvisor LLC. Tripadvisor realiza comprobaciones de las opiniones.",Leer más,1.0,0,,,https://dynamic-media-cdn.tripadvisor.com/media/photo-o/1a/f6/e8/ea/default-avatar-2020-63.jpg?w=100&h=-1&s=1
1776248031-14,https://www.tripadvisor.es/Restaurant_Review-g187514-d33094616-Reviews-Asado_Central-Madrid.html,Todo muy bueno,María D,Un trato muy agradable los camarero muy amables,Escrita el 10 de marzo de 2026,1 contribución,"Esta es la opinión subjetiva de un miembro de Tripadvisor, no de Tripadvisor LLC. Tripadvisor realiza comprobaciones de las opiniones.",mar 2026 • Parejas,,,,,,Leer más,1.0,0,,,https://dynamic-media-cdn.tripadvisor.com/media/photo-o/1a/f6/e9/60/default-avatar-2020-64.jpg?w=100&h=-1&s=1
1776248031-15,https://www.tripadvisor.es/Restaurant_Review-g187514-d33094616-Reviews-Asado_Central-Madrid.html,Calidez,Roberto O,"Laura y Erik fueron fabulosos, super amables y atentos, muchas gracias",Escrita el 9 de marzo de 2026,1 contribución,,mar 2026 • En familia,Calidad/precio,Comida,Servicio,Ambiente,"Esta es la opinión subjetiva de un miembro de Tripadvisor, no de Tripadvisor LLC. Tripadvisor realiza comprobaciones de las opiniones.",Leer más,1.0,0,,,https://dynamic-media-cdn.tripadvisor.com/media/photo-o/1a/f6/f4/20/default-avatar-2020-31.jpg?w=100&h=-1&s=1
1776248020-1,https://www.tripadvisor.es/Restaurant_Review-g187514-d33094616-Reviews-Asado_Central-Madrid.html,Experiencia 10/10,andreea,"El trato y servicio fueron super amables y rapidos. La comida llegó super rapido y estaba todo buenisimo y en su punto! 
Experiencia para repetir!",1 contribución,Escrita el 23 de marzo de 2026,,mar 2026 • En familia,Calidad/precio,Comida,Servicio,Ambiente,,"Esta es la opinión subjetiva de un miembro de Tripadvisor, no de Tripadvisor LLC. Tripadvisor realiza comprobaciones de las opiniones.",1.0,Leer más,0.0,,https://dynamic-media-cdn.tripadvisor.com/media/photo-o/1a/f6/e3/1f/default-avatar-2020-46.jpg?w=100&h=-1&s=1
1776248020-2,https://www.tripadvisor.es/Restaurant_Review-g187514-d33094616-Reviews-Asado_Central-Madrid.html,Muy buena atencion,Falko M,"La comida muy rica , fueron muy atentas y nos regalaron postre",1 contribución,Escrita el 22 de marzo de 2026,,mar 2026 • Amigos,,,,,"Esta es la opinión subjetiva de un miembro de Tripadvisor, no de Tripadvisor LLC. Tripadvisor realiza comprobaciones de las opiniones.",,1.0,Leer más,0.0,,https://dynamic-media-cdn.tripadvisor.com/media/photo-o/1a/f6/de/5a/default-avatar-2020-36.jpg?w=100&h=-1&s=1
1776248020-3,https://www.tripadvisor.es/Restaurant_Review-g187514-d33094616-Reviews-Asado_Central-Madrid.html,Buena experiencia,Fabio S,"Buena calidad, y buen precio con el Tenedor. Trato muy bueno del personal.",1 contribución,Escrita el 22 de marzo de 2026,,mar 2026 • En familia,,,,,,"Esta es la opinión subjetiva de un miembro de Tripadvisor, no de Tripadvisor LLC. Tripadvisor realiza comprobaciones de las opiniones.",1.0,Leer más,0.0,https://dynamic-media-cdn.tripadvisor.com/media/photo-o/32/c0/2f/4d/caption.jpg?w=300&h=300&s=1,https://dynamic-media-cdn.tripadvisor.com/media/photo-o/1a/f6/f2/b8/default-avatar-2020-26.jpg?w=100&h=-1&s=1
1776248020-4,https://www.tripadvisor.es/Restaurant_Review-g187514-d33094616-Reviews-Asado_Central-Madrid.html,Comida y trato de 10. Gestión del aforo algo mala,Alba B,"La comida está muy buena y el personal es muy atento y amable. La única pega es que tienen tanta afluencia que da igual que hagas reserva, vas a tener que esperar quizás 30min. Pero todo el personal hace lo posible para que la espera no sea mucha y están atentos de pasarte en cuanto puedan.

Punto negativo la gestión del aforo pero por lo demás muy recomendable. La comida está muy buena, te la sirven rápido y están atentos de si estás comodo",1 contribución,Escrita el 22 de marzo de 2026,,mar 2026 • Parejas,Calidad/precio,Comida,Servicio,Ambiente,,,1.0,Leer más,0.0,https://dynamic-media-cdn.tripadvisor.com/media/photo-o/32/bf/ba/12/caption.jpg?w=300&h=300&s=1,https://dynamic-media-cdn.tripadvisor.com/media/photo-o/1a/f6/e2/4a/default-avatar-2020-42.jpg?w=100&h=-1&s=1
1776248020-5,https://www.tripadvisor.es/Restaurant_Review-g187514-d33094616-Reviews-Asado_Central-Madrid.html,Para volver,Javiux R,"Un muy buen trato , excelente servicio , calidad de comida .",1 contribución,Escrita el 22 de marzo de 2026,,mar 2026 • Parejas,Calidad/precio,Comida,Servicio,Ambiente,,"Esta es la opinión subjetiva de un miembro de Tripadvisor, no de Tripadvisor LLC. Tripadvisor realiza comprobaciones de las opiniones.",1.0,Leer más,0.0,,https://dynamic-media-cdn.tripadvisor.com/media/photo-o/1a/f6/f1/79/default-avatar-2020-21.jpg?w=100&h=-1&s=1
1776248020-6,https://www.tripadvisor.es/Restaurant_Review-g187514-d33094616-Reviews-Asado_Central-Madrid.html,Malísima experiencia en el asado central,Luisa M,"Hoy hemos ido en familia por el día del padre al Asado Central y cuando llegamos justo a la hora de la reserva  NO HABÍA MESA LIBRE Y LISTA DE ESPERA increíble, NUNCA  nos había pasado no le doy -1☆ porque no se puede. Fatal.",6 contribuciones,Escrita el 21 de marzo de 2026,,mar 2026 • En familia,,,,,"Esta es la opinión subjetiva de un miembro de Tripadvisor, no de Tripadvisor LLC. Tripadvisor realiza comprobaciones de las opiniones.",,6.0,Leer más,0.0,,https://dynamic-media-cdn.tripadvisor.com/media/photo-o/1a/f6/e5/66/default-avatar-2020-53.jpg?w=100&h=-1&s=1
1776248020-7,https://www.tripadvisor.es/Restaurant_Review-g187514-d33094616-Reviews-Asado_Central-Madrid.html,Los mejores cortes de carne de Madrid.,Linda G,"La atención del personal es 10/10, la comida deliciosa tal y como se ve en las imágenes de la carta, el lugar es agradable, pero el servicio hace que todo sea mejor aquí, volveríamos sin duda alguna.",1 contribución,Escrita el 21 de marzo de 2026,,mar 2026 • Parejas,Calidad/precio,Comida,Servicio,Ambiente,,"Esta es la opinión subjetiva de un miembro de Tripadvisor, no de Tripadvisor LLC. Tripadvisor realiza comprobaciones de las opiniones.",1.0,Leer más,0.0,,https://dynamic-media-cdn.tripadvisor.com/media/photo-o/1a/f6/e4/2d/default-avatar-2020-48.jpg?w=100&h=-1&s=1
