1776248020-8,https://www.tripadvisor.es/Restaurant_Review-g187514-d33094616-Reviews-Asado_Central-Madrid.html,Excelente restaurante,Julian A,"Excelentes cortes de carne, excelente servicio volvería una y 1000 veces",1 contribución,Escrita el 21 de marzo de 2026,,mar 2026 • Parejas,Calidad/precio,Comida,Servicio,Ambiente,"Muy bien ubicado, cerca de Sol, en la mejor zona de Madrid",,1.0,Leer más,0.0,,https://dynamic-media-cdn.tripadvisor.com/media/photo-o/1a/f6/e3/6a/default-avatar-2020-47.jpg?w=100&h=-1&s=1
1776248020-9,https://www.tripadvisor.es/Restaurant_Review-g187514-d33094616-Reviews-Asado_Central-Madrid.html,"Calidad y precio muy bueno,",Joaquin S,"Comida buena, servicio de sala de Valentina excelente.","Pego, España",Escrita el 21 de marzo de 2026,4 contribuciones,mar 2026 • Amigos,,,,,"Esta es la opinión subjetiva de un miembro de Tripadvisor, no de Tripadvisor LLC. Tripadvisor realiza comprobaciones de las opiniones.",,4.0,Leer más,0.0,,https://dynamic-media-cdn.tripadvisor.com/media/photo-o/1a/f6/de/5a/default-avatar-2020-36.jpg?w=100&h=-1&s=1
1776248020-10,https://www.tripadvisor.es/Restaurant_Review-g187514-d33094616-Reviews-Asado_Central-Madrid.html,Muy buen servicio,Jose Carlos S,"Valentina, excelente profesional",1 contribución,Escrita el 21 de marzo de 2026,,mar 2026 • Parejas,,,,,"Esta es la opinión subjetiva de un miembro de Tripadvisor, no de Tripadvisor LLC. Tripadvisor realiza comprobaciones de las opiniones.",,1.0,Leer más,0.0,,https://dynamic-media-cdn.tripadvisor.com/media/photo-o/1a/f6/ee/10/default-avatar-2020-8.jpg?w=100&h=-1&s=1
1776248020-11,https://www.tripadvisor.es/Restaurant_Review-g187514-d33094616-Reviews-Asado_Central-Madrid.html,Viaje familiar,Adriana O,"Excelente comida, servicio, la parilada deliviosa",1 contribución,Escrita el 20 de marzo de 2026,,mar 2026 • En familia,Calidad/precio,Comida,Servicio,Ambiente,,"Esta es la opinión subjetiva de un miembro de Tripadvisor, no de Tripadvisor LLC. Tripadvisor realiza comprobaciones de las opiniones.",1.0,Leer más,0.0,,https://dynamic-media-cdn.tripadvisor.com/media/photo-o/1a/f6/f6/0d/default-avatar-2020-34.jpg?w=100&h=-1&s=1
1776248020-12,https://www.tripadvisor.es/Restaurant_Review-g187514-d33094616-Reviews-Asado_Central-Madrid.html,Experiencia en asador argentino,Elena,"Servicio al cliente muy agradable y rápido.
La comida estaba buena.
Recomendable :)","Medina de Rioseco, España",Escrita el 20 de marzo de 2026,1 contribución,mar 2026 • Parejas,,,,,"Esta es la opinión subjetiva de un miembro de Tripadvisor, no de Tripadvisor LLC. Tripadvisor realiza comprobaciones de las opiniones.",,1.0,Leer más,0.0,,https://dynamic-media-cdn.tripadvisor.com/media/photo-o/1a/f6/df/2b/default-avatar-2020-39.jpg?w=100&h=-1&s=1
1776248020-13,https://www.tripadvisor.es/Restaurant_Review-g187514-d33094616-Reviews-Asado_Central-Madrid.html,Muy bueno!!!!,Bia R,Un de los mejores! La carne es oncreible è las personas son muy amables!,"Terni, Italia",Escrita el 19 de marzo de 2026,2 contribuciones,mar 2026 • Amigos,Calidad/precio,Comida,Servicio,Ambiente,,"Esta es la opinión subjetiva de un miembro de Tripadvisor, no de Tripadvisor LLC. Tripadvisor realiza comprobaciones de las opiniones.",2.0,Leer más,0.0,,https://dynamic-media-cdn.tripadvisor.com/media/photo-o/1a/f6/ee/10/default-avatar-2020-8.jpg?w=100&h=-1&s=1
1776248020-14,https://www.tripadvisor.es/Restaurant_Review-g187514-d33094616-Reviews-Asado_Central-Madrid.html,"Buenas carne, y mejor atención",MIGUEL ANGEL P,"Todo fenomenal, la carne exquisita: pedimos parrillada y steak tartar.
Y la atención, profesionalidad y amabilidad de Valentina insuperable.
Siempre atenta.
Mucha suerte, te deseo lo mejor, te lo mereces",16 contribuciones,Escrita el 19 de marzo de 2026,,mar 2026 • Parejas,,,,,,"Esta es la opinión subjetiva de un miembro de Tripadvisor, no de Tripadvisor LLC. Tripadvisor realiza comprobaciones de las opiniones.",16.0,Leer más,0.0,https://dynamic-media-cdn.tripadvisor.com/media/photo-o/32/ba/05/16/caption.jpg?w=300&h=300&s=1,https://dynamic-media-cdn.tripadvisor.com/media/photo-o/1a/f6/f6/0d/default-avatar-2020-34.jpg?w=100&h=-1&s=1
1776248020-15,https://www.tripadvisor.es/Restaurant_Review-g187514-d33094616-Reviews-Asado_Central-Madrid.html,Erik,Cami F,Buena atrncion rica la comida,1 contribución,Escrita el 16 de marzo de 2026,,mar 2026 • Parejas,,,,,,"Esta es la opinión subjetiva de un miembro de Tripadvisor, no de Tripadvisor LLC. Tripadvisor realiza comprobaciones de las opiniones.",1.0,Leer más,0.0,https://dynamic-media-cdn.tripadvisor.com/media/photo-o/32/b3/a8/da/caption.jpg?w=300&h=300&s=1,https://dynamic-media-cdn.tripadvisor.com/media/photo-o/1a/f6/e2/11/default-avatar-2020-41.jpg?w=100&h=-1&s=1
