1776262877-4,https://www.tripadvisor.es/Restaurant_Review-g187514-d24982405-Reviews-Bosque_De_Piamonte-Madrid.html,"Excelente atencion, muy buenos precios. Exelentes postres que te dejan con ganas de regresar. Buena experiencia. Bie",manucho g,"El servicio y la comida exelentes! 
Cenamos Pizzas y pastas Gastamos €22 porque nos cobraron la mitad de todo lo que consumimos gracias a la aplicación the Fork",Escrita el 10 de junio de 2025,1 contribución,1,Calidad/precio,Ambiente,Servicio,Comida,,"Esta es la opinión subjetiva de un miembro de Tripadvisor, no de Tripadvisor LLC. Tripadvisor realiza comprobaciones de las opiniones.",Leer más,0,,,,,,https://dynamic-media-cdn.tripadvisor.com/media/photo-o/1a/f6/f4/d0/default-avatar-2020-33.jpg?w=100&h=-1&s=1,
1776262877-5,https://www.tripadvisor.es/Restaurant_Review-g187514-d24982405-Reviews-Bosque_De_Piamonte-Madrid.html,Buena relación calidad-precio,Cesia O,Buenísimo!La comida estuvo excelente. Nos pedimos una pizza barbacoa y un gnocchi del nonno. Ambos muy ricos y la relación calidad-precio estuvo de 10. Seguramente volveremos,Escrita el 10 de junio de 2025,1 contribución,1,,,,,,"Esta es la opinión subjetiva de un miembro de Tripadvisor, no de Tripadvisor LLC. Tripadvisor realiza comprobaciones de las opiniones.",Leer más,0,,,,,https://dynamic-media-cdn.tripadvisor.com/media/photo-o/30/1f/9b/de/caption.jpg?w=300&h=300&s=1,https://dynamic-media-cdn.tripadvisor.com/media/photo-o/1a/f6/f4/d0/default-avatar-2020-33.jpg?w=100&h=-1&s=1,
1776262877-6,https://www.tripadvisor.es/Restaurant_Review-g187514-d24982405-Reviews-Bosque_De_Piamonte-Madrid.html,Muy buen servicio,María R,Muy buen servicio y la comida muy buena. Hemos venido por casualidad y un acierto. Muy recomendable si estás por el centro,Escrita el 9 de junio de 2025,1 contribución,1,,,,,"Esta es la opinión subjetiva de un miembro de Tripadvisor, no de Tripadvisor LLC. Tripadvisor realiza comprobaciones de las opiniones.",,Leer más,0,,,,,,https://dynamic-media-cdn.tripadvisor.com/media/photo-o/1a/f6/ec/3d/default-avatar-2020-1.jpg?w=100&h=-1&s=1,
1776262877-7,https://www.tripadvisor.es/Restaurant_Review-g187514-d24982405-Reviews-Bosque_De_Piamonte-Madrid.html,"Buen precio, buena comida y muy buen servicio.",Rodrigo R,"Está sitio es absolutamente increíble. Se resume fácil: buena comida, buenos precios y una atención excelente. 
Recomiendo mucho probar la burrata (cualquiera de las que sirven) y las pizzas, aunque todo tenía una pinta… 
En especial agradezco la atención de Jorman, un profesional excelente al que no le ha faltado la sonrisa. 
Repetiremos seguro.",Escrita el 9 de junio de 2025,1 contribución,1,Calidad/precio,Ambiente,Servicio,Comida,,,Leer más,0,,,,,https://dynamic-media-cdn.tripadvisor.com/media/photo-o/30/1c/86/e0/caption.jpg?w=300&h=300&s=1,https://dynamic-media-cdn.tripadvisor.com/media/photo-o/1a/f6/f2/7a/default-avatar-2020-25.jpg?w=100&h=-1&s=1,
1776262877-8,https://www.tripadvisor.es/Restaurant_Review-g187514-d24982405-Reviews-Bosque_De_Piamonte-Madrid.html,Me encantó,lurdes A,"Todos los platos están muy buenos, frescos y ricos. Los postres deliciosos, la atención muy buena, muchas gracias por todo.",Escrita el 7 de junio de 2025,1 contribución,1,Calidad/precio,Ambiente,Servicio,Comida,,"Esta es la opinión subjetiva de un miembro de Tripadvisor, no de Tripadvisor LLC. Tripadvisor realiza comprobaciones de las opiniones.",Leer más,0,,,,,,https://dynamic-media-cdn.tripadvisor.com/media/photo-o/1a/f6/f2/eb/default-avatar-2020-27.jpg?w=100&h=-1&s=1,
1776262877-9,https://www.tripadvisor.es/Restaurant_Review-g187514-d24982405-Reviews-Bosque_De_Piamonte-Madrid.html,Restaurante acogedor,Fiorlla A,"Un sitio acogedor, nos atendieron con mucha amabilidad, y la comida muy rica! Un acierto seguro, volveremos seguro ;).",Escrita el 7 de junio de 2025,1 contribución,1,Calidad/precio,Ambiente,Servicio,Comida,,"Esta es la opinión subjetiva de un miembro de Tripadvisor, no de Tripadvisor LLC. Tripadvisor realiza comprobaciones de las opiniones.",Leer más,0,,,,,,https://dynamic-media-cdn.tripadvisor.com/media/photo-o/1a/f6/f0/9f/default-avatar-2020-16.jpg?w=100&h=-1&s=1,
1776262877-10,https://www.tripadvisor.es/Restaurant_Review-g187514-d24982405-Reviews-Bosque_De_Piamonte-Madrid.html,Sitio inmejorable y exquisito,tania m,"Increíble, lugar de 10 probamos el Petto de pollo all Alfredo y está brutal no lo siguiente, la pizza di Bosco exquisita.
Un lugar excepcional donde compartir con amigos, familia.
Repetiremos y el trato del personal inmejorable. Da gusto ir a sitios así donde la calidad y la buena comida abundan.",Escrita el 4 de junio de 2025,1 contribución,1,Calidad/precio,Ambiente,Servicio,Comida,Preparaos para disfrutar con la variedad de sabores.,,Leer más,0,,,,,,https://dynamic-media-cdn.tripadvisor.com/media/photo-o/1a/f6/f1/79/default-avatar-2020-21.jpg?w=100&h=-1&s=1,
1776262877-11,https://www.tripadvisor.es/Restaurant_Review-g187514-d24982405-Reviews-Bosque_De_Piamonte-Madrid.html,El  camarero a sido muy amable,Luis C,"Me a encantado el lugar volveremos , la atención espectacular y el sitio bastante bonito lo recomiendo 100/100.

Repetiremos",Escrita el 4 de junio de 2025,1 contribución,1,,,,,,"Esta es la opinión subjetiva de un miembro de Tripadvisor, no de Tripadvisor LLC. Tripadvisor realiza comprobaciones de las opiniones.",Leer más,0,,,,,https://dynamic-media-cdn.tripadvisor.com/media/photo-o/30/11/10/66/caption.jpg?w=300&h=300&s=1,https://dynamic-media-cdn.tripadvisor.com/media/photo-o/1a/f6/f0/9f/default-avatar-2020-16.jpg?w=100&h=-1&s=1,
1776262877-12,https://www.tripadvisor.es/Restaurant_Review-g187514-d24982405-Reviews-Bosque_De_Piamonte-Madrid.html,Perfecto,Romy v,La comida es muy deliciosa y los gentes son muy simpáticos. Todos es para un precio muy bien. Nos gusta ir al este restaurante.,Escrita el 3 de junio de 2025,1 contribución,1,,,,,"Esta es la opinión subjetiva de un miembro de Tripadvisor, no de Tripadvisor LLC. Tripadvisor realiza comprobaciones de las opiniones.",,Leer más,0,,,,,,https://dynamic-media-cdn.tripadvisor.com/media/photo-o/1a/f6/f2/59/default-avatar-2020-24.jpg?w=100&h=-1&s=1,
1776262877-13,https://www.tripadvisor.es/Restaurant_Review-g187514-d24982405-Reviews-Bosque_De_Piamonte-Madrid.html,Recomendable,Jessica N,"Un buen acierto , comida espectacular, trato amable y ambiente cómodo y relajado ! Recomendable 100% . Yo volveré muy pronto",Escrita el 3 de junio de 2025,10 contribuciones,10,Calidad/precio,Ambiente,Servicio,Comida,,"Esta es la opinión subjetiva de un miembro de Tripadvisor, no de Tripadvisor LLC. Tripadvisor realiza comprobaciones de las opiniones.",Leer más,0,,,,,,https://dynamic-media-cdn.tripadvisor.com/media/photo-o/1a/f6/f2/b8/default-avatar-2020-26.jpg?w=100&h=-1&s=1,
1776262877-14,https://www.tripadvisor.es/Restaurant_Review-g187514-d24982405-Reviews-Bosque_De_Piamonte-Madrid.html,Cena en familia,johanna pamela v,"Buenísimo, buena atención, muy serviciales. me gustaron mucho las pastas, buenos postres. Volvería con mi familia sin dudas.",Escrita el 3 de junio de 2025,3 contribuciones,3,,,,,"Esta es la opinión subjetiva de un miembro de Tripadvisor, no de Tripadvisor LLC. Tripadvisor realiza comprobaciones de las opiniones.",,Leer más,0,,,,,,https://dynamic-media-cdn.tripadvisor.com/media/photo-o/11/e1/81/a1/johanna-pamela-v.jpg?w=100&h=-1&s=1,
1776262877-15,https://www.tripadvisor.es/Restaurant_Review-g187514-d24982405-Reviews-Bosque_De_Piamonte-Madrid.html,Buen precio para buena comida,Peter N,"Me tomé un buen Tagliatelle de sextas y trufa, con un vino blanco y espresso con Amaretto. Buen precio. El camarero era amable, aunque no hablaba inglés (pero nos las arreglamos 😉)",Escrita el 2 de junio de 2025,131 contribuciones,131,,,,,,"Esta es la opinión subjetiva de un miembro de Tripadvisor, no de Tripadvisor LLC. Tripadvisor realiza comprobaciones de las opiniones.",Leer más,0,,,,,,https://dynamic-media-cdn.tripadvisor.com/media/photo-o/1a/f6/e8/91/default-avatar-2020-62.jpg?w=100&h=-1&s=1,
1776262825-1,https://www.tripadvisor.es/Restaurant_Review-g187514-d24982405-Reviews-Bosque_De_Piamonte-Madrid.html,,,,,,,,,,,,,,,,,,,,,
1776262825-2,https://www.tripadvisor.es/Restaurant_Review-g187514-d24982405-Reviews-Bosque_De_Piamonte-Madrid.html,Una joya en Barcelona,Lsd001,Algunos de los mejores italianos que he tenido y he estado en Italia. Este pequeño lugar tiene un gran Linguine alle Vongole y delicioso Tiramisu. Una verdadera joya en el barrio.,13 contribuciones,13.0,Escrita el 12 de octubre de 2025,13 contribuciones,,,,,,"Esta es la opinión subjetiva de un miembro de Tripadvisor, no de Tripadvisor LLC. Tripadvisor realiza comprobaciones de las opiniones.",Leer más,0.0,,,,https://dynamic-media-cdn.tripadvisor.com/media/photo-o/1a/f6/ec/3d/default-avatar-2020-1.jpg?w=100&h=-1&s=1,,
1776262825-3,https://www.tripadvisor.es/Restaurant_Review-g187514-d24982405-Reviews-Bosque_De_Piamonte-Madrid.html,Muy buena elección,Aroa S,"Todo estupendo,tanto la comida como la atención recibida!un placer siempre venir aquí! La relación calidad-precio es excelente,llevo muchos años viniendo a este lugar!",1 contribución,1.0,Escrita el 3 de octubre de 2025,1 contribución,Calidad/precio,Ambiente,Servicio,Comida,,"Esta es la opinión subjetiva de un miembro de Tripadvisor, no de Tripadvisor LLC. Tripadvisor realiza comprobaciones de las opiniones.",Leer más,0.0,,,,https://dynamic-media-cdn.tripadvisor.com/media/photo-o/1a/f6/e7/3d/default-avatar-2020-55.jpg?w=100&h=-1&s=1,,
1776262825-4,https://www.tripadvisor.es/Restaurant_Review-g187514-d24982405-Reviews-Bosque_De_Piamonte-Madrid.html,Muy buena experiencia,Coastal67566226295,"Personal muy amable, mucha atención. El local está muy bien, no hay ruido, la música está bajita. La comida muy rica a precio asequible",1 contribución,1.0,Escrita el 3 de octubre de 2025,1 contribución,,,,,"Esta es la opinión subjetiva de un miembro de Tripadvisor, no de Tripadvisor LLC. Tripadvisor realiza comprobaciones de las opiniones.",,Leer más,0.0,,,,,,
1776262825-5,https://www.tripadvisor.es/Restaurant_Review-g187514-d24982405-Reviews-Bosque_De_Piamonte-Madrid.html,Perfect,Trip57087874450,Muy buena atención y la comida volvería a repetir una visita a este establecimiento sin dudarlo jamás  el postre estaba muy rico,1 contribución,1.0,Escrita el 25 de septiembre de 2025,1 contribución,,,,,"Esta es la opinión subjetiva de un miembro de Tripadvisor, no de Tripadvisor LLC. Tripadvisor realiza comprobaciones de las opiniones.",,Leer más,0.0,,,,https://dynamic-media-cdn.tripadvisor.com/media/photo-o/1a/f6/f3/23/default-avatar-2020-28.jpg?w=100&h=-1&s=1,,
1776262825-6,https://www.tripadvisor.es/Restaurant_Review-g187514-d24982405-Reviews-Bosque_De_Piamonte-Madrid.html,GRAN ITALIANO EN MADRID,Marcos D,"Comida muy rica, sitio tranquilo y servicio amable! Pedimos la pizza di Boscoz los Tagliatelle di campagna y la joya la corana: la tentazione al forno. Maravilloso!",1 contribución,1.0,Escrita el 24 de septiembre de 2025,1 contribución,,,,,"Esta es la opinión subjetiva de un miembro de Tripadvisor, no de Tripadvisor LLC. Tripadvisor realiza comprobaciones de las opiniones.",,Leer más,0.0,,,,https://dynamic-media-cdn.tripadvisor.com/media/photo-o/1a/f6/e8/24/default-avatar-2020-60.jpg?w=100&h=-1&s=1,,
1776262825-7,https://www.tripadvisor.es/Restaurant_Review-g187514-d24982405-Reviews-Bosque_De_Piamonte-Madrid.html,Bien.,Lubje,"Acudimos a este local debido a sus buenísimas críticas.
Lo más destacable, con diferencia, es la atención de las camareras, que son unos soletes en todo momento.
La comida está buena, pero hay italianos mucho mejores. Además le echan salsa pomodoro a todo cuando muchas recetas italianas no la llevan.
El precio es razonable y la atención maravillosa.",202 contribuciones,202.0,Escrita el 22 de septiembre de 2025,"Barcelona, España",,,,,"Esta es la opinión subjetiva de un miembro de Tripadvisor, no de Tripadvisor LLC. Tripadvisor realiza comprobaciones de las opiniones.",,Leer más,0.0,,,,,,
1776262825-8,https://www.tripadvisor.es/Restaurant_Review-g187514-d24982405-Reviews-Bosque_De_Piamonte-Madrid.html,Comida,Nerea G,"Todo muy rico y los camareros muy atentos y agradables 
Nos pedimos una pizza, una pasta y un postre y acabos muy contentos",1 contribución,1.0,Escrita el 13 de septiembre de 2025,1 contribución,,,,,"Esta es la opinión subjetiva de un miembro de Tripadvisor, no de Tripadvisor LLC. Tripadvisor realiza comprobaciones de las opiniones.",,Leer más,0.0,,,,https://dynamic-media-cdn.tripadvisor.com/media/photo-o/1a/f6/e9/bb/default-avatar-2020-65.jpg?w=100&h=-1&s=1,,
1776262825-9,https://www.tripadvisor.es/Restaurant_Review-g187514-d24982405-Reviews-Bosque_De_Piamonte-Madrid.html,"Genial, para repetir",Fernando D,"Genial, comida de calidad y buenísima.
Personal muy amable, servicio rápido.
Buen ambiente, tranquilo y agradable.
Para repetir",1 contribución,1.0,Escrita el 12 de septiembre de 2025,"Leganés, España",Calidad/precio,Ambiente,Servicio,Comida,,"Esta es la opinión subjetiva de un miembro de Tripadvisor, no de Tripadvisor LLC. Tripadvisor realiza comprobaciones de las opiniones.",Leer más,0.0,,,,https://dynamic-media-cdn.tripadvisor.com/media/photo-o/1a/f6/e4/59/default-avatar-2020-49.jpg?w=100&h=-1&s=1,,
1776262825-10,https://www.tripadvisor.es/Restaurant_Review-g187514-d24982405-Reviews-Bosque_De_Piamonte-Madrid.html,Comida,noel g,"Todo muy bueno, espero volver alguna vez mas, personal super agradable!!
Tanto la pizza como la pasta estaban muy buenas, los postres geniales!",1 contribución,1.0,Escrita el 12 de septiembre de 2025,1 contribución,,,,,"Esta es la opinión subjetiva de un miembro de Tripadvisor, no de Tripadvisor LLC. Tripadvisor realiza comprobaciones de las opiniones.",,Leer más,0.0,,,,https://dynamic-media-cdn.tripadvisor.com/media/photo-o/1a/f6/f0/48/default-avatar-2020-15.jpg?w=100&h=-1&s=1,,
1776262825-11,https://www.tripadvisor.es/Restaurant_Review-g187514-d24982405-Reviews-Bosque_De_Piamonte-Madrid.html,Barato pero no volveré,Sonia G,"Vinimos por los comentarios pero nos decepcionó. Pedimos el fondutta de queso (mucha nata y poco queso), unos gnochis (sabí a a tomate de bote) y 2 platos de pasta (ambos grasientos, con un montón de aceite al final). El precio era económico (con agua algo menos de 20€ por persona) pero con lo grasiento de la comida se nos quedó un poco de mal cuerpo (y tampoco era especialmente sabroso). Para quitar el hambre bien, pero no para saborear una comida fuera de casa.",43 contribuciones,43.0,Escrita el 6 de septiembre de 2025,"Madrid, España",Calidad/precio,Ambiente,Servicio,Comida,,"Esta es la opinión subjetiva de un miembro de Tripadvisor, no de Tripadvisor LLC. Tripadvisor realiza comprobaciones de las opiniones.",Leer más,0.0,,,,https://dynamic-media-cdn.tripadvisor.com/media/photo-o/30/df/36/58/sonia-g.jpg?w=100&h=-1&s=1,,
1776262825-12,https://www.tripadvisor.es/Restaurant_Review-g187514-d24982405-Reviews-Bosque_De_Piamonte-Madrid.html,Puro Italia,Aitor V,La burra siciliana muy rica y el personal muy amable. La pizza capricho era grande. El precio está muy bien y esperamos volver pronto.,1 contribución,1.0,Escrita el 30 de agosto de 2025,1 contribución,,,,,"Esta es la opinión subjetiva de un miembro de Tripadvisor, no de Tripadvisor LLC. Tripadvisor realiza comprobaciones de las opiniones.",,Leer más,0.0,,,,https://dynamic-media-cdn.tripadvisor.com/media/photo-o/1a/f6/e2/a7/default-avatar-2020-44.jpg?w=100&h=-1&s=1,,
1776262825-13,https://www.tripadvisor.es/Restaurant_Review-g187514-d24982405-Reviews-Bosque_De_Piamonte-Madrid.html,Una comida deliciosa en familia,Juan Camilo,"Espectacular comida, servicio y atención de Ariel !!!!
100% recomendado!!! La pizza, las pastas , todo !!!!! El fondue de queso wow !!!!",6 contribuciones,6.0,Escrita el 20 de agosto de 2025,"Boadilla del Monte, España",Calidad/precio,Ambiente,Servicio,Comida,,,Leer más,0.0,,,,https://dynamic-media-cdn.tripadvisor.com/media/photo-o/1a/f6/ea/2e/default-avatar-2020-67.jpg?w=100&h=-1&s=1,,
1776262825-14,https://www.tripadvisor.es/Restaurant_Review-g187514-d24982405-Reviews-Bosque_De_Piamonte-Madrid.html,Italiano en Madrid,Carles C,"Servicio excelente.
Disponibilidad de menú y carta. Comida abundante y buena relación calidad precio.
Buen sitio para comer en Madrid.",3 contribuciones,3.0,Escrita el 20 de agosto de 2025,"Barcelona, España",,,,,"Esta es la opinión subjetiva de un miembro de Tripadvisor, no de Tripadvisor LLC. Tripadvisor realiza comprobaciones de las opiniones.",,Leer más,0.0,,,,https://dynamic-media-cdn.tripadvisor.com/media/photo-o/1a/f6/e4/2d/default-avatar-2020-48.jpg?w=100&h=-1&s=1,,
1776262825-15,https://www.tripadvisor.es/Restaurant_Review-g187514-d24982405-Reviews-Bosque_De_Piamonte-Madrid.html,Buen almuerzo,OROMAN,"Excelente comida muy rica y suficiente.
Vairedad de platos 
Muy bien en relacion del menu con precios 
Buena atencion y ubicacion",1 contribución,1.0,Escrita el 19 de agosto de 2025,1 contribución,Calidad/precio,Ambiente,Servicio,Comida,Ir con la familia,,Leer más,0.0,,,,https://dynamic-media-cdn.tripadvisor.com/media/photo-o/1a/f6/e2/11/default-avatar-2020-41.jpg?w=100&h=-1&s=1,,
1776262825-16,https://www.tripadvisor.es/Restaurant_Review-g187514-d24982405-Reviews-Bosque_De_Piamonte-Madrid.html,Pizza deliciosa,Trail40823437027,Comida muy buena ☺️. El trato muy bueno también por parte de los camareros. El ambiente del local muy bien. Todo correcto.,1 contribución,1.0,Escrita el 18 de agosto de 2025,1 contribución,Calidad/precio,Ambiente,Servicio,Comida,,"Esta es la opinión subjetiva de un miembro de Tripadvisor, no de Tripadvisor LLC. Tripadvisor realiza comprobaciones de las opiniones.",Leer más,0.0,,,,https://dynamic-media-cdn.tripadvisor.com/media/photo-o/1a/f6/f2/11/default-avatar-2020-23.jpg?w=100&h=-1&s=1,,
1776262860-1,https://www.tripadvisor.es/Restaurant_Review-g187514-d24982405-Reviews-Bosque_De_Piamonte-Madrid.html,Gran experiencia,Nerea M,"Es un sitio increíble, muy buena atención, comida muy muy buena, gran calidad.
Sin duda volveré! Esta en muy buena ubicación y genial conectado.",1 contribución,Escrita el 16 de julio de 2025,1,1 contribución,Calidad/precio,Ambiente,Servicio,Comida,,"Esta es la opinión subjetiva de un miembro de Tripadvisor, no de Tripadvisor LLC. Tripadvisor realiza comprobaciones de las opiniones.",,,,Leer más,0.0,,https://dynamic-media-cdn.tripadvisor.com/media/photo-o/1a/f6/f0/9f/default-avatar-2020-16.jpg?w=100&h=-1&s=1,
1776262860-2,https://www.tripadvisor.es/Restaurant_Review-g187514-d24982405-Reviews-Bosque_De_Piamonte-Madrid.html,Comida italiana,ISABEL M,"La atención excepcional, la comida muy buena y el precio inmejorable 
Recomiendo reservar con el tenedor con antelación.",1 contribución,Escrita el 14 de julio de 2025,1,1 contribución,Calidad/precio,Ambiente,Servicio,Comida,,,,"Esta es la opinión subjetiva de un miembro de Tripadvisor, no de Tripadvisor LLC. Tripadvisor realiza comprobaciones de las opiniones.",,Leer más,0.0,https://dynamic-media-cdn.tripadvisor.com/media/photo-o/30/78/04/99/caption.jpg?w=300&h=300&s=1,https://dynamic-media-cdn.tripadvisor.com/media/photo-o/1a/f6/e8/5b/default-avatar-2020-61.jpg?w=100&h=-1&s=1,
1776262860-3,https://www.tripadvisor.es/Restaurant_Review-g187514-d24982405-Reviews-Bosque_De_Piamonte-Madrid.html,"Atención de primera, lo recomiendo",Ezequiel P,"Excelente, estaba todo rico, buen ambiente 😋 buenas atención departe del las camareras. Lo recomiendo. Un 10 de 10. 
Muy amable Kiochy",1 contribución,Escrita el 12 de julio de 2025,1,1 contribución,,,,,,,"Esta es la opinión subjetiva de un miembro de Tripadvisor, no de Tripadvisor LLC. Tripadvisor realiza comprobaciones de las opiniones.",,,Leer más,0.0,,https://dynamic-media-cdn.tripadvisor.com/media/photo-o/1a/f6/f1/42/default-avatar-2020-20.jpg?w=100&h=-1&s=1,
1776262860-4,https://www.tripadvisor.es/Restaurant_Review-g187514-d24982405-Reviews-Bosque_De_Piamonte-Madrid.html,¡Subestimado!,teresa h,"¡Definitivamente subestimado! Tengo la pizza prosciutto y el tagliatelle Napoli. Yeyla, nuestra camarera, era increíble y tentativo con nosotros.",1 contribución,Escrita el 10 de julio de 2025,1,1 contribución,Calidad/precio,Ambiente,Servicio,Comida,Mostrar original,,,"Esta es la opinión subjetiva de un miembro de Tripadvisor, no de Tripadvisor LLC. Tripadvisor realiza comprobaciones de las opiniones.",Traducido automáticamente,Leer más,0.0,,https://dynamic-media-cdn.tripadvisor.com/media/photo-o/1a/f6/ea/b2/default-avatar-2020-69.jpg?w=100&h=-1&s=1,
1776262860-5,https://www.tripadvisor.es/Restaurant_Review-g187514-d24982405-Reviews-Bosque_De_Piamonte-Madrid.html,Ideal,Kati N,"Vinimos de casualidad a comer con mi marido, y fue un acierto total! Pedimos el menú, estaba riquísimo y excelente servicio.",1 contribución,Escrita el 10 de julio de 2025,1,1 contribución,,,,,,,"Esta es la opinión subjetiva de un miembro de Tripadvisor, no de Tripadvisor LLC. Tripadvisor realiza comprobaciones de las opiniones.",,,Leer más,0.0,,https://dynamic-media-cdn.tripadvisor.com/media/photo-o/1a/f6/ea/74/default-avatar-2020-68.jpg?w=100&h=-1&s=1,
1776262860-6,https://www.tripadvisor.es/Restaurant_Review-g187514-d24982405-Reviews-Bosque_De_Piamonte-Madrid.html,Calidad precio magnífico,David S,"Excelente comida italiana, con sabores auténticos y calidad insuperable a un precio muy razonable. Recomendable para cualquier día.",1 contribución,Escrita el 8 de julio de 2025,1,1 contribución,,,,,,,"Esta es la opinión subjetiva de un miembro de Tripadvisor, no de Tripadvisor LLC. Tripadvisor realiza comprobaciones de las opiniones.",,,Leer más,0.0,,https://dynamic-media-cdn.tripadvisor.com/media/photo-o/1a/f6/e9/60/default-avatar-2020-64.jpg?w=100&h=-1&s=1,
1776262860-7,https://www.tripadvisor.es/Restaurant_Review-g187514-d24982405-Reviews-Bosque_De_Piamonte-Madrid.html,No te lo puedes perder!! Increíble!!!,jamesbond25,Es uno de los mejores sitios de Madrid para comer comida Italiana. El trato es inmejorable!! Muy recomendable!! No te lo puedes perder!!,9 contribuciones,Escrita el 6 de julio de 2025,9,Beijing,,,,,,"Esta es la opinión subjetiva de un miembro de Tripadvisor, no de Tripadvisor LLC. Tripadvisor realiza comprobaciones de las opiniones.",,,,Leer más,0.0,https://dynamic-media-cdn.tripadvisor.com/media/photo-o/30/63/93/a4/caption.jpg?w=300&h=300&s=1,https://dynamic-media-cdn.tripadvisor.com/media/photo-o/14/3a/3d/2f/jamesbond25.jpg?w=100&h=-1&s=1,
1776262860-8,https://www.tripadvisor.es/Restaurant_Review-g187514-d24982405-Reviews-Bosque_De_Piamonte-Madrid.html,Trato 10/10,Isabel S,"Tiempo de espera normal. Las raciones con un tamaño fenomenal, el servicio excelente, y climatizado agradable. La pizza carbonara espectacular, la recomiendo encarecidamente.",1 contribución,Escrita el 5 de julio de 2025,1,1 contribución,,,,,,,"Esta es la opinión subjetiva de un miembro de Tripadvisor, no de Tripadvisor LLC. Tripadvisor realiza comprobaciones de las opiniones.",,,Leer más,0.0,,https://dynamic-media-cdn.tripadvisor.com/media/photo-o/1a/f6/e2/4a/default-avatar-2020-42.jpg?w=100&h=-1&s=1,
1776262860-9,https://www.tripadvisor.es/Restaurant_Review-g187514-d24982405-Reviews-Bosque_De_Piamonte-Madrid.html,La calidad de la comida es maravillosa,DANA G,"El lugar es muy limpio y acogedor y a pesar del calor que estamos pasando estos días en Madrid el lugar está muy ventilado y se está de maravilla. Los camareros son muy cuidadosos con el detalle muy amables y atentos. Pedimos dos menú del día, la cantidad es más que suficiente como para ir a dormir una buena siesta. En cuanto a la calidad-precio realmente nos ha sorprendido, la comida es exquisita y por supuesto se va a convertir en uno de mis lugares favoritos. 
Recomendable cien por cien la comida está muy bien elaborada, sin excesos de aceites y bastante saludable.",1 contribución,Escrita el 4 de julio de 2025,1,1 contribución,Calidad/precio,Ambiente,Servicio,Comida,,"Esta es la opinión subjetiva de un miembro de Tripadvisor, no de Tripadvisor LLC. Tripadvisor realiza comprobaciones de las opiniones.",,,,Leer más,0.0,,https://dynamic-media-cdn.tripadvisor.com/media/photo-o/1a/f6/f2/eb/default-avatar-2020-27.jpg?w=100&h=-1&s=1,
1776262860-10,https://www.tripadvisor.es/Restaurant_Review-g187514-d24982405-Reviews-Bosque_De_Piamonte-Madrid.html,Comida,alvaro p,Calor en el local. Algo de demora en servir los platos. Atención de los camareros muy buena. Calidad de la materia prima correcta.,20 contribuciones,Escrita el 28 de junio de 2025,20,"Madrid, España",,,,,,,"Esta es la opinión subjetiva de un miembro de Tripadvisor, no de Tripadvisor LLC. Tripadvisor realiza comprobaciones de las opiniones.",,,Leer más,0.0,,https://dynamic-media-cdn.tripadvisor.com/media/photo-o/17/31/b4/86/alvaro-p.jpg?w=100&h=-1&s=1,
1776262860-11,https://www.tripadvisor.es/Restaurant_Review-g187514-d24982405-Reviews-Bosque_De_Piamonte-Madrid.html,Agradable comida :),lou m,"Los camareros son encantadores, buena relación calidad-precio!! La comida sale rápido y tienen la cocina abierta todo el día",1 contribución,Escrita el 26 de junio de 2025,1,1 contribución,,,,,,,"Esta es la opinión subjetiva de un miembro de Tripadvisor, no de Tripadvisor LLC. Tripadvisor realiza comprobaciones de las opiniones.",,,Leer más,0.0,,https://dynamic-media-cdn.tripadvisor.com/media/photo-o/1a/f6/f2/7a/default-avatar-2020-25.jpg?w=100&h=-1&s=1,
