1779688299-8,https://www.tripadvisor.es/Restaurant_Review-g187514-d6404685-Reviews-Matilda-Madrid.html,Encantador,Olga G,"Me ha gustado mucho, la comida es casera, no es nada caro, el personal es muy amable y te informan perfectamente de cada plato y de lo que te puede gustar más.",17 contribuciones,17,Escrita el 4 de febrero de 2020,,"Madrid, España",,,,"Esta es la opinión subjetiva de un miembro de Tripadvisor, no de Tripadvisor LLC. Tripadvisor realiza comprobaciones de las opiniones.","Opinión obtenida en colaboración con este restaurante Este negocio utiliza herramientas facilitadas por Tripadvisor (o uno de sus socios oficiales de recopilación de opiniones) para animar a los huéspedes a que escriban opiniones y recopilarlas, incluida esta.",,0,Leer más,"Este negocio utiliza herramientas facilitadas por Tripadvisor (o uno de sus socios oficiales de recopilación de opiniones) para animar a los huéspedes a que escriban opiniones y recopilarlas, incluida esta.",https://dynamic-media-cdn.tripadvisor.com/media/photo-o/1a/f6/f2/59/default-avatar-2020-24.jpg?w=100&h=-1&s=1,,,,,,
1779688299-9,https://www.tripadvisor.es/Restaurant_Review-g187514-d6404685-Reviews-Matilda-Madrid.html,Desayuno,Javier B,"Lugar con encanto y muy buen trato por parte del personal. Cuentan con variedad de desayunos y tipos de café. El café muy bueno y variedad en tostadas y bollería. Muy agradable para ir y pasar un buen rato desayunando o, simplemente, tomando un buen café!",686 contribuciones,686,Escrita el 28 de enero de 2020,,"Logroño, España",Calidad/precio,Servicio,Comida,,,"Esta es la opinión subjetiva de un miembro de Tripadvisor, no de Tripadvisor LLC. Tripadvisor realiza comprobaciones de las opiniones.",0,Leer más,,https://dynamic-media-cdn.tripadvisor.com/media/photo-o/0b/73/92/fd/javier-b.jpg?w=100&h=-1&s=1,,,,,,
1779688299-10,https://www.tripadvisor.es/Restaurant_Review-g187514-d6404685-Reviews-Matilda-Madrid.html,Café encantador,Sophie,Personal muy amable y buena comida a buen precio. Hermosa ubicación y obras de arte. Menú para 3 platos y café por 12 €.,22 contribuciones,22,Escrita el 10 de enero de 2020,,22 contribuciones,,,,"Esta es la opinión subjetiva de un miembro de Tripadvisor, no de Tripadvisor LLC. Tripadvisor realiza comprobaciones de las opiniones.",,,0,Leer más,,https://dynamic-media-cdn.tripadvisor.com/media/photo-o/1a/f6/e5/2b/default-avatar-2020-52.jpg?w=100&h=-1&s=1,,,,,,
1779688299-11,https://www.tripadvisor.es/Restaurant_Review-g187514-d6404685-Reviews-Matilda-Madrid.html,Restaurante curioso o peculiar,Javier,"Sitio recomendable con ambiente familiar. Al ser pequeño es conveniente reservar antes. Es un local pequeño decorado con objetos antiguos. Es curiosa la vajilla que usan porque cada plato es diferente y parecen heredados de la abuela o comprados en el rastro. Tienen un menú del día económico que está bien. Yo comí tortilla de patata y pollo de corral, que estaba bueno. Diferentes tartas o bizcochos caseros de postre. Los camareros muy simpáticos y con un sentido del humor que te hacen la comida muy agradable. El sitio es demasiado pequeño y te hace estar un poco ""apretado"".",1 contribución,1,Escrita el 5 de enero de 2020,,"Palencia, España",Calidad/precio,Servicio,Comida,,"Opinión obtenida en colaboración con este restaurante Este negocio utiliza herramientas facilitadas por Tripadvisor (o uno de sus socios oficiales de recopilación de opiniones) para animar a los huéspedes a que escriban opiniones y recopilarlas, incluida esta.","Esta es la opinión subjetiva de un miembro de Tripadvisor, no de Tripadvisor LLC. Tripadvisor realiza comprobaciones de las opiniones.",0,Leer más,"Este negocio utiliza herramientas facilitadas por Tripadvisor (o uno de sus socios oficiales de recopilación de opiniones) para animar a los huéspedes a que escriban opiniones y recopilarlas, incluida esta.",https://dynamic-media-cdn.tripadvisor.com/media/photo-o/1a/f6/f2/b8/default-avatar-2020-26.jpg?w=100&h=-1&s=1,,,,,,
1779688299-12,https://www.tripadvisor.es/Restaurant_Review-g187514-d6404685-Reviews-Matilda-Madrid.html,Familiar y encantador,Carmenpam,"Un sitio para recomendar, tanto para tomar café, como para comer un menú del día a buen precio, con cocina de toda la vida con toque especial. Postres caseros. Pequeño con detalles como exposición de pinturas que venden y otros encantos, como sus dueños. Muy agradable.",14 contribuciones,14,Escrita el 3 de enero de 2020,,14 contribuciones,,,,"Esta es la opinión subjetiva de un miembro de Tripadvisor, no de Tripadvisor LLC. Tripadvisor realiza comprobaciones de las opiniones.","Opinión obtenida en colaboración con este restaurante Este negocio utiliza herramientas facilitadas por Tripadvisor (o uno de sus socios oficiales de recopilación de opiniones) para animar a los huéspedes a que escriban opiniones y recopilarlas, incluida esta.",,0,Leer más,"Este negocio utiliza herramientas facilitadas por Tripadvisor (o uno de sus socios oficiales de recopilación de opiniones) para animar a los huéspedes a que escriban opiniones y recopilarlas, incluida esta.",https://dynamic-media-cdn.tripadvisor.com/media/photo-o/1a/f6/ec/3d/default-avatar-2020-1.jpg?w=100&h=-1&s=1,,,,,,
1779688299-13,https://www.tripadvisor.es/Restaurant_Review-g187514-d6404685-Reviews-Matilda-Madrid.html,Comida,Raul,Muy bueno. Personal muy simpático. Servicio rápido y local muy bonito. Menú variado y buena relacion calidad precio.,3 contribuciones,3,Escrita el 3 de enero de 2020,,3 contribuciones,,,,"Esta es la opinión subjetiva de un miembro de Tripadvisor, no de Tripadvisor LLC. Tripadvisor realiza comprobaciones de las opiniones.","Opinión obtenida en colaboración con este restaurante Este negocio utiliza herramientas facilitadas por Tripadvisor (o uno de sus socios oficiales de recopilación de opiniones) para animar a los huéspedes a que escriban opiniones y recopilarlas, incluida esta.",,0,Leer más,"Este negocio utiliza herramientas facilitadas por Tripadvisor (o uno de sus socios oficiales de recopilación de opiniones) para animar a los huéspedes a que escriban opiniones y recopilarlas, incluida esta.",https://dynamic-media-cdn.tripadvisor.com/media/photo-o/1a/f6/e2/a7/default-avatar-2020-44.jpg?w=100&h=-1&s=1,,,,,,
1779688299-14,https://www.tripadvisor.es/Restaurant_Review-g187514-d6404685-Reviews-Matilda-Madrid.html,AMBIENTE Y PERSONAL ENCANTADORES,Tony_Trives,"Si el ambiente y decoración del local no es suficiente para atraparte, el trato de Álex y Fernando terminará por hacerlo. Son dos personas encantadoras que dan un excelente trato a los clientes.
Nosotros fuimos tanto a desayunar como a comer.
Ideal para un buen desayuno. El zumo de naranja es 100 % natural y tienen varias tartas caseras a cuál mejor. De salado no probamos nada.
Para comer tienen un menú que consta de tres primeros y tres segundos a elegir, una bebida, postre y café. No son platos excesivamente complicados pero están muy buenos y con ingredientes de calidad. Si vas a comer, imprescindible reservar.
Para nosotros va a ser un fijo en nuestras escapadas a Madrid.",19 contribuciones,19,Escrita el 31 de diciembre de 2019,,"Alicante, España",,,,"Esta es la opinión subjetiva de un miembro de Tripadvisor, no de Tripadvisor LLC. Tripadvisor realiza comprobaciones de las opiniones.","Opinión obtenida en colaboración con este restaurante Este negocio utiliza herramientas facilitadas por Tripadvisor (o uno de sus socios oficiales de recopilación de opiniones) para animar a los huéspedes a que escriban opiniones y recopilarlas, incluida esta.",,0,Leer más,"Este negocio utiliza herramientas facilitadas por Tripadvisor (o uno de sus socios oficiales de recopilación de opiniones) para animar a los huéspedes a que escriban opiniones y recopilarlas, incluida esta.",https://dynamic-media-cdn.tripadvisor.com/media/photo-o/1a/f6/f2/59/default-avatar-2020-24.jpg?w=100&h=-1&s=1,,,,,,
1779688299-15,https://www.tripadvisor.es/Restaurant_Review-g187514-d6404685-Reviews-Matilda-Madrid.html,AMBIENTE Y PERSONAL ENCANTADORES,Tony,"El sitio es pequeñito pero tiene mucho encanto. Además, si el local no te ha conquistado a primera vista, Álex y Fernando acabarán por lograrlo. El trato que ofrecen es extraordinario, haciéndote sentir como en casa, como un cliente de toda la vida.
Ideal para un buen desayuno y en cuanto a la comida, el menú consta de tres primeros, tres segundos, bebida, postre y café. No tiene grandes complicaciones pero la comida es casera y de calidad. Imprescindible reservar.
Para nosotros se va a convertir en un fijo en nuestras visitas a Madrid.",3 contribuciones,3,Escrita el 31 de diciembre de 2019,,3 contribuciones,Calidad/precio,Servicio,Comida,,"Opinión obtenida en colaboración con este restaurante Este negocio utiliza herramientas facilitadas por Tripadvisor (o uno de sus socios oficiales de recopilación de opiniones) para animar a los huéspedes a que escriban opiniones y recopilarlas, incluida esta.","Esta es la opinión subjetiva de un miembro de Tripadvisor, no de Tripadvisor LLC. Tripadvisor realiza comprobaciones de las opiniones.",0,Leer más,"Este negocio utiliza herramientas facilitadas por Tripadvisor (o uno de sus socios oficiales de recopilación de opiniones) para animar a los huéspedes a que escriban opiniones y recopilarlas, incluida esta.",https://dynamic-media-cdn.tripadvisor.com/media/photo-o/1a/f6/f0/48/default-avatar-2020-15.jpg?w=100&h=-1&s=1,,,,,,
